[I 2024-12-04 20:10:46,569] Trial 1113 finished with value: 0.3236326678212457 and parameters: {'n_estimators': 317, 'max_depth': 50, 'min_samples_split': 2, 'min_samples_leaf': 1, 'max_features': 'sqrt', 'bootstrap': False, 'criterion': 'squared_error'}. Best is trial 874 with value: 0.32176430753353746.
[I 2024-12-04 20:10:46,836] Trial 1114 finished with value: 0.6655836006331141 and parameters: {'n_estimators': 253, 'max_depth': 50, 'min_samples_split': 2, 'min_samples_leaf': 2, 'max_features': 'sqrt', 'bootstrap': False, 'criterion': 'squared_error'}. Best is trial 874 with value: 0.32176430753353746.
[I 2024-12-04 20:10:46,840] Trial 1091 finished with value: 0.5340442393835518 and parameters: {'n_estimators': 297, 'max_depth': 49, 'min_samples_split': 5, 'min_samples_leaf': 2, 'max_features': None, 'bootstrap': False, 'criterion': 'absolute_error'}. Best is trial 874 with value: 0.32176430753353746.
[I 2024-12-04 20:10:48,391] Trial 1115 finished with value: 0.3872263953738129 and parameters: {'n_estimators': 270, 'max_depth': 49, 'min_samples_split': 4, 'min_samples_leaf': 1, 'max_features': 'sqrt', 'bootstrap': False, 'criterion': 'squared_error'}. Best is trial 874 with value: 0.32176430753353746.
[I 2024-12-04 20:10:48,782] Trial 1116 finished with value: 0.35652637950502397 and parameters: {'n_estimators': 265, 'max_depth': 50, 'min_samples_split': 3, 'min_samples_leaf': 1, 'max_features': 'sqrt', 'bootstrap': False, 'criterion': 'squared_error'}. Best is trial 874 with value: 0.32176430753353746.
[I 2024-12-04 20:10:49,268] Trial 1117 finished with value: 0.3867216739802706 and parameters: {'n_estimators': 402, 'max_depth': 50, 'min_samples_split': 4, 'min_samples_leaf': 1, 'max_features': 'sqrt', 'bootstrap': False, 'criterion': 'squared_error'}. Best is trial 874 with value: 0.32176430753353746.
[I 2024-12-04 20:10:50,717] Trial 1118 finished with value: 0.3227436309075193 and parameters: {'n_estimators': 350, 'max_depth': 50, 'min_samples_split': 2, 'min_samples_leaf': 1, 'max_features': 'sqrt', 'bootstrap': False, 'criterion': 'squared_error'}. Best is trial 874 with value: 0.32176430753353746.
[I 2024-12-04 20:10:50,785] Trial 1119 finished with value: 0.3435943509421867 and parameters: {'n_estimators': 301, 'max_depth': 43, 'min_samples_split': 2, 'min_samples_leaf': 1, 'max_features': 'sqrt', 'bootstrap': False, 'criterion': 'squared_error'}. Best is trial 874 with value: 0.32176430753353746.
[I 2024-12-04 20:10:52,324] Trial 1120 finished with value: 0.3273894319395989 and parameters: {'n_estimators': 523, 'max_depth': 50, 'min_samples_split': 2, 'min_samples_leaf': 1, 'max_features': 'sqrt', 'bootstrap': False, 'criterion': 'squared_error'}. Best is trial 874 with value: 0.32176430753353746.
[I 2024-12-04 20:10:53,126] Trial 1122 finished with value: 0.40011298470032114 and parameters: {'n_estimators': 432, 'max_depth': 43, 'min_samples_split': 3, 'min_samples_leaf': 1, 'max_features': 'sqrt', 'bootstrap': False, 'criterion': 'squared_error'}. Best is trial 874 with value: 0.32176430753353746.
[I 2024-12-04 20:10:53,331] Trial 1121 finished with value: 0.3226231527741188 and parameters: {'n_estimators': 407, 'max_depth': 50, 'min_samples_split': 2, 'min_samples_leaf': 1, 'max_features': 'sqrt', 'bootstrap': False, 'criterion': 'squared_error'}. Best is trial 874 with value: 0.32176430753353746.
[I 2024-12-04 20:10:54,532] Trial 1125 finished with value: 1.3311131982819426 and parameters: {'n_estimators': 155, 'max_depth': 10, 'min_samples_split': 16, 'min_samples_leaf': 5, 'max_features': 'log2', 'bootstrap': True, 'criterion': 'absolute_error'}. Best is trial 874 with value: 0.32176430753353746.
[I 2024-12-04 20:10:54,536] Trial 1123 finished with value: 0.6772768212864366 and parameters: {'n_estimators': 584, 'max_depth': 44, 'min_samples_split': 2, 'min_samples_leaf': 2, 'max_features': 'sqrt', 'bootstrap': False, 'criterion': 'squared_error'}. Best is trial 874 with value: 0.32176430753353746.
[I 2024-12-04 20:10:55,169] Trial 1124 finished with value: 0.6842272441400097 and parameters: {'n_estimators': 422, 'max_depth': 50, 'min_samples_split': 2, 'min_samples_leaf': 2, 'max_features': 'sqrt', 'bootstrap': False, 'criterion': 'squared_error'}. Best is trial 874 with value: 0.32176430753353746.
[I 2024-12-04 20:10:57,049] Trial 1126 finished with value: 1.334795796476334 and parameters: {'n_estimators': 798, 'max_depth': 13, 'min_samples_split': 15, 'min_samples_leaf': 7, 'max_features': 'log2', 'bootstrap': True, 'criterion': 'absolute_error'}. Best is trial 874 with value: 0.32176430753353746.
[I 2024-12-04 20:10:57,799] Trial 1127 finished with value: 0.32814906184384507 and parameters: {'n_estimators': 441, 'max_depth': 50, 'min_samples_split': 2, 'min_samples_leaf': 1, 'max_features': 'sqrt', 'bootstrap': False, 'criterion': 'squared_error'}. Best is trial 874 with value: 0.32176430753353746.
[I 2024-12-04 20:10:58,063] Trial 1128 finished with value: 0.4031434651029353 and parameters: {'n_estimators': 516, 'max_depth': 43, 'min_samples_split': 3, 'min_samples_leaf': 1, 'max_features': 'sqrt', 'bootstrap': False, 'criterion': 'squared_error'}. Best is trial 874 with value: 0.32176430753353746.
[I 2024-12-04 20:10:59,083] Trial 1129 finished with value: 0.791627144278763 and parameters: {'n_estimators': 373, 'max_depth': 49, 'min_samples_split': 2, 'min_samples_leaf': 2, 'max_features': 'sqrt', 'bootstrap': True, 'criterion': 'squared_error'}. Best is trial 874 with value: 0.32176430753353746.
[I 2024-12-04 20:11:00,932] Trial 1132 finished with value: 0.4357151124492902 and parameters: {'n_estimators': 140, 'max_depth': 45, 'min_samples_split': 2, 'min_samples_leaf': 1, 'max_features': None, 'bootstrap': False, 'criterion': 'squared_error'}. Best is trial 874 with value: 0.32176430753353746.
[I 2024-12-04 20:11:01,176] Trial 1131 finished with value: 0.32802781230607847 and parameters: {'n_estimators': 565, 'max_depth': 50, 'min_samples_split': 2, 'min_samples_leaf': 1, 'max_features': 'sqrt', 'bootstrap': False, 'criterion': 'squared_error'}. Best is trial 874 with value: 0.32176430753353746.
[I 2024-12-04 20:11:02,275] Trial 1134 finished with value: 0.6646123166594711 and parameters: {'n_estimators': 245, 'max_depth': 50, 'min_samples_split': 3, 'min_samples_leaf': 2, 'max_features': 'sqrt', 'bootstrap': False, 'criterion': 'squared_error'}. Best is trial 874 with value: 0.32176430753353746.
[I 2024-12-04 20:11:03,836] Trial 1133 finished with value: 0.4994611603793548 and parameters: {'n_estimators': 104, 'max_depth': 34, 'min_samples_split': 4, 'min_samples_leaf': 1, 'max_features': 'sqrt', 'bootstrap': False, 'criterion': 'absolute_error'}. Best is trial 874 with value: 0.32176430753353746.
[I 2024-12-04 20:11:03,839] Trial 1135 finished with value: 0.3589665318867479 and parameters: {'n_estimators': 360, 'max_depth': 50, 'min_samples_split': 3, 'min_samples_leaf': 1, 'max_features': 'sqrt', 'bootstrap': False, 'criterion': 'squared_error'}. Best is trial 874 with value: 0.32176430753353746.
[I 2024-12-04 20:11:05,120] Trial 1130 finished with value: 1.2004159724261454 and parameters: {'n_estimators': 961, 'max_depth': 30, 'min_samples_split': 8, 'min_samples_leaf': 2, 'max_features': 'log2', 'bootstrap': False, 'criterion': 'absolute_error'}. Best is trial 874 with value: 0.32176430753353746.
[I 2024-12-04 20:11:05,675] Trial 1137 finished with value: 0.3575901925528144 and parameters: {'n_estimators': 255, 'max_depth': 50, 'min_samples_split': 3, 'min_samples_leaf': 1, 'max_features': 'sqrt', 'bootstrap': False, 'criterion': 'squared_error'}. Best is trial 874 with value: 0.32176430753353746.
[I 2024-12-04 20:11:06,304] Trial 1136 finished with value: 0.3227436309075193 and parameters: {'n_estimators': 350, 'max_depth': 50, 'min_samples_split': 2, 'min_samples_leaf': 1, 'max_features': 'sqrt', 'bootstrap': False, 'criterion': 'squared_error'}. Best is trial 874 with value: 0.32176430753353746.
[I 2024-12-04 20:11:07,402] Trial 1138 finished with value: 0.34574295654400206 and parameters: {'n_estimators': 345, 'max_depth': 43, 'min_samples_split': 2, 'min_samples_leaf': 1, 'max_features': 'sqrt', 'bootstrap': False, 'criterion': 'squared_error'}. Best is trial 874 with value: 0.32176430753353746.
[I 2024-12-04 20:11:07,673] Trial 1140 finished with value: 1.327813228202017 and parameters: {'n_estimators': 285, 'max_depth': 11, 'min_samples_split': 5, 'min_samples_leaf': 7, 'max_features': 'log2', 'bootstrap': False, 'criterion': 'absolute_error'}. Best is trial 874 with value: 0.32176430753353746.
[I 2024-12-04 20:11:08,746] Trial 1139 finished with value: 1.2657499416257398 and parameters: {'n_estimators': 540, 'max_depth': 41, 'min_samples_split': 29, 'min_samples_leaf': 2, 'max_features': 'log2', 'bootstrap': True, 'criterion': 'absolute_error'}. Best is trial 874 with value: 0.32176430753353746.
[I 2024-12-04 20:11:09,290] Trial 1142 finished with value: 0.3274911617310422 and parameters: {'n_estimators': 175, 'max_depth': 50, 'min_samples_split': 2, 'min_samples_leaf': 1, 'max_features': 'sqrt', 'bootstrap': False, 'criterion': 'squared_error'}. Best is trial 874 with value: 0.32176430753353746.
[I 2024-12-04 20:11:09,380] Trial 1141 finished with value: 0.38753846418393945 and parameters: {'n_estimators': 417, 'max_depth': 50, 'min_samples_split': 4, 'min_samples_leaf': 1, 'max_features': 'sqrt', 'bootstrap': False, 'criterion': 'squared_error'}. Best is trial 874 with value: 0.32176430753353746.
[I 2024-12-04 20:11:11,341] Trial 1143 finished with value: 0.32814906184384507 and parameters: {'n_estimators': 441, 'max_depth': 50, 'min_samples_split': 2, 'min_samples_leaf': 1, 'max_features': 'sqrt', 'bootstrap': False, 'criterion': 'squared_error'}. Best is trial 874 with value: 0.32176430753353746.
[I 2024-12-04 20:11:11,606] Trial 1145 finished with value: 0.3252594167164361 and parameters: {'n_estimators': 303, 'max_depth': 50, 'min_samples_split': 2, 'min_samples_leaf': 1, 'max_features': 'sqrt', 'bootstrap': False, 'criterion': 'squared_error'}. Best is trial 874 with value: 0.32176430753353746.
[I 2024-12-04 20:11:11,716] Trial 1144 finished with value: 0.32284208788093754 and parameters: {'n_estimators': 352, 'max_depth': 50, 'min_samples_split': 2, 'min_samples_leaf': 1, 'max_features': 'sqrt', 'bootstrap': False, 'criterion': 'squared_error'}. Best is trial 874 with value: 0.32176430753353746.
[I 2024-12-04 20:11:13,130] Trial 1146 finished with value: 0.6569260139017354 and parameters: {'n_estimators': 285, 'max_depth': 50, 'min_samples_split': 2, 'min_samples_leaf': 2, 'max_features': 'sqrt', 'bootstrap': False, 'criterion': 'squared_error'}. Best is trial 874 with value: 0.32176430753353746.
[I 2024-12-04 20:11:13,912] Trial 1148 finished with value: 0.9679667529917447 and parameters: {'n_estimators': 728, 'max_depth': 36, 'min_samples_split': 39, 'min_samples_leaf': 3, 'max_features': 'sqrt', 'bootstrap': True, 'criterion': 'squared_error'}. Best is trial 874 with value: 0.32176430753353746.
[I 2024-12-04 20:11:14,768] Trial 1149 finished with value: 0.3420485803669957 and parameters: {'n_estimators': 221, 'max_depth': 43, 'min_samples_split': 2, 'min_samples_leaf': 1, 'max_features': 'sqrt', 'bootstrap': False, 'criterion': 'squared_error'}. Best is trial 874 with value: 0.32176430753353746.
[I 2024-12-04 20:11:15,301] Trial 1150 finished with value: 0.6834565116734341 and parameters: {'n_estimators': 372, 'max_depth': 42, 'min_samples_split': 3, 'min_samples_leaf': 2, 'max_features': 'sqrt', 'bootstrap': False, 'criterion': 'squared_error'}. Best is trial 874 with value: 0.32176430753353746.
[I 2024-12-04 20:11:16,846] Trial 1151 finished with value: 1.2641345163122748 and parameters: {'n_estimators': 878, 'max_depth': 13, 'min_samples_split': 5, 'min_samples_leaf': 6, 'max_features': 'log2', 'bootstrap': True, 'criterion': 'squared_error'}. Best is trial 874 with value: 0.32176430753353746.
[I 2024-12-04 20:11:18,523] Trial 1153 finished with value: 0.3452218439703514 and parameters: {'n_estimators': 296, 'max_depth': 42, 'min_samples_split': 2, 'min_samples_leaf': 1, 'max_features': 'sqrt', 'bootstrap': False, 'criterion': 'squared_error'}. Best is trial 874 with value: 0.32176430753353746.
[I 2024-12-04 20:11:22,697] Trial 1154 finished with value: 1.2928370148417017 and parameters: {'n_estimators': 808, 'max_depth': 5, 'min_samples_split': 20, 'min_samples_leaf': 1, 'max_features': 'log2', 'bootstrap': False, 'criterion': 'absolute_error'}. Best is trial 874 with value: 0.32176430753353746.
[I 2024-12-04 20:11:23,088] Trial 1152 finished with value: 0.7626558395219595 and parameters: {'n_estimators': 833, 'max_depth': 28, 'min_samples_split': 24, 'min_samples_leaf': 13, 'max_features': None, 'bootstrap': True, 'criterion': 'absolute_error'}. Best is trial 874 with value: 0.32176430753353746.
[I 2024-12-04 20:11:24,917] Trial 1155 finished with value: 0.34889324443665537 and parameters: {'n_estimators': 391, 'max_depth': 43, 'min_samples_split': 2, 'min_samples_leaf': 1, 'max_features': 'sqrt', 'bootstrap': False, 'criterion': 'squared_error'}. Best is trial 874 with value: 0.32176430753353746.
[I 2024-12-04 20:11:26,712] Trial 1157 finished with value: 0.32348956166805265 and parameters: {'n_estimators': 322, 'max_depth': 50, 'min_samples_split': 2, 'min_samples_leaf': 1, 'max_features': 'sqrt', 'bootstrap': False, 'criterion': 'squared_error'}. Best is trial 874 with value: 0.32176430753353746.
[I 2024-12-04 20:11:28,136] Trial 1156 finished with value: 0.8478711872351247 and parameters: {'n_estimators': 249, 'max_depth': 17, 'min_samples_split': 4, 'min_samples_leaf': 1, 'max_features': 'sqrt', 'bootstrap': False, 'criterion': 'absolute_error'}. Best is trial 874 with value: 0.32176430753353746.
[I 2024-12-04 20:11:28,971] Trial 1147 finished with value: 0.5051055041092026 and parameters: {'n_estimators': 287, 'max_depth': 9, 'min_samples_split': 14, 'min_samples_leaf': 1, 'max_features': None, 'bootstrap': True, 'criterion': 'absolute_error'}. Best is trial 874 with value: 0.32176430753353746.
[I 2024-12-04 20:11:29,764] Trial 1159 finished with value: 0.403581639945086 and parameters: {'n_estimators': 144, 'max_depth': 42, 'min_samples_split': 3, 'min_samples_leaf': 1, 'max_features': 'sqrt', 'bootstrap': False, 'criterion': 'squared_error'}. Best is trial 874 with value: 0.32176430753353746.
[I 2024-12-04 20:11:30,741] Trial 1160 finished with value: 0.3847954866044127 and parameters: {'n_estimators': 332, 'max_depth': 50, 'min_samples_split': 4, 'min_samples_leaf': 1, 'max_features': 'sqrt', 'bootstrap': False, 'criterion': 'squared_error'}. Best is trial 874 with value: 0.32176430753353746.
[I 2024-12-04 20:11:31,281] Trial 1158 finished with value: 0.5534088532626046 and parameters: {'n_estimators': 266, 'max_depth': 42, 'min_samples_split': 4, 'min_samples_leaf': 1, 'max_features': 'sqrt', 'bootstrap': True, 'criterion': 'absolute_error'}. Best is trial 874 with value: 0.32176430753353746.
[I 2024-12-04 20:11:32,097] Trial 1161 finished with value: 0.3223327925900426 and parameters: {'n_estimators': 343, 'max_depth': 50, 'min_samples_split': 2, 'min_samples_leaf': 1, 'max_features': 'sqrt', 'bootstrap': False, 'criterion': 'squared_error'}. Best is trial 874 with value: 0.32176430753353746.
[I 2024-12-04 20:11:32,351] Trial 1162 finished with value: 0.690298542349648 and parameters: {'n_estimators': 433, 'max_depth': 42, 'min_samples_split': 2, 'min_samples_leaf': 2, 'max_features': 'sqrt', 'bootstrap': False, 'criterion': 'squared_error'}. Best is trial 874 with value: 0.32176430753353746.
[I 2024-12-04 20:11:33,022] Trial 1163 finished with value: 0.38607905184007135 and parameters: {'n_estimators': 238, 'max_depth': 49, 'min_samples_split': 4, 'min_samples_leaf': 1, 'max_features': 'sqrt', 'bootstrap': False, 'criterion': 'squared_error'}. Best is trial 874 with value: 0.32176430753353746.
[I 2024-12-04 20:11:33,596] Trial 1165 finished with value: 0.43189284293082636 and parameters: {'n_estimators': 108, 'max_depth': 42, 'min_samples_split': 4, 'min_samples_leaf': 1, 'max_features': 'sqrt', 'bootstrap': False, 'criterion': 'squared_error'}. Best is trial 874 with value: 0.32176430753353746.
[I 2024-12-04 20:11:34,106] Trial 1164 finished with value: 0.34274173051854434 and parameters: {'n_estimators': 293, 'max_depth': 43, 'min_samples_split': 2, 'min_samples_leaf': 1, 'max_features': 'sqrt', 'bootstrap': False, 'criterion': 'squared_error'}. Best is trial 874 with value: 0.32176430753353746.
[I 2024-12-04 20:11:35,188] Trial 1167 finished with value: 0.627023364768984 and parameters: {'n_estimators': 328, 'max_depth': 42, 'min_samples_split': 4, 'min_samples_leaf': 1, 'max_features': 'log2', 'bootstrap': False, 'criterion': 'squared_error'}. Best is trial 874 with value: 0.32176430753353746.
[I 2024-12-04 20:11:36,027] Trial 1169 finished with value: 0.6177037859795873 and parameters: {'n_estimators': 102, 'max_depth': 50, 'min_samples_split': 4, 'min_samples_leaf': 2, 'max_features': 'sqrt', 'bootstrap': False, 'criterion': 'squared_error'}. Best is trial 874 with value: 0.32176430753353746.
[I 2024-12-04 20:11:37,821] Trial 1170 finished with value: 0.3235816647186971 and parameters: {'n_estimators': 329, 'max_depth': 50, 'min_samples_split': 2, 'min_samples_leaf': 1, 'max_features': 'sqrt', 'bootstrap': False, 'criterion': 'squared_error'}. Best is trial 874 with value: 0.32176430753353746.
[I 2024-12-04 20:11:39,137] Trial 1171 finished with value: 0.6919963141207112 and parameters: {'n_estimators': 450, 'max_depth': 50, 'min_samples_split': 4, 'min_samples_leaf': 2, 'max_features': 'sqrt', 'bootstrap': False, 'criterion': 'squared_error'}. Best is trial 874 with value: 0.32176430753353746.
[I 2024-12-04 20:11:40,869] Trial 1172 finished with value: 0.3242220679354728 and parameters: {'n_estimators': 306, 'max_depth': 50, 'min_samples_split': 2, 'min_samples_leaf': 1, 'max_features': 'sqrt', 'bootstrap': False, 'criterion': 'squared_error'}. Best is trial 874 with value: 0.32176430753353746.
[I 2024-12-04 20:11:41,883] Trial 1173 finished with value: 0.6719511710857113 and parameters: {'n_estimators': 221, 'max_depth': 41, 'min_samples_split': 2, 'min_samples_leaf': 2, 'max_features': 'sqrt', 'bootstrap': False, 'criterion': 'squared_error'}. Best is trial 874 with value: 0.32176430753353746.
[I 2024-12-04 20:11:42,737] Trial 1168 finished with value: 0.6388330044448388 and parameters: {'n_estimators': 457, 'max_depth': 49, 'min_samples_split': 5, 'min_samples_leaf': 1, 'max_features': 'log2', 'bootstrap': False, 'criterion': 'absolute_error'}. Best is trial 874 with value: 0.32176430753353746.
[I 2024-12-04 20:11:43,786] Trial 1174 finished with value: 0.3235478435313454 and parameters: {'n_estimators': 259, 'max_depth': 50, 'min_samples_split': 2, 'min_samples_leaf': 1, 'max_features': 'sqrt', 'bootstrap': False, 'criterion': 'squared_error'}. Best is trial 874 with value: 0.32176430753353746.
[I 2024-12-04 20:11:43,854] Trial 1175 finished with value: 0.33536211839816593 and parameters: {'n_estimators': 132, 'max_depth': 50, 'min_samples_split': 2, 'min_samples_leaf': 1, 'max_features': 'sqrt', 'bootstrap': False, 'criterion': 'squared_error'}. Best is trial 874 with value: 0.32176430753353746.
[I 2024-12-04 20:11:46,092] Trial 1177 finished with value: 0.6321910658122256 and parameters: {'n_estimators': 414, 'max_depth': 49, 'min_samples_split': 48, 'min_samples_leaf': 1, 'max_features': None, 'bootstrap': True, 'criterion': 'squared_error'}. Best is trial 874 with value: 0.32176430753353746.
[I 2024-12-04 20:11:47,311] Trial 1178 finished with value: 0.38813533008591394 and parameters: {'n_estimators': 230, 'max_depth': 50, 'min_samples_split': 4, 'min_samples_leaf': 1, 'max_features': 'sqrt', 'bootstrap': False, 'criterion': 'squared_error'}. Best is trial 874 with value: 0.32176430753353746.
[I 2024-12-04 20:11:48,762] Trial 1179 finished with value: 0.685057329889317 and parameters: {'n_estimators': 528, 'max_depth': 49, 'min_samples_split': 3, 'min_samples_leaf': 2, 'max_features': 'sqrt', 'bootstrap': False, 'criterion': 'squared_error'}. Best is trial 874 with value: 0.32176430753353746.
[I 2024-12-04 20:11:50,022] Trial 1180 finished with value: 0.6727381842170259 and parameters: {'n_estimators': 369, 'max_depth': 50, 'min_samples_split': 2, 'min_samples_leaf': 2, 'max_features': 'sqrt', 'bootstrap': False, 'criterion': 'squared_error'}. Best is trial 874 with value: 0.32176430753353746.
[I 2024-12-04 20:11:50,827] Trial 1176 finished with value: 0.8499148051838633 and parameters: {'n_estimators': 472, 'max_depth': 43, 'min_samples_split': 43, 'min_samples_leaf': 1, 'max_features': 'sqrt', 'bootstrap': True, 'criterion': 'absolute_error'}. Best is trial 874 with value: 0.32176430753353746.
[I 2024-12-04 20:11:52,852] Trial 1181 finished with value: 0.5200998179565056 and parameters: {'n_estimators': 545, 'max_depth': 27, 'min_samples_split': 6, 'min_samples_leaf': 5, 'max_features': None, 'bootstrap': True, 'criterion': 'squared_error'}. Best is trial 874 with value: 0.32176430753353746.
[I 2024-12-04 20:11:54,328] Trial 1183 finished with value: 0.6835631412280452 and parameters: {'n_estimators': 530, 'max_depth': 50, 'min_samples_split': 2, 'min_samples_leaf': 2, 'max_features': 'sqrt', 'bootstrap': False, 'criterion': 'squared_error'}. Best is trial 874 with value: 0.32176430753353746.
[I 2024-12-04 20:11:55,628] Trial 1182 finished with value: 0.6227169775471447 and parameters: {'n_estimators': 976, 'max_depth': 18, 'min_samples_split': 33, 'min_samples_leaf': 4, 'max_features': None, 'bootstrap': False, 'criterion': 'squared_error'}. Best is trial 874 with value: 0.32176430753353746.
