[I 2024-12-04 11:52:46,460] Trial 238 finished with value: 1.3400153874729748 and parameters: {'max_depth': 30, 'min_samples_split': 2, 'min_samples_leaf': 10, 'max_features': 'sqrt', 'criterion': 'absolute_error', 'splitter': 'best'}. Best is trial 160 with value: 0.5065208369659612.
[I 2024-12-04 11:52:46,732] Trial 235 finished with value: 1.3617773369400628 and parameters: {'max_depth': 1, 'min_samples_split': 9, 'min_samples_leaf': 1, 'max_features': 'sqrt', 'criterion': 'absolute_error', 'splitter': 'random'}. Best is trial 160 with value: 0.5065208369659612.
[I 2024-12-04 11:52:46,798] Trial 247 finished with value: 0.6088565093492886 and parameters: {'max_depth': 34, 'min_samples_split': 3, 'min_samples_leaf': 1, 'max_features': 'log2', 'criterion': 'absolute_error', 'splitter': 'best'}. Best is trial 160 with value: 0.5065208369659612.
[I 2024-12-04 11:52:47,036] Trial 232 finished with value: 1.009355341748503 and parameters: {'max_depth': 34, 'min_samples_split': 2, 'min_samples_leaf': 2, 'max_features': 'log2', 'criterion': 'absolute_error', 'splitter': 'best'}. Best is trial 160 with value: 0.5065208369659612.
[I 2024-12-04 11:52:47,103] Trial 241 finished with value: 0.5365713065858015 and parameters: {'max_depth': 35, 'min_samples_split': 2, 'min_samples_leaf': 1, 'max_features': 'log2', 'criterion': 'absolute_error', 'splitter': 'best'}. Best is trial 160 with value: 0.5065208369659612.
[I 2024-12-04 11:52:47,165] Trial 230 finished with value: 1.009355341748503 and parameters: {'max_depth': 34, 'min_samples_split': 2, 'min_samples_leaf': 2, 'max_features': 'log2', 'criterion': 'absolute_error', 'splitter': 'best'}. Best is trial 160 with value: 0.5065208369659612.
[I 2024-12-04 11:52:47,281] Trial 243 finished with value: 1.3014693347727373 and parameters: {'max_depth': 16, 'min_samples_split': 19, 'min_samples_leaf': 9, 'max_features': 'log2', 'criterion': 'squared_error', 'splitter': 'random'}. Best is trial 160 with value: 0.5065208369659612.
[I 2024-12-04 11:52:47,283] Trial 228 finished with value: 0.5066822665811462 and parameters: {'max_depth': 35, 'min_samples_split': 3, 'min_samples_leaf': 1, 'max_features': 'log2', 'criterion': 'absolute_error', 'splitter': 'best'}. Best is trial 160 with value: 0.5065208369659612.
[I 2024-12-04 11:52:47,396] Trial 231 finished with value: 0.5346482740235124 and parameters: {'max_depth': 34, 'min_samples_split': 2, 'min_samples_leaf': 1, 'max_features': 'log2', 'criterion': 'squared_error', 'splitter': 'best'}. Best is trial 160 with value: 0.5065208369659612.
[I 2024-12-04 11:52:48,205] Trial 216 finished with value: 0.5845523283856866 and parameters: {'max_depth': 31, 'min_samples_split': 2, 'min_samples_leaf': 1, 'max_features': 'log2', 'criterion': 'friedman_mse', 'splitter': 'best'}. Best is trial 160 with value: 0.5065208369659612.
[I 2024-12-04 11:52:48,430] Trial 236 finished with value: 0.6254326371381861 and parameters: {'max_depth': 35, 'min_samples_split': 8, 'min_samples_leaf': 1, 'max_features': 'log2', 'criterion': 'absolute_error', 'splitter': 'best'}. Best is trial 160 with value: 0.5065208369659612.
[I 2024-12-04 11:52:48,589] Trial 245 finished with value: 0.7414768836782462 and parameters: {'max_depth': 35, 'min_samples_split': 5, 'min_samples_leaf': 1, 'max_features': 'log2', 'criterion': 'absolute_error', 'splitter': 'best'}. Best is trial 160 with value: 0.5065208369659612.
[I 2024-12-04 11:52:49,173] Trial 249 finished with value: 0.7177525863158705 and parameters: {'max_depth': 34, 'min_samples_split': 2, 'min_samples_leaf': 2, 'max_features': 'log2', 'criterion': 'squared_error', 'splitter': 'best'}. Best is trial 160 with value: 0.5065208369659612.
[I 2024-12-04 11:52:49,545] Trial 237 finished with value: 0.565171694227249 and parameters: {'max_depth': 31, 'min_samples_split': 3, 'min_samples_leaf': 1, 'max_features': 'log2', 'criterion': 'absolute_error', 'splitter': 'best'}. Best is trial 160 with value: 0.5065208369659612.
[I 2024-12-04 11:52:50,062] Trial 251 finished with value: 0.5729089406692737 and parameters: {'max_depth': 34, 'min_samples_split': 3, 'min_samples_leaf': 1, 'max_features': 'log2', 'criterion': 'squared_error', 'splitter': 'best'}. Best is trial 160 with value: 0.5065208369659612.
[I 2024-12-04 11:52:50,297] Trial 244 finished with value: 1.1705715507952004 and parameters: {'max_depth': 31, 'min_samples_split': 2, 'min_samples_leaf': 2, 'max_features': 'sqrt', 'criterion': 'absolute_error', 'splitter': 'random'}. Best is trial 160 with value: 0.5065208369659612.
[I 2024-12-04 11:52:51,579] Trial 248 finished with value: 0.577392391382288 and parameters: {'max_depth': 33, 'min_samples_split': 3, 'min_samples_leaf': 1, 'max_features': 'log2', 'criterion': 'squared_error', 'splitter': 'best'}. Best is trial 160 with value: 0.5065208369659612.
[I 2024-12-04 11:52:52,424] Trial 250 finished with value: 1.3105279435582882 and parameters: {'max_depth': 25, 'min_samples_split': 18, 'min_samples_leaf': 9, 'max_features': 'sqrt', 'criterion': 'friedman_mse', 'splitter': 'best'}. Best is trial 160 with value: 0.5065208369659612.
[I 2024-12-04 11:52:53,151] Trial 257 finished with value: 0.5172303731839445 and parameters: {'max_depth': 33, 'min_samples_split': 2, 'min_samples_leaf': 1, 'max_features': 'log2', 'criterion': 'squared_error', 'splitter': 'best'}. Best is trial 160 with value: 0.5065208369659612.
[I 2024-12-04 11:52:53,655] Trial 242 finished with value: 0.5421908820820033 and parameters: {'max_depth': 34, 'min_samples_split': 2, 'min_samples_leaf': 1, 'max_features': 'log2', 'criterion': 'absolute_error', 'splitter': 'best'}. Best is trial 160 with value: 0.5065208369659612.
[I 2024-12-04 11:52:54,592] Trial 256 finished with value: 0.5365713065858015 and parameters: {'max_depth': 35, 'min_samples_split': 2, 'min_samples_leaf': 1, 'max_features': 'log2', 'criterion': 'absolute_error', 'splitter': 'best'}. Best is trial 246 with value: 0.46736820859187767.
[I 2024-12-04 11:52:55,180] Trial 246 finished with value: 0.46736820859187767 and parameters: {'max_depth': 34, 'min_samples_split': 2, 'min_samples_leaf': 1, 'max_features': 'sqrt', 'criterion': 'squared_error', 'splitter': 'best'}. Best is trial 246 with value: 0.46736820859187767.
[I 2024-12-04 11:52:55,202] Trial 239 finished with value: 0.924799806170231 and parameters: {'max_depth': 35, 'min_samples_split': 2, 'min_samples_leaf': 3, 'max_features': 'log2', 'criterion': 'friedman_mse', 'splitter': 'best'}. Best is trial 246 with value: 0.46736820859187767.
[I 2024-12-04 11:52:55,498] Trial 253 finished with value: 0.5172303731839445 and parameters: {'max_depth': 33, 'min_samples_split': 2, 'min_samples_leaf': 1, 'max_features': 'log2', 'criterion': 'squared_error', 'splitter': 'best'}. Best is trial 246 with value: 0.46736820859187767.
[I 2024-12-04 11:52:55,648] Trial 252 finished with value: 0.7177525863158705 and parameters: {'max_depth': 35, 'min_samples_split': 2, 'min_samples_leaf': 2, 'max_features': 'log2', 'criterion': 'squared_error', 'splitter': 'best'}. Best is trial 246 with value: 0.46736820859187767.
[I 2024-12-04 11:52:55,704] Trial 259 finished with value: 0.6701963951273836 and parameters: {'max_depth': 33, 'min_samples_split': 7, 'min_samples_leaf': 1, 'max_features': 'log2', 'criterion': 'squared_error', 'splitter': 'best'}. Best is trial 246 with value: 0.46736820859187767.
[I 2024-12-04 11:52:55,882] Trial 262 finished with value: 0.5172303731839445 and parameters: {'max_depth': 33, 'min_samples_split': 2, 'min_samples_leaf': 1, 'max_features': 'log2', 'criterion': 'squared_error', 'splitter': 'best'}. Best is trial 246 with value: 0.46736820859187767.
[I 2024-12-04 11:52:56,186] Trial 258 finished with value: 0.577392391382288 and parameters: {'max_depth': 33, 'min_samples_split': 3, 'min_samples_leaf': 1, 'max_features': 'log2', 'criterion': 'squared_error', 'splitter': 'best'}. Best is trial 246 with value: 0.46736820859187767.
[I 2024-12-04 11:52:56,437] Trial 254 finished with value: 0.5966457171727975 and parameters: {'max_depth': 32, 'min_samples_split': 3, 'min_samples_leaf': 1, 'max_features': 'log2', 'criterion': 'squared_error', 'splitter': 'best'}. Best is trial 246 with value: 0.46736820859187767.
[I 2024-12-04 11:52:56,895] Trial 263 finished with value: 0.6508219269682929 and parameters: {'max_depth': 34, 'min_samples_split': 5, 'min_samples_leaf': 1, 'max_features': 'sqrt', 'criterion': 'squared_error', 'splitter': 'best'}. Best is trial 246 with value: 0.46736820859187767.
[I 2024-12-04 11:52:57,330] Trial 265 finished with value: 0.4830761340708416 and parameters: {'max_depth': 35, 'min_samples_split': 2, 'min_samples_leaf': 1, 'max_features': 'sqrt', 'criterion': 'squared_error', 'splitter': 'best'}. Best is trial 246 with value: 0.46736820859187767.
[I 2024-12-04 11:52:57,332] Trial 261 finished with value: 0.6796795062830638 and parameters: {'max_depth': 31, 'min_samples_split': 6, 'min_samples_leaf': 1, 'max_features': 'sqrt', 'criterion': 'squared_error', 'splitter': 'best'}. Best is trial 246 with value: 0.46736820859187767.
[I 2024-12-04 11:52:57,478] Trial 274 finished with value: 0.7200730001278538 and parameters: {'max_depth': 35, 'min_samples_split': 5, 'min_samples_leaf': 1, 'max_features': 'log2', 'criterion': 'squared_error', 'splitter': 'best'}. Best is trial 246 with value: 0.46736820859187767.
[I 2024-12-04 11:52:57,484] Trial 268 finished with value: 0.5859454919728878 and parameters: {'max_depth': 34, 'min_samples_split': 3, 'min_samples_leaf': 1, 'max_features': 'sqrt', 'criterion': 'squared_error', 'splitter': 'best'}. Best is trial 246 with value: 0.46736820859187767.
[I 2024-12-04 11:52:57,769] Trial 269 finished with value: 1.1261154552845143 and parameters: {'max_depth': 35, 'min_samples_split': 3, 'min_samples_leaf': 2, 'max_features': 'sqrt', 'criterion': 'squared_error', 'splitter': 'best'}. Best is trial 246 with value: 0.46736820859187767.
[I 2024-12-04 11:52:58,271] Trial 273 finished with value: 0.4830761340708416 and parameters: {'max_depth': 35, 'min_samples_split': 2, 'min_samples_leaf': 1, 'max_features': 'sqrt', 'criterion': 'squared_error', 'splitter': 'best'}. Best is trial 246 with value: 0.46736820859187767.
[I 2024-12-04 11:52:58,397] Trial 260 finished with value: 1.265806529011898 and parameters: {'max_depth': 30, 'min_samples_split': 3, 'min_samples_leaf': 1, 'max_features': 'log2', 'criterion': 'squared_error', 'splitter': 'random'}. Best is trial 246 with value: 0.46736820859187767.
[I 2024-12-04 11:52:58,779] Trial 266 finished with value: 1.3007745979739842 and parameters: {'max_depth': 16, 'min_samples_split': 19, 'min_samples_leaf': 4, 'max_features': 'log2', 'criterion': 'friedman_mse', 'splitter': 'best'}. Best is trial 246 with value: 0.46736820859187767.
[I 2024-12-04 11:52:58,846] Trial 271 finished with value: 0.5583963367356682 and parameters: {'max_depth': 32, 'min_samples_split': 2, 'min_samples_leaf': 1, 'max_features': 'log2', 'criterion': 'squared_error', 'splitter': 'best'}. Best is trial 246 with value: 0.46736820859187767.
[I 2024-12-04 11:52:59,111] Trial 267 finished with value: 1.2821018421432997 and parameters: {'max_depth': 33, 'min_samples_split': 4, 'min_samples_leaf': 2, 'max_features': 'log2', 'criterion': 'friedman_mse', 'splitter': 'random'}. Best is trial 246 with value: 0.46736820859187767.
[I 2024-12-04 11:52:59,112] Trial 270 finished with value: 0.7177525863158705 and parameters: {'max_depth': 35, 'min_samples_split': 2, 'min_samples_leaf': 2, 'max_features': 'log2', 'criterion': 'squared_error', 'splitter': 'best'}. Best is trial 246 with value: 0.46736820859187767.
[I 2024-12-04 11:52:59,942] Trial 264 finished with value: 1.2707508278377346 and parameters: {'max_depth': 34, 'min_samples_split': 2, 'min_samples_leaf': 3, 'max_features': 'sqrt', 'criterion': 'squared_error', 'splitter': 'best'}. Best is trial 246 with value: 0.46736820859187767.
[I 2024-12-04 11:53:00,678] Trial 255 finished with value: 0.5172303731839445 and parameters: {'max_depth': 33, 'min_samples_split': 2, 'min_samples_leaf': 1, 'max_features': 'log2', 'criterion': 'squared_error', 'splitter': 'best'}. Best is trial 246 with value: 0.46736820859187767.
[I 2024-12-04 11:53:00,948] Trial 280 finished with value: 0.5302162188396224 and parameters: {'max_depth': 33, 'min_samples_split': 3, 'min_samples_leaf': 1, 'max_features': 'sqrt', 'criterion': 'squared_error', 'splitter': 'best'}. Best is trial 246 with value: 0.46736820859187767.
[I 2024-12-04 11:53:02,424] Trial 275 finished with value: 0.5859454919728878 and parameters: {'max_depth': 34, 'min_samples_split': 3, 'min_samples_leaf': 1, 'max_features': 'sqrt', 'criterion': 'squared_error', 'splitter': 'best'}. Best is trial 246 with value: 0.46736820859187767.
[I 2024-12-04 11:53:02,624] Trial 272 finished with value: 0.6155642789130865 and parameters: {'max_depth': 31, 'min_samples_split': 4, 'min_samples_leaf': 1, 'max_features': 'sqrt', 'criterion': 'squared_error', 'splitter': 'best'}. Best is trial 246 with value: 0.46736820859187767.
[I 2024-12-04 11:53:03,350] Trial 276 finished with value: 1.2594527375158908 and parameters: {'max_depth': 35, 'min_samples_split': 5, 'min_samples_leaf': 6, 'max_features': 'sqrt', 'criterion': 'friedman_mse', 'splitter': 'random'}. Best is trial 246 with value: 0.46736820859187767.
[I 2024-12-04 11:53:03,353] Trial 292 finished with value: 1.1261154552845143 and parameters: {'max_depth': 35, 'min_samples_split': 2, 'min_samples_leaf': 2, 'max_features': 'sqrt', 'criterion': 'squared_error', 'splitter': 'best'}. Best is trial 246 with value: 0.46736820859187767.
[I 2024-12-04 11:53:03,683] Trial 286 finished with value: 0.5461587684201986 and parameters: {'max_depth': 30, 'min_samples_split': 2, 'min_samples_leaf': 1, 'max_features': 'sqrt', 'criterion': 'squared_error', 'splitter': 'best'}. Best is trial 246 with value: 0.46736820859187767.
[I 2024-12-04 11:53:04,336] Trial 282 finished with value: 1.1261154552845143 and parameters: {'max_depth': 32, 'min_samples_split': 2, 'min_samples_leaf': 2, 'max_features': 'sqrt', 'criterion': 'squared_error', 'splitter': 'best'}. Best is trial 246 with value: 0.46736820859187767.
[I 2024-12-04 11:53:04,499] Trial 284 finished with value: 0.5583963367356682 and parameters: {'max_depth': 32, 'min_samples_split': 2, 'min_samples_leaf': 1, 'max_features': 'log2', 'criterion': 'squared_error', 'splitter': 'best'}. Best is trial 246 with value: 0.46736820859187767.
[I 2024-12-04 11:53:05,288] Trial 281 finished with value: 1.3629276849850611 and parameters: {'max_depth': 24, 'min_samples_split': 7, 'min_samples_leaf': 7, 'max_features': 'log2', 'criterion': 'absolute_error', 'splitter': 'random'}. Best is trial 246 with value: 0.46736820859187767.
[I 2024-12-04 11:53:05,368] Trial 291 finished with value: 1.36280343027112 and parameters: {'max_depth': 8, 'min_samples_split': 20, 'min_samples_leaf': 8, 'max_features': 'log2', 'criterion': 'absolute_error', 'splitter': 'best'}. Best is trial 246 with value: 0.46736820859187767.
[I 2024-12-04 11:53:06,408] Trial 288 finished with value: 0.5346482740235124 and parameters: {'max_depth': 34, 'min_samples_split': 2, 'min_samples_leaf': 1, 'max_features': 'log2', 'criterion': 'squared_error', 'splitter': 'best'}. Best is trial 246 with value: 0.46736820859187767.
[I 2024-12-04 11:53:06,482] Trial 283 finished with value: 0.8912381971797895 and parameters: {'max_depth': 35, 'min_samples_split': 6, 'min_samples_leaf': 4, 'max_features': 'sqrt', 'criterion': 'squared_error', 'splitter': 'best'}. Best is trial 246 with value: 0.46736820859187767.
[I 2024-12-04 11:53:06,577] Trial 287 finished with value: 1.1261154552845143 and parameters: {'max_depth': 35, 'min_samples_split': 2, 'min_samples_leaf': 2, 'max_features': 'sqrt', 'criterion': 'squared_error', 'splitter': 'best'}. Best is trial 246 with value: 0.46736820859187767.
[I 2024-12-04 11:53:06,709] Trial 278 finished with value: 0.5172303731839445 and parameters: {'max_depth': 33, 'min_samples_split': 2, 'min_samples_leaf': 1, 'max_features': 'log2', 'criterion': 'squared_error', 'splitter': 'best'}. Best is trial 246 with value: 0.46736820859187767.
[I 2024-12-04 11:53:07,235] Trial 301 finished with value: 1.3007745979739842 and parameters: {'max_depth': 35, 'min_samples_split': 4, 'min_samples_leaf': 4, 'max_features': 'log2', 'criterion': 'squared_error', 'splitter': 'best'}. Best is trial 246 with value: 0.46736820859187767.
[I 2024-12-04 11:53:07,909] Trial 285 finished with value: 0.5517901989838648 and parameters: {'max_depth': 35, 'min_samples_split': 3, 'min_samples_leaf': 1, 'max_features': 'sqrt', 'criterion': 'squared_error', 'splitter': 'best'}. Best is trial 246 with value: 0.46736820859187767.
[I 2024-12-04 11:53:08,186] Trial 277 finished with value: 0.5966457171727975 and parameters: {'max_depth': 32, 'min_samples_split': 3, 'min_samples_leaf': 1, 'max_features': 'log2', 'criterion': 'squared_error', 'splitter': 'best'}. Best is trial 246 with value: 0.46736820859187767.
[I 2024-12-04 11:53:08,854] Trial 295 finished with value: 0.5346482740235124 and parameters: {'max_depth': 34, 'min_samples_split': 2, 'min_samples_leaf': 1, 'max_features': 'log2', 'criterion': 'squared_error', 'splitter': 'best'}. Best is trial 246 with value: 0.46736820859187767.
[I 2024-12-04 11:53:09,107] Trial 279 finished with value: 0.601574981694179 and parameters: {'max_depth': 30, 'min_samples_split': 3, 'min_samples_leaf': 1, 'max_features': 'sqrt', 'criterion': 'squared_error', 'splitter': 'best'}. Best is trial 246 with value: 0.46736820859187767.
[I 2024-12-04 11:53:09,236] Trial 290 finished with value: 1.36280343027112 and parameters: {'max_depth': 35, 'min_samples_split': 17, 'min_samples_leaf': 10, 'max_features': 'log2', 'criterion': 'absolute_error', 'splitter': 'best'}. Best is trial 246 with value: 0.46736820859187767.
[I 2024-12-04 11:53:09,556] Trial 294 finished with value: 0.526171915895561 and parameters: {'max_depth': 35, 'min_samples_split': 2, 'min_samples_leaf': 1, 'max_features': 'log2', 'criterion': 'squared_error', 'splitter': 'best'}. Best is trial 246 with value: 0.46736820859187767.
[I 2024-12-04 11:53:09,611] Trial 307 finished with value: 0.526171915895561 and parameters: {'max_depth': 35, 'min_samples_split': 2, 'min_samples_leaf': 1, 'max_features': 'log2', 'criterion': 'squared_error', 'splitter': 'best'}. Best is trial 246 with value: 0.46736820859187767.
[I 2024-12-04 11:53:10,113] Trial 300 finished with value: 1.3225455615026942 and parameters: {'max_depth': 1, 'min_samples_split': 8, 'min_samples_leaf': 3, 'max_features': 'sqrt', 'criterion': 'squared_error', 'splitter': 'best'}. Best is trial 309 with value: 0.46729638362398634.
[I 2024-12-04 11:53:10,590] Trial 306 finished with value: 0.5517901989838648 and parameters: {'max_depth': 35, 'min_samples_split': 3, 'min_samples_leaf': 1, 'max_features': 'sqrt', 'criterion': 'squared_error', 'splitter': 'best'}. Best is trial 309 with value: 0.46729638362398634.
[I 2024-12-04 11:53:10,628] Trial 309 finished with value: 0.46729638362398634 and parameters: {'max_depth': 31, 'min_samples_split': 2, 'min_samples_leaf': 1, 'max_features': 'sqrt', 'criterion': 'absolute_error', 'splitter': 'best'}. Best is trial 309 with value: 0.46729638362398634.
[I 2024-12-04 11:53:11,028] Trial 297 finished with value: 1.3014693347727373 and parameters: {'max_depth': 13, 'min_samples_split': 4, 'min_samples_leaf': 9, 'max_features': 'log2', 'criterion': 'squared_error', 'splitter': 'random'}. Best is trial 309 with value: 0.46729638362398634.
[I 2024-12-04 11:53:11,031] Trial 289 finished with value: 0.924799806170231 and parameters: {'max_depth': 29, 'min_samples_split': 2, 'min_samples_leaf': 3, 'max_features': 'log2', 'criterion': 'squared_error', 'splitter': 'best'}. Best is trial 309 with value: 0.46729638362398634.
[I 2024-12-04 11:53:11,151] Trial 299 finished with value: 0.924799806170231 and parameters: {'max_depth': 30, 'min_samples_split': 6, 'min_samples_leaf': 3, 'max_features': 'log2', 'criterion': 'squared_error', 'splitter': 'best'}. Best is trial 309 with value: 0.46729638362398634.
[I 2024-12-04 11:53:11,758] Trial 298 finished with value: 1.1646717068541756 and parameters: {'max_depth': 33, 'min_samples_split': 5, 'min_samples_leaf': 1, 'max_features': 'sqrt', 'criterion': 'squared_error', 'splitter': 'random'}. Best is trial 309 with value: 0.46729638362398634.
[I 2024-12-04 11:53:12,147] Trial 305 finished with value: 0.526171915895561 and parameters: {'max_depth': 35, 'min_samples_split': 2, 'min_samples_leaf': 1, 'max_features': 'log2', 'criterion': 'squared_error', 'splitter': 'best'}. Best is trial 309 with value: 0.46729638362398634.
[I 2024-12-04 11:53:12,149] Trial 293 finished with value: 0.5676194226646921 and parameters: {'max_depth': 33, 'min_samples_split': 2, 'min_samples_leaf': 1, 'max_features': 'sqrt', 'criterion': 'squared_error', 'splitter': 'best'}. Best is trial 309 with value: 0.46729638362398634.
[I 2024-12-04 11:53:12,414] Trial 303 finished with value: 1.2594527375158908 and parameters: {'max_depth': 25, 'min_samples_split': 12, 'min_samples_leaf': 6, 'max_features': 'sqrt', 'criterion': 'friedman_mse', 'splitter': 'random'}. Best is trial 309 with value: 0.46729638362398634.
[I 2024-12-04 11:53:13,238] Trial 310 finished with value: 0.924799806170231 and parameters: {'max_depth': 35, 'min_samples_split': 4, 'min_samples_leaf': 3, 'max_features': 'log2', 'criterion': 'squared_error', 'splitter': 'best'}. Best is trial 309 with value: 0.46729638362398634.
[I 2024-12-04 11:53:13,247] Trial 302 finished with value: 0.526171915895561 and parameters: {'max_depth': 35, 'min_samples_split': 2, 'min_samples_leaf': 1, 'max_features': 'log2', 'criterion': 'squared_error', 'splitter': 'best'}. Best is trial 309 with value: 0.46729638362398634.
