[I 2024-12-04 12:35:59,392] Trial 599 finished with value: 0.2742650544681384 and parameters: {'n_estimators': 1389, 'learning_rate': 0.09064640703251291, 'max_depth': 11, 'min_samples_split': 13, 'min_samples_leaf': 2, 'subsample': 0.6535451861908079, 'max_features': 'log2'}. Best is trial 509 with value: 0.20551759698042563.
[I 2024-12-04 12:36:01,137] Trial 596 finished with value: 0.22738871948391212 and parameters: {'n_estimators': 1498, 'learning_rate': 0.043228454915391436, 'max_depth': 12, 'min_samples_split': 17, 'min_samples_leaf': 1, 'subsample': 0.7071316767722325, 'max_features': 'sqrt'}. Best is trial 509 with value: 0.20551759698042563.
[I 2024-12-04 12:36:01,965] Trial 597 finished with value: 0.21701223221941357 and parameters: {'n_estimators': 1465, 'learning_rate': 0.08116941431891135, 'max_depth': 12, 'min_samples_split': 19, 'min_samples_leaf': 1, 'subsample': 0.7552044371551782, 'max_features': 'sqrt'}. Best is trial 509 with value: 0.20551759698042563.
[I 2024-12-04 12:36:04,727] Trial 600 finished with value: 0.21105778390350485 and parameters: {'n_estimators': 1431, 'learning_rate': 0.08687121876066356, 'max_depth': 11, 'min_samples_split': 13, 'min_samples_leaf': 1, 'subsample': 0.6385212414790611, 'max_features': 'sqrt'}. Best is trial 509 with value: 0.20551759698042563.
[I 2024-12-04 12:36:05,697] Trial 604 finished with value: 0.2198213266428501 and parameters: {'n_estimators': 1268, 'learning_rate': 0.09452641646338406, 'max_depth': 11, 'min_samples_split': 17, 'min_samples_leaf': 1, 'subsample': 0.6362483106769822, 'max_features': 'sqrt'}. Best is trial 509 with value: 0.20551759698042563.
[I 2024-12-04 12:36:10,502] Trial 601 finished with value: 0.21229387046326947 and parameters: {'n_estimators': 1461, 'learning_rate': 0.053843546221930313, 'max_depth': 12, 'min_samples_split': 18, 'min_samples_leaf': 1, 'subsample': 0.6092304473109509, 'max_features': 'sqrt'}. Best is trial 509 with value: 0.20551759698042563.
[I 2024-12-04 12:36:13,959] Trial 621 finished with value: 0.5137005219381765 and parameters: {'n_estimators': 723, 'learning_rate': 0.015648088357601096, 'max_depth': 5, 'min_samples_split': 10, 'min_samples_leaf': 2, 'subsample': 0.7768946353394752, 'max_features': 'log2'}. Best is trial 509 with value: 0.20551759698042563.
[I 2024-12-04 12:36:16,398] Trial 627 finished with value: 0.38134134128089037 and parameters: {'n_estimators': 492, 'learning_rate': 0.07344478196248024, 'max_depth': 4, 'min_samples_split': 15, 'min_samples_leaf': 9, 'subsample': 0.8637848886470466, 'max_features': None}. Best is trial 509 with value: 0.20551759698042563.
[I 2024-12-04 12:36:16,477] Trial 623 finished with value: 0.4224206131986436 and parameters: {'n_estimators': 681, 'learning_rate': 0.011829523814388745, 'max_depth': 8, 'min_samples_split': 12, 'min_samples_leaf': 5, 'subsample': 0.6229821551319905, 'max_features': 'sqrt'}. Best is trial 509 with value: 0.20551759698042563.
[I 2024-12-04 12:36:19,795] Trial 610 finished with value: 0.2777230192051312 and parameters: {'n_estimators': 1066, 'learning_rate': 0.05512524254794709, 'max_depth': 8, 'min_samples_split': 10, 'min_samples_leaf': 1, 'subsample': 0.8677161940607868, 'max_features': None}. Best is trial 509 with value: 0.20551759698042563.
[I 2024-12-04 12:36:20,914] Trial 605 finished with value: 0.2351204090676262 and parameters: {'n_estimators': 1494, 'learning_rate': 0.04671796128461087, 'max_depth': 10, 'min_samples_split': 13, 'min_samples_leaf': 1, 'subsample': 0.768156060911489, 'max_features': 'sqrt'}. Best is trial 509 with value: 0.20551759698042563.
[I 2024-12-04 12:36:20,979] Trial 613 finished with value: 0.2524328994952358 and parameters: {'n_estimators': 1117, 'learning_rate': 0.09931238373628021, 'max_depth': 11, 'min_samples_split': 15, 'min_samples_leaf': 2, 'subsample': 0.7568832226166462, 'max_features': 'sqrt'}. Best is trial 509 with value: 0.20551759698042563.
[I 2024-12-04 12:36:22,204] Trial 615 finished with value: 0.2325430619998309 and parameters: {'n_estimators': 1034, 'learning_rate': 0.08326040716167941, 'max_depth': 12, 'min_samples_split': 12, 'min_samples_leaf': 1, 'subsample': 0.7689581124029059, 'max_features': 'sqrt'}. Best is trial 509 with value: 0.20551759698042563.
[I 2024-12-04 12:36:22,206] Trial 608 finished with value: 0.33270531204632503 and parameters: {'n_estimators': 1230, 'learning_rate': 0.04403182016484003, 'max_depth': 7, 'min_samples_split': 7, 'min_samples_leaf': 6, 'subsample': 0.6181619315358045, 'max_features': None}. Best is trial 509 with value: 0.20551759698042563.
[I 2024-12-04 12:36:22,481] Trial 614 finished with value: 0.2548944463623422 and parameters: {'n_estimators': 1102, 'learning_rate': 0.06114382299768704, 'max_depth': 12, 'min_samples_split': 14, 'min_samples_leaf': 4, 'subsample': 0.7409088089477306, 'max_features': 'sqrt'}. Best is trial 509 with value: 0.20551759698042563.
[I 2024-12-04 12:36:24,744] Trial 607 finished with value: 0.23675770506065286 and parameters: {'n_estimators': 1477, 'learning_rate': 0.0749017488954738, 'max_depth': 12, 'min_samples_split': 13, 'min_samples_leaf': 1, 'subsample': 0.7152756073572373, 'max_features': 'sqrt'}. Best is trial 509 with value: 0.20551759698042563.
[I 2024-12-04 12:36:31,006] Trial 622 finished with value: 0.4419424090774262 and parameters: {'n_estimators': 960, 'learning_rate': 0.01225647607774181, 'max_depth': 9, 'min_samples_split': 18, 'min_samples_leaf': 9, 'subsample': 0.8838066551829115, 'max_features': 'sqrt'}. Best is trial 509 with value: 0.20551759698042563.
[I 2024-12-04 12:36:32,232] Trial 620 finished with value: 0.23868207269014433 and parameters: {'n_estimators': 1026, 'learning_rate': 0.08623142622795359, 'max_depth': 11, 'min_samples_split': 16, 'min_samples_leaf': 1, 'subsample': 0.6242310518339371, 'max_features': 'sqrt'}. Best is trial 509 with value: 0.20551759698042563.
[I 2024-12-04 12:36:32,324] Trial 616 finished with value: 0.23214304953450446 and parameters: {'n_estimators': 1145, 'learning_rate': 0.05366267304144804, 'max_depth': 12, 'min_samples_split': 14, 'min_samples_leaf': 2, 'subsample': 0.6644483966866965, 'max_features': 'sqrt'}. Best is trial 509 with value: 0.20551759698042563.
[I 2024-12-04 12:36:32,610] Trial 606 finished with value: 0.2995049861611694 and parameters: {'n_estimators': 1487, 'learning_rate': 0.09974862216389555, 'max_depth': 11, 'min_samples_split': 14, 'min_samples_leaf': 3, 'subsample': 0.6322117604166112, 'max_features': None}. Best is trial 509 with value: 0.20551759698042563.
[I 2024-12-04 12:36:36,710] Trial 611 finished with value: 0.2042243937933349 and parameters: {'n_estimators': 1500, 'learning_rate': 0.08202738934219889, 'max_depth': 11, 'min_samples_split': 16, 'min_samples_leaf': 1, 'subsample': 0.6085376656974077, 'max_features': 'sqrt'}. Best is trial 611 with value: 0.2042243937933349.
[I 2024-12-04 12:36:37,430] Trial 612 finished with value: 0.22227534460806395 and parameters: {'n_estimators': 1464, 'learning_rate': 0.09411905416453262, 'max_depth': 10, 'min_samples_split': 18, 'min_samples_leaf': 1, 'subsample': 0.6150700222891137, 'max_features': 'sqrt'}. Best is trial 611 with value: 0.2042243937933349.
[I 2024-12-04 12:36:37,817] Trial 629 finished with value: 0.38432982613186534 and parameters: {'n_estimators': 750, 'learning_rate': 0.01846692716846793, 'max_depth': 10, 'min_samples_split': 2, 'min_samples_leaf': 10, 'subsample': 0.9831421698864609, 'max_features': None}. Best is trial 611 with value: 0.2042243937933349.
[I 2024-12-04 12:36:43,298] Trial 624 finished with value: 0.22192807976962936 and parameters: {'n_estimators': 1144, 'learning_rate': 0.09741968910524773, 'max_depth': 12, 'min_samples_split': 12, 'min_samples_leaf': 1, 'subsample': 0.7320521845869703, 'max_features': 'sqrt'}. Best is trial 611 with value: 0.2042243937933349.
[I 2024-12-04 12:36:46,373] Trial 626 finished with value: 0.31523019529811014 and parameters: {'n_estimators': 1035, 'learning_rate': 0.07886338365786315, 'max_depth': 7, 'min_samples_split': 13, 'min_samples_leaf': 5, 'subsample': 0.9569970839243335, 'max_features': None}. Best is trial 611 with value: 0.2042243937933349.
[I 2024-12-04 12:36:49,327] Trial 619 finished with value: 0.36212627552305465 and parameters: {'n_estimators': 1438, 'learning_rate': 0.031208998976078015, 'max_depth': 5, 'min_samples_split': 9, 'min_samples_leaf': 3, 'subsample': 0.7458013590565753, 'max_features': 'log2'}. Best is trial 611 with value: 0.2042243937933349.
[I 2024-12-04 12:36:49,690] Trial 618 finished with value: 0.24310493108273865 and parameters: {'n_estimators': 1474, 'learning_rate': 0.06209740354554069, 'max_depth': 11, 'min_samples_split': 13, 'min_samples_leaf': 3, 'subsample': 0.6108671493500417, 'max_features': 'sqrt'}. Best is trial 611 with value: 0.2042243937933349.
[I 2024-12-04 12:36:53,650] Trial 632 finished with value: 0.24439500607670375 and parameters: {'n_estimators': 1005, 'learning_rate': 0.09338485939482136, 'max_depth': 12, 'min_samples_split': 14, 'min_samples_leaf': 3, 'subsample': 0.6341422803479615, 'max_features': 'sqrt'}. Best is trial 611 with value: 0.2042243937933349.
[I 2024-12-04 12:36:55,429] Trial 617 finished with value: 0.2899616136767481 and parameters: {'n_estimators': 1432, 'learning_rate': 0.07182785808048434, 'max_depth': 10, 'min_samples_split': 20, 'min_samples_leaf': 2, 'subsample': 0.7660326961592141, 'max_features': None}. Best is trial 611 with value: 0.2042243937933349.
[I 2024-12-04 12:37:03,340] Trial 625 finished with value: 0.22395168568594906 and parameters: {'n_estimators': 1450, 'learning_rate': 0.08552270559362739, 'max_depth': 11, 'min_samples_split': 14, 'min_samples_leaf': 1, 'subsample': 0.7347252198115649, 'max_features': 'sqrt'}. Best is trial 611 with value: 0.2042243937933349.
[I 2024-12-04 12:37:05,950] Trial 631 finished with value: 0.23842681821156295 and parameters: {'n_estimators': 1282, 'learning_rate': 0.09179289707062417, 'max_depth': 11, 'min_samples_split': 18, 'min_samples_leaf': 1, 'subsample': 0.8021042898148846, 'max_features': 'log2'}. Best is trial 611 with value: 0.2042243937933349.
[I 2024-12-04 12:37:07,241] Trial 628 finished with value: 0.2348595708925793 and parameters: {'n_estimators': 1424, 'learning_rate': 0.07890568628209903, 'max_depth': 9, 'min_samples_split': 10, 'min_samples_leaf': 2, 'subsample': 0.6135704994883181, 'max_features': 'sqrt'}. Best is trial 611 with value: 0.2042243937933349.
[I 2024-12-04 12:37:08,891] Trial 646 finished with value: 0.40450326000835973 and parameters: {'n_estimators': 630, 'learning_rate': 0.06486443285298119, 'max_depth': 4, 'min_samples_split': 15, 'min_samples_leaf': 5, 'subsample': 0.7933747518271453, 'max_features': 'log2'}. Best is trial 611 with value: 0.2042243937933349.
[I 2024-12-04 12:37:11,137] Trial 630 finished with value: 0.21472284406018594 and parameters: {'n_estimators': 1469, 'learning_rate': 0.09624311529533583, 'max_depth': 11, 'min_samples_split': 12, 'min_samples_leaf': 1, 'subsample': 0.6230804749696927, 'max_features': 'sqrt'}. Best is trial 611 with value: 0.2042243937933349.
[I 2024-12-04 12:37:13,382] Trial 635 finished with value: 0.22086565771945177 and parameters: {'n_estimators': 1227, 'learning_rate': 0.07471742039977239, 'max_depth': 12, 'min_samples_split': 17, 'min_samples_leaf': 1, 'subsample': 0.6840639009877061, 'max_features': 'sqrt'}. Best is trial 611 with value: 0.2042243937933349.
[I 2024-12-04 12:37:17,509] Trial 634 finished with value: 0.24527287723243288 and parameters: {'n_estimators': 1352, 'learning_rate': 0.0916716442979545, 'max_depth': 10, 'min_samples_split': 14, 'min_samples_leaf': 4, 'subsample': 0.7629622809249599, 'max_features': 'sqrt'}. Best is trial 611 with value: 0.2042243937933349.
[I 2024-12-04 12:37:22,839] Trial 633 finished with value: 0.24924370782543884 and parameters: {'n_estimators': 1461, 'learning_rate': 0.06816137072055876, 'max_depth': 12, 'min_samples_split': 17, 'min_samples_leaf': 3, 'subsample': 0.7290693822402505, 'max_features': 'sqrt'}. Best is trial 611 with value: 0.2042243937933349.
[I 2024-12-04 12:37:28,330] Trial 636 finished with value: 0.24153716282030405 and parameters: {'n_estimators': 1458, 'learning_rate': 0.08605153226079394, 'max_depth': 12, 'min_samples_split': 19, 'min_samples_leaf': 2, 'subsample': 0.7876612777191808, 'max_features': 'sqrt'}. Best is trial 611 with value: 0.2042243937933349.
[I 2024-12-04 12:37:30,862] Trial 638 finished with value: 0.2786645973219009 and parameters: {'n_estimators': 1345, 'learning_rate': 0.09337928362496911, 'max_depth': 12, 'min_samples_split': 9, 'min_samples_leaf': 4, 'subsample': 0.7632214760736673, 'max_features': 'log2'}. Best is trial 611 with value: 0.2042243937933349.
[I 2024-12-04 12:37:35,654] Trial 637 finished with value: 0.2124137242845849 and parameters: {'n_estimators': 1491, 'learning_rate': 0.06030984123328908, 'max_depth': 12, 'min_samples_split': 20, 'min_samples_leaf': 1, 'subsample': 0.6250963013806572, 'max_features': 'sqrt'}. Best is trial 611 with value: 0.2042243937933349.
[I 2024-12-04 12:37:39,680] Trial 641 finished with value: 0.3846952919171994 and parameters: {'n_estimators': 1170, 'learning_rate': 0.014380644245861864, 'max_depth': 11, 'min_samples_split': 17, 'min_samples_leaf': 10, 'subsample': 0.786196364595287, 'max_features': None}. Best is trial 611 with value: 0.2042243937933349.
[I 2024-12-04 12:37:43,463] Trial 640 finished with value: 0.24339118430496193 and parameters: {'n_estimators': 1445, 'learning_rate': 0.05634776167058556, 'max_depth': 11, 'min_samples_split': 20, 'min_samples_leaf': 2, 'subsample': 0.6167470048177319, 'max_features': 'sqrt'}. Best is trial 611 with value: 0.2042243937933349.
[I 2024-12-04 12:37:45,693] Trial 639 finished with value: 0.2071007513107323 and parameters: {'n_estimators': 1489, 'learning_rate': 0.059957419564771894, 'max_depth': 12, 'min_samples_split': 16, 'min_samples_leaf': 1, 'subsample': 0.6758391368276567, 'max_features': 'sqrt'}. Best is trial 611 with value: 0.2042243937933349.
[I 2024-12-04 12:37:48,398] Trial 642 finished with value: 0.3977398802077989 and parameters: {'n_estimators': 1405, 'learning_rate': 0.05866575071887149, 'max_depth': 8, 'min_samples_split': 5, 'min_samples_leaf': 9, 'subsample': 0.7885198308887116, 'max_features': 'sqrt'}. Best is trial 611 with value: 0.2042243937933349.
[I 2024-12-04 12:37:50,704] Trial 663 finished with value: 0.26066128522739646 and parameters: {'n_estimators': 602, 'learning_rate': 0.07813033286577878, 'max_depth': 9, 'min_samples_split': 5, 'min_samples_leaf': 1, 'subsample': 0.6451492375020143, 'max_features': 'log2'}. Best is trial 611 with value: 0.2042243937933349.
[I 2024-12-04 12:37:53,285] Trial 645 finished with value: 0.2177787718291113 and parameters: {'n_estimators': 1373, 'learning_rate': 0.0926165789012487, 'max_depth': 10, 'min_samples_split': 13, 'min_samples_leaf': 1, 'subsample': 0.6201757492511215, 'max_features': 'sqrt'}. Best is trial 611 with value: 0.2042243937933349.
[I 2024-12-04 12:37:56,709] Trial 644 finished with value: 0.21479918619713165 and parameters: {'n_estimators': 1392, 'learning_rate': 0.08897203280436991, 'max_depth': 11, 'min_samples_split': 14, 'min_samples_leaf': 1, 'subsample': 0.6073592499121957, 'max_features': 'sqrt'}. Best is trial 611 with value: 0.2042243937933349.
[I 2024-12-04 12:37:57,999] Trial 647 finished with value: 0.22337365804653245 and parameters: {'n_estimators': 1311, 'learning_rate': 0.04775616331465308, 'max_depth': 11, 'min_samples_split': 18, 'min_samples_leaf': 1, 'subsample': 0.6394894414255049, 'max_features': 'sqrt'}. Best is trial 611 with value: 0.2042243937933349.
[I 2024-12-04 12:38:00,767] Trial 643 finished with value: 0.2512686452130367 and parameters: {'n_estimators': 1464, 'learning_rate': 0.0803124055795045, 'max_depth': 11, 'min_samples_split': 12, 'min_samples_leaf': 2, 'subsample': 0.7803908538954786, 'max_features': 'log2'}. Best is trial 611 with value: 0.2042243937933349.
[I 2024-12-04 12:38:03,672] Trial 649 finished with value: 0.2142803323584027 and parameters: {'n_estimators': 1366, 'learning_rate': 0.09687395721202013, 'max_depth': 11, 'min_samples_split': 16, 'min_samples_leaf': 1, 'subsample': 0.6000136947897947, 'max_features': 'sqrt'}. Best is trial 611 with value: 0.2042243937933349.
[I 2024-12-04 12:38:03,943] Trial 650 finished with value: 0.25048625082196124 and parameters: {'n_estimators': 1135, 'learning_rate': 0.08609223034645169, 'max_depth': 10, 'min_samples_split': 17, 'min_samples_leaf': 1, 'subsample': 0.6991671042823415, 'max_features': None}. Best is trial 611 with value: 0.2042243937933349.
[I 2024-12-04 12:38:05,936] Trial 651 finished with value: 0.2517995879938135 and parameters: {'n_estimators': 1345, 'learning_rate': 0.06384570101710435, 'max_depth': 11, 'min_samples_split': 18, 'min_samples_leaf': 3, 'subsample': 0.6110436236967366, 'max_features': 'sqrt'}. Best is trial 611 with value: 0.2042243937933349.
[I 2024-12-04 12:38:06,275] Trial 671 finished with value: 0.38254732649090917 and parameters: {'n_estimators': 382, 'learning_rate': 0.05028281695725853, 'max_depth': 8, 'min_samples_split': 19, 'min_samples_leaf': 9, 'subsample': 0.7938369733681019, 'max_features': None}. Best is trial 611 with value: 0.2042243937933349.
[I 2024-12-04 12:38:08,637] Trial 652 finished with value: 0.21626089640710752 and parameters: {'n_estimators': 1276, 'learning_rate': 0.07891769916461085, 'max_depth': 11, 'min_samples_split': 15, 'min_samples_leaf': 1, 'subsample': 0.6206130040756774, 'max_features': 'sqrt'}. Best is trial 611 with value: 0.2042243937933349.
[I 2024-12-04 12:38:10,029] Trial 657 finished with value: 0.2159273143627674 and parameters: {'n_estimators': 1172, 'learning_rate': 0.09539640592510447, 'max_depth': 10, 'min_samples_split': 16, 'min_samples_leaf': 1, 'subsample': 0.708057876467328, 'max_features': 'sqrt'}. Best is trial 611 with value: 0.2042243937933349.
[I 2024-12-04 12:38:11,257] Trial 653 finished with value: 0.23980805153195142 and parameters: {'n_estimators': 1274, 'learning_rate': 0.06838994542757978, 'max_depth': 12, 'min_samples_split': 16, 'min_samples_leaf': 2, 'subsample': 0.6076545420638355, 'max_features': 'sqrt'}. Best is trial 611 with value: 0.2042243937933349.
[I 2024-12-04 12:38:13,771] Trial 659 finished with value: 0.22114625939886376 and parameters: {'n_estimators': 1155, 'learning_rate': 0.06105469416965574, 'max_depth': 12, 'min_samples_split': 20, 'min_samples_leaf': 1, 'subsample': 0.6392318587720149, 'max_features': 'sqrt'}. Best is trial 611 with value: 0.2042243937933349.
[I 2024-12-04 12:38:16,368] Trial 648 finished with value: 0.21654632070186003 and parameters: {'n_estimators': 1435, 'learning_rate': 0.051088028501769606, 'max_depth': 12, 'min_samples_split': 15, 'min_samples_leaf': 1, 'subsample': 0.6255105352652668, 'max_features': 'sqrt'}. Best is trial 611 with value: 0.2042243937933349.
[I 2024-12-04 12:38:18,738] Trial 655 finished with value: 0.24302665124667427 and parameters: {'n_estimators': 1369, 'learning_rate': 0.09967373922293847, 'max_depth': 12, 'min_samples_split': 17, 'min_samples_leaf': 2, 'subsample': 0.6214483535917866, 'max_features': 'sqrt'}. Best is trial 611 with value: 0.2042243937933349.
[I 2024-12-04 12:38:22,001] Trial 668 finished with value: 0.48798812888356025 and parameters: {'n_estimators': 909, 'learning_rate': 0.04713607582789271, 'max_depth': 4, 'min_samples_split': 16, 'min_samples_leaf': 7, 'subsample': 0.607001065427443, 'max_features': 'log2'}. Best is trial 611 with value: 0.2042243937933349.
[I 2024-12-04 12:38:22,259] Trial 665 finished with value: 0.45426549210815503 and parameters: {'n_estimators': 1034, 'learning_rate': 0.012949951679801742, 'max_depth': 12, 'min_samples_split': 19, 'min_samples_leaf': 8, 'subsample': 0.6143756243718835, 'max_features': 'sqrt'}. Best is trial 611 with value: 0.2042243937933349.
[I 2024-12-04 12:38:22,365] Trial 669 finished with value: 0.4021449372096454 and parameters: {'n_estimators': 752, 'learning_rate': 0.05101702345864876, 'max_depth': 4, 'min_samples_split': 2, 'min_samples_leaf': 8, 'subsample': 0.9907116417476761, 'max_features': 'sqrt'}. Best is trial 611 with value: 0.2042243937933349.
[I 2024-12-04 12:38:22,395] Trial 654 finished with value: 0.2326286342276775 and parameters: {'n_estimators': 1479, 'learning_rate': 0.0746525227852919, 'max_depth': 10, 'min_samples_split': 15, 'min_samples_leaf': 2, 'subsample': 0.618117924147018, 'max_features': 'sqrt'}. Best is trial 611 with value: 0.2042243937933349.
[I 2024-12-04 12:38:26,355] Trial 656 finished with value: 0.24418574612685673 and parameters: {'n_estimators': 1424, 'learning_rate': 0.06624945013370581, 'max_depth': 9, 'min_samples_split': 13, 'min_samples_leaf': 1, 'subsample': 0.6343202280775683, 'max_features': 'sqrt'}. Best is trial 611 with value: 0.2042243937933349.
[I 2024-12-04 12:38:30,366] Trial 658 finished with value: 0.2183164807464041 and parameters: {'n_estimators': 1466, 'learning_rate': 0.07495738498737253, 'max_depth': 12, 'min_samples_split': 16, 'min_samples_leaf': 1, 'subsample': 0.6035304136161611, 'max_features': 'sqrt'}. Best is trial 611 with value: 0.2042243937933349.
[I 2024-12-04 12:38:30,732] Trial 662 finished with value: 0.2190671102911329 and parameters: {'n_estimators': 1266, 'learning_rate': 0.07161504014362845, 'max_depth': 12, 'min_samples_split': 16, 'min_samples_leaf': 1, 'subsample': 0.7179293366643604, 'max_features': 'sqrt'}. Best is trial 611 with value: 0.2042243937933349.
[I 2024-12-04 12:38:33,873] Trial 660 finished with value: 0.2552391698420384 and parameters: {'n_estimators': 1487, 'learning_rate': 0.03991195459106833, 'max_depth': 11, 'min_samples_split': 17, 'min_samples_leaf': 1, 'subsample': 0.8267160897411414, 'max_features': 'log2'}. Best is trial 611 with value: 0.2042243937933349.
