[I 2024-12-04 15:09:27,964] Trial 1416 finished with value: 0.48830341486417583 and parameters: {'kernel_type': 'Matern', 'length_scale': 64193.43283879749, 'noise_level': 0.24902352682127232, 'constant_value': 50086.19903416301, 'nu': 0.5}. Best is trial 386 with value: 0.4872991004520934.
[I 2024-12-04 15:09:28,476] Trial 1412 finished with value: 0.48830341476588873 and parameters: {'kernel_type': 'Matern', 'length_scale': 1876.9889020317987, 'noise_level': 0.8207595971329398, 'constant_value': 1229.8134975429086, 'nu': 0.5}. Best is trial 386 with value: 0.4872991004520934.
[I 2024-12-04 15:09:28,764] Trial 1428 finished with value: 0.4883034060539065 and parameters: {'kernel_type': 'Matern', 'length_scale': 333.1775822119065, 'noise_level': 0.9436301566600538, 'constant_value': 1445.494163059745, 'nu': 0.5}. Best is trial 386 with value: 0.4872991004520934.
[I 2024-12-04 15:09:29,126] Trial 1415 finished with value: 0.4883034268273808 and parameters: {'kernel_type': 'Matern', 'length_scale': 95622.6927068779, 'noise_level': 0.015916508535031484, 'constant_value': 1900.1975399542634, 'nu': 0.5}. Best is trial 386 with value: 0.4872991004520934.
[I 2024-12-04 15:09:29,916] Trial 1434 finished with value: 1.2614547975421913 and parameters: {'kernel_type': 'RBF', 'length_scale': 644.6628932234015, 'noise_level': 0.3737973367650436, 'constant_value': 0.07782708771017133, 'nu': 1.5}. Best is trial 386 with value: 0.4872991004520934.
[I 2024-12-04 15:09:30,397] Trial 1422 finished with value: 1.2401112325448764 and parameters: {'kernel_type': 'RBF', 'length_scale': 6986.370552653179, 'noise_level': 0.019527033756780665, 'constant_value': 25557.65370745582, 'nu': 0.5}. Best is trial 386 with value: 0.4872991004520934.
[I 2024-12-04 15:09:30,838] Trial 1432 finished with value: 0.4883034237105509 and parameters: {'kernel_type': 'Matern', 'length_scale': 572.6789147560643, 'noise_level': 0.015369673164626821, 'constant_value': 3407.247749826718, 'nu': 0.5}. Best is trial 386 with value: 0.4872991004520934.
[I 2024-12-04 15:09:31,788] Trial 1430 finished with value: 0.4883034184092661 and parameters: {'kernel_type': 'Matern', 'length_scale': 66101.37121745606, 'noise_level': 0.9903682264076099, 'constant_value': 3569.868768453735, 'nu': 0.5}. Best is trial 386 with value: 0.4872991004520934.
[I 2024-12-04 15:09:33,501] Trial 1433 finished with value: 1.2401112272405836 and parameters: {'kernel_type': 'RBF', 'length_scale': 0.1282395110620145, 'noise_level': 5.431700967500463e-09, 'constant_value': 1.505819703131398e-07, 'nu': 2.5}. Best is trial 386 with value: 0.4872991004520934.
[I 2024-12-04 15:09:33,986] Trial 1435 finished with value: 0.48830338993401073 and parameters: {'kernel_type': 'Matern', 'length_scale': 55032.27686768104, 'noise_level': 0.6744379682865104, 'constant_value': 35796.22895570473, 'nu': 0.5}. Best is trial 386 with value: 0.4872991004520934.
[I 2024-12-04 15:09:34,458] Trial 1431 finished with value: 0.4883034734917136 and parameters: {'kernel_type': 'Matern', 'length_scale': 58730.20125542891, 'noise_level': 0.00044903570954891596, 'constant_value': 91394.42420685088, 'nu': 0.5}. Best is trial 386 with value: 0.4872991004520934.
[I 2024-12-04 15:09:34,817] Trial 1436 finished with value: 1.2401112326015988 and parameters: {'kernel_type': 'RBF', 'length_scale': 16137.251729666605, 'noise_level': 0.005098536104112874, 'constant_value': 147.7245808199419, 'nu': 2.5}. Best is trial 386 with value: 0.4872991004520934.
[I 2024-12-04 15:09:35,545] Trial 1444 finished with value: 0.4883034089668151 and parameters: {'kernel_type': 'Matern', 'length_scale': 935.8237458237604, 'noise_level': 0.10617515102796085, 'constant_value': 1363.9094832818441, 'nu': 0.5}. Best is trial 386 with value: 0.4872991004520934.
[I 2024-12-04 15:09:35,860] Trial 1439 finished with value: 0.48830346269367436 and parameters: {'kernel_type': 'Matern', 'length_scale': 39231.504401291524, 'noise_level': 0.023201719226602593, 'constant_value': 90236.06750421129, 'nu': 0.5}. Best is trial 386 with value: 0.4872991004520934.
[I 2024-12-04 15:09:36,601] Trial 1446 finished with value: 0.48830341525683496 and parameters: {'kernel_type': 'Matern', 'length_scale': 15.335075610720098, 'noise_level': 0.07697512273318463, 'constant_value': 96222.51216437535, 'nu': 0.5}. Best is trial 386 with value: 0.4872991004520934.
[I 2024-12-04 15:09:39,117] Trial 1441 finished with value: 0.488303425262865 and parameters: {'kernel_type': 'Matern', 'length_scale': 1635.202482901282, 'noise_level': 0.013029937846753247, 'constant_value': 80542.28104676372, 'nu': 0.5}. Best is trial 386 with value: 0.4872991004520934.
[I 2024-12-04 15:09:39,175] Trial 1443 finished with value: 1.2401112325841763 and parameters: {'kernel_type': 'Matern', 'length_scale': 98263.13560615513, 'noise_level': 0.02816823883567653, 'constant_value': 175.77238625827874, 'nu': 0.5}. Best is trial 386 with value: 0.4872991004520934.
[I 2024-12-04 15:09:39,483] Trial 1440 finished with value: 1.2401112324859445 and parameters: {'kernel_type': 'RBF', 'length_scale': 1.0211413187254574e-05, 'noise_level': 0.0057417572034778545, 'constant_value': 89779.60697142019, 'nu': 0.5}. Best is trial 386 with value: 0.4872991004520934.
[I 2024-12-04 15:09:40,163] Trial 1438 finished with value: 0.4883036245901668 and parameters: {'kernel_type': 'Matern', 'length_scale': 79494.43912666029, 'noise_level': 0.18752253497703542, 'constant_value': 5026.389269380764, 'nu': 0.5}. Best is trial 386 with value: 0.4872991004520934.
[I 2024-12-04 15:09:41,397] Trial 1452 finished with value: 0.48830341922475845 and parameters: {'kernel_type': 'Matern', 'length_scale': 75362.02418433299, 'noise_level': 0.5547735941843212, 'constant_value': 24856.87591750382, 'nu': 0.5}. Best is trial 386 with value: 0.4872991004520934.
[I 2024-12-04 15:09:41,963] Trial 1449 finished with value: 0.48830341897614016 and parameters: {'kernel_type': 'Matern', 'length_scale': 89891.60991443909, 'noise_level': 0.002318670448860462, 'constant_value': 53760.46062289371, 'nu': 0.5}. Best is trial 386 with value: 0.4872991004520934.
[I 2024-12-04 15:09:42,431] Trial 1445 finished with value: 1.2401112323605443 and parameters: {'kernel_type': 'Matern', 'length_scale': 98283.7460961959, 'noise_level': 0.004265606741576509, 'constant_value': 79.75705799545871, 'nu': 2.5}. Best is trial 386 with value: 0.4872991004520934.
[I 2024-12-04 15:09:42,470] Trial 1448 finished with value: 1.2614547953941473 and parameters: {'kernel_type': 'Matern', 'length_scale': 6.186767953553274, 'noise_level': 0.025257909699571136, 'constant_value': 1758.096645101283, 'nu': 0.5}. Best is trial 386 with value: 0.4872991004520934.
[I 2024-12-04 15:09:42,619] Trial 1447 finished with value: 1.261454370202669 and parameters: {'kernel_type': 'RBF', 'length_scale': 3.827692544324587e-05, 'noise_level': 6.015248552316338e-09, 'constant_value': 609.4296043816829, 'nu': 1.5}. Best is trial 386 with value: 0.4872991004520934.
[I 2024-12-04 15:09:42,859] Trial 1453 finished with value: 0.4883033184555268 and parameters: {'kernel_type': 'Matern', 'length_scale': 41811.93123382432, 'noise_level': 0.9857603576980487, 'constant_value': 92095.88161135551, 'nu': 0.5}. Best is trial 386 with value: 0.4872991004520934.
[I 2024-12-04 15:09:43,178] Trial 1451 finished with value: 0.488303423369461 and parameters: {'kernel_type': 'Matern', 'length_scale': 757.3135540245904, 'noise_level': 0.01980812867294162, 'constant_value': 760.3301106959602, 'nu': 0.5}. Best is trial 386 with value: 0.4872991004520934.
[I 2024-12-04 15:09:44,085] Trial 1442 finished with value: 0.48830341514621667 and parameters: {'kernel_type': 'Matern', 'length_scale': 18796.327537987607, 'noise_level': 0.4522945613476578, 'constant_value': 91592.82177703695, 'nu': 0.5}. Best is trial 386 with value: 0.4872991004520934.
[I 2024-12-04 15:09:44,095] Trial 1455 finished with value: 0.48830334038817536 and parameters: {'kernel_type': 'Matern', 'length_scale': 87523.03580800732, 'noise_level': 0.010337726588633135, 'constant_value': 3511.1135032525467, 'nu': 0.5}. Best is trial 386 with value: 0.4872991004520934.
[I 2024-12-04 15:09:44,531] Trial 1437 finished with value: 0.48830317759712244 and parameters: {'kernel_type': 'Matern', 'length_scale': 167.61478644901308, 'noise_level': 0.6073272555193633, 'constant_value': 451.98856259302687, 'nu': 0.5}. Best is trial 386 with value: 0.4872991004520934.
[I 2024-12-04 15:09:46,250] Trial 1454 finished with value: 0.4883032464196421 and parameters: {'kernel_type': 'Matern', 'length_scale': 1433.3454994686647, 'noise_level': 0.005883078051060935, 'constant_value': 1455.6385666714118, 'nu': 0.5}. Best is trial 386 with value: 0.4872991004520934.
[I 2024-12-04 15:09:47,116] Trial 1450 finished with value: 0.48830340662861327 and parameters: {'kernel_type': 'Matern', 'length_scale': 241.62991382992735, 'noise_level': 0.031422802595035965, 'constant_value': 469.59950723921645, 'nu': 0.5}. Best is trial 386 with value: 0.4872991004520934.
[I 2024-12-04 15:09:47,165] Trial 1456 finished with value: 0.48830343361648737 and parameters: {'kernel_type': 'Matern', 'length_scale': 96799.8102181827, 'noise_level': 0.05058171235761354, 'constant_value': 10385.148607667581, 'nu': 0.5}. Best is trial 386 with value: 0.4872991004520934.
[I 2024-12-04 15:09:48,128] Trial 1462 finished with value: 1.240111232416119 and parameters: {'kernel_type': 'Matern', 'length_scale': 1307.74916367952, 'noise_level': 0.0005586560130528354, 'constant_value': 89537.90767896167, 'nu': 1.5}. Best is trial 386 with value: 0.4872991004520934.
[I 2024-12-04 15:09:49,102] Trial 1463 finished with value: 0.4883034181493824 and parameters: {'kernel_type': 'Matern', 'length_scale': 4641.412438313174, 'noise_level': 0.9389421300245018, 'constant_value': 34095.822301029104, 'nu': 0.5}. Best is trial 386 with value: 0.4872991004520934.
[I 2024-12-04 15:09:49,796] Trial 1460 finished with value: 1.261454795394147 and parameters: {'kernel_type': 'Matern', 'length_scale': 477.01587550350257, 'noise_level': 0.032398087656784494, 'constant_value': 5100.257232060139, 'nu': 0.5}. Best is trial 386 with value: 0.4872991004520934.
[I 2024-12-04 15:09:50,034] Trial 1461 finished with value: 1.2401112315202683 and parameters: {'kernel_type': 'RBF', 'length_scale': 36136.065182325976, 'noise_level': 1.8820021999569944e-05, 'constant_value': 17789.014276742877, 'nu': 0.5}. Best is trial 386 with value: 0.4872991004520934.
[I 2024-12-04 15:09:50,240] Trial 1464 finished with value: 0.48830323592014635 and parameters: {'kernel_type': 'Matern', 'length_scale': 16.843106103183423, 'noise_level': 0.2439583674899853, 'constant_value': 147.71001192449205, 'nu': 0.5}. Best is trial 386 with value: 0.4872991004520934.
[I 2024-12-04 15:09:50,504] Trial 1457 finished with value: 1.240111232379693 and parameters: {'kernel_type': 'Matern', 'length_scale': 0.04252658277060116, 'noise_level': 0.0030709905818429328, 'constant_value': 0.3688350236221234, 'nu': 0.5}. Best is trial 386 with value: 0.4872991004520934.
[I 2024-12-04 15:09:50,730] Trial 1459 finished with value: 0.4883034183335297 and parameters: {'kernel_type': 'Matern', 'length_scale': 1550.836496889584, 'noise_level': 0.9033165141671565, 'constant_value': 46.63502745632737, 'nu': 0.5}. Best is trial 386 with value: 0.4872991004520934.
[I 2024-12-04 15:09:50,987] Trial 1469 finished with value: 0.4883034062104657 and parameters: {'kernel_type': 'Matern', 'length_scale': 29637.79383344161, 'noise_level': 0.44791943921118504, 'constant_value': 88958.85149648089, 'nu': 0.5}. Best is trial 386 with value: 0.4872991004520934.
[I 2024-12-04 15:09:51,619] Trial 1472 finished with value: 0.4883034684579694 and parameters: {'kernel_type': 'Matern', 'length_scale': 2328.559341347626, 'noise_level': 0.03961359537009282, 'constant_value': 2057.280771360449, 'nu': 0.5}. Best is trial 386 with value: 0.4872991004520934.
[I 2024-12-04 15:09:51,636] Trial 1458 finished with value: 0.4883034277352756 and parameters: {'kernel_type': 'Matern', 'length_scale': 2422.730770537212, 'noise_level': 0.5841111235115026, 'constant_value': 735.2271956017875, 'nu': 0.5}. Best is trial 386 with value: 0.4872991004520934.
[I 2024-12-04 15:09:53,270] Trial 1467 finished with value: 0.5663932213423731 and parameters: {'kernel_type': 'Matern', 'length_scale': 2253.57330202757, 'noise_level': 0.7339237068064378, 'constant_value': 12.333298127524614, 'nu': 2.5}. Best is trial 386 with value: 0.4872991004520934.
[I 2024-12-04 15:09:53,988] Trial 1466 finished with value: 1.24011123267673 and parameters: {'kernel_type': 'Matern', 'length_scale': 48844.91805064128, 'noise_level': 9.598425257272918e-06, 'constant_value': 0.001187316415114985, 'nu': 2.5}. Best is trial 386 with value: 0.4872991004520934.
[I 2024-12-04 15:09:57,334] Trial 1474 finished with value: 0.4883033980658714 and parameters: {'kernel_type': 'Matern', 'length_scale': 88035.3608690457, 'noise_level': 0.14805134408840043, 'constant_value': 59469.1768463799, 'nu': 0.5}. Best is trial 386 with value: 0.4872991004520934.
[I 2024-12-04 15:09:57,391] Trial 1473 finished with value: 0.5273045926214535 and parameters: {'kernel_type': 'Matern', 'length_scale': 24848.74800193122, 'noise_level': 0.05348996355147774, 'constant_value': 95544.1334438598, 'nu': 1.5}. Best is trial 386 with value: 0.4872991004520934.
[I 2024-12-04 15:09:59,428] Trial 1465 finished with value: 0.527305448720531 and parameters: {'kernel_type': 'Matern', 'length_scale': 27881.36904262997, 'noise_level': 0.37809287652720874, 'constant_value': 439.5491897612046, 'nu': 1.5}. Best is trial 386 with value: 0.4872991004520934.
[I 2024-12-04 15:09:59,961] Trial 1468 finished with value: 1.2401112314983234 and parameters: {'kernel_type': 'Matern', 'length_scale': 0.005556472328094831, 'noise_level': 0.0005303525767202261, 'constant_value': 736.2119007532557, 'nu': 1.5}. Best is trial 386 with value: 0.4872991004520934.
[I 2024-12-04 15:09:59,972] Trial 1476 finished with value: 0.48830370069211215 and parameters: {'kernel_type': 'Matern', 'length_scale': 58521.55645065454, 'noise_level': 0.8381150482559839, 'constant_value': 322.19585737593394, 'nu': 0.5}. Best is trial 386 with value: 0.4872991004520934.
[I 2024-12-04 15:10:01,360] Trial 1471 finished with value: 0.48830322164928536 and parameters: {'kernel_type': 'Matern', 'length_scale': 17.21080074995442, 'noise_level': 0.4773083634715497, 'constant_value': 764.6357866643958, 'nu': 0.5}. Best is trial 386 with value: 0.4872991004520934.
[I 2024-12-04 15:10:01,895] Trial 1470 finished with value: 0.4883034228373736 and parameters: {'kernel_type': 'Matern', 'length_scale': 8.730686785912496, 'noise_level': 0.7327817518356597, 'constant_value': 64521.785810209476, 'nu': 0.5}. Best is trial 386 with value: 0.4872991004520934.
[I 2024-12-04 15:10:02,071] Trial 1479 finished with value: 0.48830341536445143 and parameters: {'kernel_type': 'Matern', 'length_scale': 903.843930689113, 'noise_level': 0.8949185488695036, 'constant_value': 209.77723458654015, 'nu': 0.5}. Best is trial 386 with value: 0.4872991004520934.
[I 2024-12-04 15:10:02,427] Trial 1482 finished with value: 0.4883034236889658 and parameters: {'kernel_type': 'Matern', 'length_scale': 2240.8305086434048, 'noise_level': 0.009966235216367816, 'constant_value': 2359.6704460395463, 'nu': 0.5}. Best is trial 386 with value: 0.4872991004520934.
[I 2024-12-04 15:10:02,538] Trial 1483 finished with value: 0.4883034277559233 and parameters: {'kernel_type': 'Matern', 'length_scale': 54903.75928443512, 'noise_level': 0.17939341416901441, 'constant_value': 90754.70356767435, 'nu': 0.5}. Best is trial 386 with value: 0.4872991004520934.
[I 2024-12-04 15:10:02,703] Trial 1477 finished with value: 1.2401112328532125 and parameters: {'kernel_type': 'Matern', 'length_scale': 10.762375515109598, 'noise_level': 3.496234193505097e-07, 'constant_value': 1.3164554528771182e-07, 'nu': 0.5}. Best is trial 386 with value: 0.4872991004520934.
[I 2024-12-04 15:10:02,866] Trial 1489 finished with value: 0.4883034362868679 and parameters: {'kernel_type': 'Matern', 'length_scale': 9403.74215932835, 'noise_level': 0.9555852435387648, 'constant_value': 438.51685869950757, 'nu': 0.5}. Best is trial 386 with value: 0.4872991004520934.
[I 2024-12-04 15:10:03,563] Trial 1478 finished with value: 0.4883034153671022 and parameters: {'kernel_type': 'Matern', 'length_scale': 55184.02390666568, 'noise_level': 0.9475833563729112, 'constant_value': 9.45483480119194, 'nu': 0.5}. Best is trial 386 with value: 0.4872991004520934.
[I 2024-12-04 15:10:04,747] Trial 1485 finished with value: 0.48830338222158953 and parameters: {'kernel_type': 'Matern', 'length_scale': 2596.332394272194, 'noise_level': 0.030154575001807044, 'constant_value': 2081.754473186764, 'nu': 0.5}. Best is trial 386 with value: 0.4872991004520934.
[I 2024-12-04 15:10:05,644] Trial 1492 finished with value: 0.4883034183601506 and parameters: {'kernel_type': 'Matern', 'length_scale': 62447.85033285898, 'noise_level': 0.8922503977694481, 'constant_value': 72834.86446954023, 'nu': 0.5}. Best is trial 386 with value: 0.4872991004520934.
[I 2024-12-04 15:10:06,082] Trial 1486 finished with value: 1.261454795394147 and parameters: {'kernel_type': 'Matern', 'length_scale': 354.5663559892382, 'noise_level': 0.041202932744890015, 'constant_value': 70897.44042852594, 'nu': 0.5}. Best is trial 386 with value: 0.4872991004520934.
[I 2024-12-04 15:10:06,623] Trial 1484 finished with value: 0.4883034170321053 and parameters: {'kernel_type': 'Matern', 'length_scale': 777.9491217517124, 'noise_level': 0.04945339260562213, 'constant_value': 66315.36209573303, 'nu': 0.5}. Best is trial 386 with value: 0.4872991004520934.
[I 2024-12-04 15:10:06,636] Trial 1488 finished with value: 0.4883034047932423 and parameters: {'kernel_type': 'Matern', 'length_scale': 1095.3643203239074, 'noise_level': 0.9847309490465517, 'constant_value': 215.95914953907229, 'nu': 0.5}. Best is trial 386 with value: 0.4872991004520934.
[I 2024-12-04 15:10:07,206] Trial 1487 finished with value: 0.48830341816399403 and parameters: {'kernel_type': 'Matern', 'length_scale': 77771.07211124359, 'noise_level': 0.3267263785222006, 'constant_value': 168.1138161980118, 'nu': 0.5}. Best is trial 386 with value: 0.4872991004520934.
[I 2024-12-04 15:10:07,398] Trial 1493 finished with value: 0.48830341871682187 and parameters: {'kernel_type': 'Matern', 'length_scale': 1310.9443810094792, 'noise_level': 0.011333338370743939, 'constant_value': 16504.372855778856, 'nu': 0.5}. Best is trial 386 with value: 0.4872991004520934.
[I 2024-12-04 15:10:07,418] Trial 1475 finished with value: 0.4883034189975102 and parameters: {'kernel_type': 'Matern', 'length_scale': 13.564946528430024, 'noise_level': 0.8506644460833966, 'constant_value': 0.0005180328540324282, 'nu': 0.5}. Best is trial 386 with value: 0.4872991004520934.
[I 2024-12-04 15:10:07,648] Trial 1494 finished with value: 1.261454795394147 and parameters: {'kernel_type': 'Matern', 'length_scale': 707.069488788856, 'noise_level': 0.02587591193283338, 'constant_value': 2813.67211786601, 'nu': 0.5}. Best is trial 386 with value: 0.4872991004520934.
[I 2024-12-04 15:10:07,797] Trial 1490 finished with value: 0.48830341609301636 and parameters: {'kernel_type': 'Matern', 'length_scale': 71379.6025847515, 'noise_level': 0.002450804242569336, 'constant_value': 3694.1758707730123, 'nu': 0.5}. Best is trial 386 with value: 0.4872991004520934.
[I 2024-12-04 15:10:07,798] Trial 1481 finished with value: 0.4883033552352829 and parameters: {'kernel_type': 'Matern', 'length_scale': 7.991194046887201, 'noise_level': 0.9063431102458724, 'constant_value': 7089.648689141235, 'nu': 0.5}. Best is trial 386 with value: 0.4872991004520934.
[I 2024-12-04 15:10:09,264] Trial 1496 finished with value: 0.4883037613010035 and parameters: {'kernel_type': 'Matern', 'length_scale': 17.333981974519247, 'noise_level': 0.9341206107557928, 'constant_value': 901.4495327051744, 'nu': 0.5}. Best is trial 386 with value: 0.4872991004520934.
[I 2024-12-04 15:10:12,059] Trial 1491 finished with value: 0.4883033456778462 and parameters: {'kernel_type': 'Matern', 'length_scale': 3.0617510984245686, 'noise_level': 0.009729292082421298, 'constant_value': 0.09680197821903386, 'nu': 0.5}. Best is trial 386 with value: 0.4872991004520934.
[I 2024-12-04 15:10:12,379] Trial 1480 finished with value: 0.48830341822387524 and parameters: {'kernel_type': 'Matern', 'length_scale': 46236.044561290044, 'noise_level': 0.8041812773834397, 'constant_value': 78231.33691056892, 'nu': 0.5}. Best is trial 386 with value: 0.4872991004520934.
[I 2024-12-04 15:10:13,823] Trial 1495 finished with value: 0.48830343312566343 and parameters: {'kernel_type': 'Matern', 'length_scale': 1437.7580836272712, 'noise_level': 0.054539939189134044, 'constant_value': 1852.7152131649332, 'nu': 0.5}. Best is trial 386 with value: 0.4872991004520934.
[I 2024-12-04 15:10:16,591] Trial 1498 finished with value: 0.4883034215471344 and parameters: {'kernel_type': 'Matern', 'length_scale': 150.8457519219808, 'noise_level': 0.020096810599470875, 'constant_value': 35.399441845722734, 'nu': 0.5}. Best is trial 386 with value: 0.4872991004520934.
[I 2024-12-04 15:10:16,676] Trial 1499 finished with value: 1.240111232503656 and parameters: {'kernel_type': 'Matern', 'length_scale': 7.729663878390516, 'noise_level': 0.0035172300917690295, 'constant_value': 4.318028925337052e-05, 'nu': 0.5}. Best is trial 386 with value: 0.4872991004520934.
[I 2024-12-04 15:10:16,700] Trial 1500 finished with value: 0.4883034056927834 and parameters: {'kernel_type': 'Matern', 'length_scale': 1039.5546011649076, 'noise_level': 0.8237678528021346, 'constant_value': 5.790581454838187, 'nu': 0.5}. Best is trial 386 with value: 0.4872991004520934.
