[I 2024-12-04 19:48:22,952] Trial 256 finished with value: 1.0916545032843885 and parameters: {'kernel_type': 'Matern', 'length_scale': 3911.1132445963176, 'noise_level': 0.8388305609759346, 'constant_value': 3.641701368171978e-05, 'nu': 0.5}. Best is trial 199 with value: 0.3592098145876718.
[I 2024-12-04 19:48:27,190] Trial 257 finished with value: 0.35921123616572714 and parameters: {'kernel_type': 'Matern', 'length_scale': 5.322342904566834, 'noise_level': 0.2366460629548197, 'constant_value': 54.37920732327893, 'nu': 0.5}. Best is trial 199 with value: 0.3592098145876718.
[I 2024-12-04 19:48:27,748] Trial 258 finished with value: 0.41956599013025436 and parameters: {'kernel_type': 'Matern', 'length_scale': 0.3560230498441131, 'noise_level': 0.0699801730595465, 'constant_value': 0.022409285422814073, 'nu': 2.5}. Best is trial 199 with value: 0.3592098145876718.
[I 2024-12-04 19:48:27,994] Trial 259 finished with value: 0.3592104863268124 and parameters: {'kernel_type': 'Matern', 'length_scale': 385.00414175472497, 'noise_level': 0.10987939833432574, 'constant_value': 1.3578934324190246, 'nu': 0.5}. Best is trial 199 with value: 0.3592098145876718.
[I 2024-12-04 19:48:32,289] Trial 260 finished with value: 0.4195658741346063 and parameters: {'kernel_type': 'Matern', 'length_scale': 45.59833550983413, 'noise_level': 0.7952523960339358, 'constant_value': 0.05538608732639788, 'nu': 2.5}. Best is trial 199 with value: 0.3592098145876718.
[I 2024-12-04 19:48:32,756] Trial 261 finished with value: 0.3592113153693253 and parameters: {'kernel_type': 'Matern', 'length_scale': 3.7216176182714156, 'noise_level': 0.014191935769967532, 'constant_value': 0.12410220135594018, 'nu': 0.5}. Best is trial 199 with value: 0.3592098145876718.
[I 2024-12-04 19:48:32,929] Trial 262 finished with value: 1.0624161176822555 and parameters: {'kernel_type': 'Matern', 'length_scale': 525.7866703731596, 'noise_level': 0.004310823413891576, 'constant_value': 0.7433556658451606, 'nu': 0.5}. Best is trial 199 with value: 0.3592098145876718.
[I 2024-12-04 19:48:37,527] Trial 265 finished with value: 0.35921100301943665 and parameters: {'kernel_type': 'Matern', 'length_scale': 27.882000906908658, 'noise_level': 0.10850126501381516, 'constant_value': 1.6268979093297038, 'nu': 0.5}. Best is trial 199 with value: 0.3592098145876718.
[I 2024-12-04 19:48:38,356] Trial 263 finished with value: 0.35921124597192605 and parameters: {'kernel_type': 'Matern', 'length_scale': 15.06050319473114, 'noise_level': 0.4133023622975202, 'constant_value': 0.0045524552300383455, 'nu': 0.5}. Best is trial 199 with value: 0.3592098145876718.
[I 2024-12-04 19:48:39,540] Trial 264 finished with value: 1.0624161172710123 and parameters: {'kernel_type': 'Matern', 'length_scale': 365.6166164417321, 'noise_level': 0.006720101681853739, 'constant_value': 3.230588685237399e-07, 'nu': 0.5}. Best is trial 199 with value: 0.3592098145876718.
[I 2024-12-04 19:48:42,079] Trial 266 finished with value: 0.3592112151130426 and parameters: {'kernel_type': 'Matern', 'length_scale': 99.25612710974553, 'noise_level': 0.08039966626150095, 'constant_value': 0.1678335102824244, 'nu': 0.5}. Best is trial 199 with value: 0.3592098145876718.
[I 2024-12-04 19:48:42,749] Trial 267 finished with value: 0.3592111709599422 and parameters: {'kernel_type': 'Matern', 'length_scale': 19.653394429734195, 'noise_level': 0.13393674114896106, 'constant_value': 0.18932110468711608, 'nu': 0.5}. Best is trial 199 with value: 0.3592098145876718.
[I 2024-12-04 19:48:44,520] Trial 268 finished with value: 0.3592112513543183 and parameters: {'kernel_type': 'Matern', 'length_scale': 0.26318043372602457, 'noise_level': 0.018771960121927424, 'constant_value': 56.60436987938562, 'nu': 0.5}. Best is trial 199 with value: 0.3592098145876718.
[I 2024-12-04 19:48:47,902] Trial 270 finished with value: 0.3592112379112651 and parameters: {'kernel_type': 'Matern', 'length_scale': 69.6579166466149, 'noise_level': 0.00017223704737364366, 'constant_value': 272.84663131676604, 'nu': 0.5}. Best is trial 199 with value: 0.3592098145876718.
[I 2024-12-04 19:48:49,031] Trial 271 finished with value: 0.35921104828316347 and parameters: {'kernel_type': 'Matern', 'length_scale': 2.204414254557177, 'noise_level': 0.5951904229097892, 'constant_value': 0.6688598227493053, 'nu': 0.5}. Best is trial 199 with value: 0.3592098145876718.
[I 2024-12-04 19:48:50,831] Trial 272 finished with value: 1.0916567257364687 and parameters: {'kernel_type': 'RBF', 'length_scale': 1.077266522615042, 'noise_level': 4.390973945141664e-07, 'constant_value': 57.85526198955486, 'nu': 1.5}. Best is trial 199 with value: 0.3592098145876718.
[I 2024-12-04 19:48:51,414] Trial 269 finished with value: 1.06241611803101 and parameters: {'kernel_type': 'Matern', 'length_scale': 57.11942201300642, 'noise_level': 0.011201955146986508, 'constant_value': 0.0008571843129479904, 'nu': 0.5}. Best is trial 199 with value: 0.3592098145876718.
[I 2024-12-04 19:48:52,456] Trial 273 finished with value: 1.0916558493878465 and parameters: {'kernel_type': 'Matern', 'length_scale': 6.62798695754818e-05, 'noise_level': 3.819761111064723e-09, 'constant_value': 501.4626476297882, 'nu': 1.5}. Best is trial 199 with value: 0.3592098145876718.
[I 2024-12-04 19:48:53,486] Trial 274 finished with value: 1.0916558493868078 and parameters: {'kernel_type': 'RBF', 'length_scale': 0.00012178653802410246, 'noise_level': 7.676798287133536e-06, 'constant_value': 1.1937854143814213, 'nu': 0.5}. Best is trial 199 with value: 0.3592098145876718.
[I 2024-12-04 19:48:56,081] Trial 275 finished with value: 1.06241611921115 and parameters: {'kernel_type': 'Matern', 'length_scale': 20.26618580633388, 'noise_level': 0.0011785264666955612, 'constant_value': 0.22623580685443323, 'nu': 1.5}. Best is trial 199 with value: 0.3592098145876718.
[I 2024-12-04 19:48:58,199] Trial 277 finished with value: 0.3592112447545558 and parameters: {'kernel_type': 'Matern', 'length_scale': 1.0596830373549622, 'noise_level': 0.0010631429937688593, 'constant_value': 7476.954080489569, 'nu': 0.5}. Best is trial 199 with value: 0.3592098145876718.
[I 2024-12-04 19:49:01,765] Trial 278 finished with value: 0.3592112386593809 and parameters: {'kernel_type': 'Matern', 'length_scale': 1458.0930413600254, 'noise_level': 0.03517686949297593, 'constant_value': 1.7170962996515557, 'nu': 0.5}. Best is trial 199 with value: 0.3592098145876718.
[I 2024-12-04 19:49:02,209] Trial 279 finished with value: 0.35921061618951405 and parameters: {'kernel_type': 'Matern', 'length_scale': 108.48737175883637, 'noise_level': 0.11781872133156134, 'constant_value': 1.2946587764538564, 'nu': 0.5}. Best is trial 199 with value: 0.3592098145876718.
[I 2024-12-04 19:49:05,080] Trial 276 finished with value: 0.3592112409780627 and parameters: {'kernel_type': 'Matern', 'length_scale': 109.39600340427586, 'noise_level': 0.8104462019892689, 'constant_value': 6.15294769962269e-05, 'nu': 0.5}. Best is trial 199 with value: 0.3592098145876718.
[I 2024-12-04 19:49:06,485] Trial 280 finished with value: 0.35921122875176525 and parameters: {'kernel_type': 'Matern', 'length_scale': 30.752798805972006, 'noise_level': 0.495470517764457, 'constant_value': 0.42309110417048645, 'nu': 0.5}. Best is trial 199 with value: 0.3592098145876718.
[I 2024-12-04 19:49:09,986] Trial 282 finished with value: 0.35921116499871625 and parameters: {'kernel_type': 'Matern', 'length_scale': 333.31811907359776, 'noise_level': 0.17436648896451235, 'constant_value': 1.1294337951232136, 'nu': 0.5}. Best is trial 199 with value: 0.3592098145876718.
[I 2024-12-04 19:49:10,592] Trial 281 finished with value: 1.0624161169993047 and parameters: {'kernel_type': 'Matern', 'length_scale': 7076.993393393607, 'noise_level': 0.020516009990360327, 'constant_value': 0.01310339438802899, 'nu': 0.5}. Best is trial 199 with value: 0.3592098145876718.
[I 2024-12-04 19:49:11,929] Trial 283 finished with value: 0.35921109359030423 and parameters: {'kernel_type': 'Matern', 'length_scale': 158.11533494059444, 'noise_level': 0.020380845233532095, 'constant_value': 0.12681652191662732, 'nu': 0.5}. Best is trial 199 with value: 0.3592098145876718.
[I 2024-12-04 19:49:14,535] Trial 284 finished with value: 0.35921080179583526 and parameters: {'kernel_type': 'Matern', 'length_scale': 202.46211130724612, 'noise_level': 0.6092657085626974, 'constant_value': 26.111234052592195, 'nu': 0.5}. Best is trial 199 with value: 0.3592098145876718.
[I 2024-12-04 19:49:16,894] Trial 285 finished with value: 0.4513960208210748 and parameters: {'kernel_type': 'Matern', 'length_scale': 0.12465812410288465, 'noise_level': 0.39812220104861884, 'constant_value': 6.144968488980652, 'nu': 1.5}. Best is trial 199 with value: 0.3592098145876718.
[I 2024-12-04 19:49:18,934] Trial 286 finished with value: 0.35921212995335194 and parameters: {'kernel_type': 'Matern', 'length_scale': 1.2967540315996753, 'noise_level': 0.0359555938001273, 'constant_value': 0.0002661533189205563, 'nu': 0.5}. Best is trial 199 with value: 0.3592098145876718.
[I 2024-12-04 19:49:19,220] Trial 287 finished with value: 0.35921086154554815 and parameters: {'kernel_type': 'Matern', 'length_scale': 120.33057663245673, 'noise_level': 0.6003689654209218, 'constant_value': 9.686066954782758, 'nu': 0.5}. Best is trial 199 with value: 0.3592098145876718.
[I 2024-12-04 19:49:21,602] Trial 288 finished with value: 0.35921127332794506 and parameters: {'kernel_type': 'Matern', 'length_scale': 68.97152742108456, 'noise_level': 0.8909290390219919, 'constant_value': 6751.915037801043, 'nu': 0.5}. Best is trial 199 with value: 0.3592098145876718.
[I 2024-12-04 19:49:23,004] Trial 289 finished with value: 0.3592111502558296 and parameters: {'kernel_type': 'Matern', 'length_scale': 236.41108375744452, 'noise_level': 0.12829588739928585, 'constant_value': 5.7773983345262145, 'nu': 0.5}. Best is trial 199 with value: 0.3592098145876718.
[I 2024-12-04 19:49:24,265] Trial 290 finished with value: 0.35921123583482495 and parameters: {'kernel_type': 'Matern', 'length_scale': 1215.7604760490754, 'noise_level': 0.8258620829810365, 'constant_value': 41.96101452680111, 'nu': 0.5}. Best is trial 199 with value: 0.3592098145876718.
[I 2024-12-04 19:49:26,342] Trial 291 finished with value: 0.35921075987992473 and parameters: {'kernel_type': 'Matern', 'length_scale': 131.84445766245227, 'noise_level': 0.8363122330225552, 'constant_value': 1.6489694410499764, 'nu': 0.5}. Best is trial 199 with value: 0.3592098145876718.
[I 2024-12-04 19:49:27,995] Trial 292 finished with value: 0.35921123517503467 and parameters: {'kernel_type': 'Matern', 'length_scale': 642.4459214064293, 'noise_level': 0.5702301748019071, 'constant_value': 60.27822667608791, 'nu': 0.5}. Best is trial 199 with value: 0.3592098145876718.
[I 2024-12-04 19:49:29,241] Trial 293 finished with value: 0.359211186066571 and parameters: {'kernel_type': 'Matern', 'length_scale': 10.004701398114252, 'noise_level': 0.34169216468521857, 'constant_value': 129.20154289851374, 'nu': 0.5}. Best is trial 199 with value: 0.3592098145876718.
[I 2024-12-04 19:49:31,524] Trial 294 finished with value: 0.35921139363005117 and parameters: {'kernel_type': 'Matern', 'length_scale': 2.0169611077300016, 'noise_level': 0.1286339221475116, 'constant_value': 22.15885538999419, 'nu': 0.5}. Best is trial 199 with value: 0.3592098145876718.
[I 2024-12-04 19:49:32,633] Trial 295 finished with value: 0.35921132518072346 and parameters: {'kernel_type': 'Matern', 'length_scale': 787.4659006804263, 'noise_level': 0.07475666745477268, 'constant_value': 8.136736866145299, 'nu': 0.5}. Best is trial 199 with value: 0.3592098145876718.
[I 2024-12-04 19:49:34,032] Trial 296 finished with value: 0.359211435079758 and parameters: {'kernel_type': 'Matern', 'length_scale': 32.816510168241656, 'noise_level': 0.008471257156086959, 'constant_value': 35.70920216488171, 'nu': 0.5}. Best is trial 199 with value: 0.3592098145876718.
[I 2024-12-04 19:49:34,499] Trial 297 finished with value: 1.0916567225865517 and parameters: {'kernel_type': 'Matern', 'length_scale': 0.9042543269829878, 'noise_level': 1.327706342508303e-07, 'constant_value': 208.41759472307953, 'nu': 2.5}. Best is trial 199 with value: 0.3592098145876718.
[I 2024-12-04 19:49:37,616] Trial 298 finished with value: 0.35921124679691807 and parameters: {'kernel_type': 'Matern', 'length_scale': 10.714139588477904, 'noise_level': 0.5456453476199026, 'constant_value': 2.26865612349904, 'nu': 0.5}. Best is trial 199 with value: 0.3592098145876718.
[I 2024-12-04 19:49:38,923] Trial 299 finished with value: 0.35921121825613256 and parameters: {'kernel_type': 'Matern', 'length_scale': 170.22755198883684, 'noise_level': 0.24964329082364406, 'constant_value': 0.010652485329665402, 'nu': 0.5}. Best is trial 199 with value: 0.3592098145876718.
[I 2024-12-04 19:49:42,821] Trial 300 finished with value: 0.35922090374917226 and parameters: {'kernel_type': 'Matern', 'length_scale': 1660.2769380359189, 'noise_level': 0.8328800186487733, 'constant_value': 0.005980529412079817, 'nu': 0.5}. Best is trial 199 with value: 0.3592098145876718.
[I 2024-12-04 19:49:43,068] Trial 301 finished with value: 1.0624161173437698 and parameters: {'kernel_type': 'RBF', 'length_scale': 46.020952142841416, 'noise_level': 1.2454136758453543e-08, 'constant_value': 97310.34935187337, 'nu': 1.5}. Best is trial 199 with value: 0.3592098145876718.
[I 2024-12-04 19:49:43,207] Trial 302 finished with value: 0.35921476035178046 and parameters: {'kernel_type': 'Matern', 'length_scale': 16.439603889030977, 'noise_level': 0.23631897965332543, 'constant_value': 31.204560850821306, 'nu': 0.5}. Best is trial 199 with value: 0.3592098145876718.
[I 2024-12-04 19:49:47,838] Trial 304 finished with value: 1.0624161172687405 and parameters: {'kernel_type': 'Matern', 'length_scale': 0.00469059589605532, 'noise_level': 0.00014833251206790147, 'constant_value': 0.43193413075590803, 'nu': 0.5}. Best is trial 199 with value: 0.3592098145876718.
[I 2024-12-04 19:49:47,850] Trial 303 finished with value: 1.0624161172708677 and parameters: {'kernel_type': 'RBF', 'length_scale': 61.15793450686653, 'noise_level': 1.7734970836020014e-10, 'constant_value': 751.137398026666, 'nu': 2.5}. Best is trial 199 with value: 0.3592098145876718.
[I 2024-12-04 19:49:49,396] Trial 305 finished with value: 0.35921123882889805 and parameters: {'kernel_type': 'Matern', 'length_scale': 51.14688424847661, 'noise_level': 0.9294380567852097, 'constant_value': 0.4256964743542313, 'nu': 0.5}. Best is trial 199 with value: 0.3592098145876718.
[I 2024-12-04 19:49:51,993] Trial 306 finished with value: 0.35921110623057095 and parameters: {'kernel_type': 'Matern', 'length_scale': 397.56422161558896, 'noise_level': 0.6122367280010562, 'constant_value': 9.97100289460035, 'nu': 0.5}. Best is trial 199 with value: 0.3592098145876718.
[I 2024-12-04 19:49:53,147] Trial 307 finished with value: 0.3592112406297833 and parameters: {'kernel_type': 'Matern', 'length_scale': 1.2447839791009876, 'noise_level': 0.5286833436287764, 'constant_value': 0.02559791008791414, 'nu': 0.5}. Best is trial 199 with value: 0.3592098145876718.
[I 2024-12-04 19:49:55,489] Trial 308 finished with value: 1.0624161174935685 and parameters: {'kernel_type': 'Matern', 'length_scale': 262.7354115364048, 'noise_level': 5.2631538339163244e-08, 'constant_value': 0.3666605818538174, 'nu': 1.5}. Best is trial 199 with value: 0.3592098145876718.
[I 2024-12-04 19:49:57,552] Trial 309 finished with value: 0.428684196465074 and parameters: {'kernel_type': 'RBF', 'length_scale': 1.8766481824589414, 'noise_level': 0.0009268584113653271, 'constant_value': 75019.96013462146, 'nu': 2.5}. Best is trial 199 with value: 0.3592098145876718.
[I 2024-12-04 19:49:57,787] Trial 310 finished with value: 0.35921126186461133 and parameters: {'kernel_type': 'Matern', 'length_scale': 1.3443675899672154, 'noise_level': 0.01203926719680198, 'constant_value': 1.2781766190676125, 'nu': 0.5}. Best is trial 199 with value: 0.3592098145876718.
[I 2024-12-04 19:50:00,098] Trial 311 finished with value: 0.359211205025284 and parameters: {'kernel_type': 'Matern', 'length_scale': 234.18135885245889, 'noise_level': 0.008378190774681386, 'constant_value': 2.0455249224405407, 'nu': 0.5}. Best is trial 199 with value: 0.3592098145876718.
[I 2024-12-04 19:50:03,493] Trial 312 finished with value: 0.42268981220296653 and parameters: {'kernel_type': 'Matern', 'length_scale': 504.5818129736607, 'noise_level': 0.17719683828018107, 'constant_value': 1.0925100675945334, 'nu': 1.5}. Best is trial 199 with value: 0.3592098145876718.
[I 2024-12-04 19:50:06,049] Trial 313 finished with value: 1.0624161173025497 and parameters: {'kernel_type': 'Matern', 'length_scale': 16.069682440703357, 'noise_level': 0.0031136592784267664, 'constant_value': 0.002787405474622737, 'nu': 0.5}. Best is trial 199 with value: 0.3592098145876718.
[I 2024-12-04 19:50:07,419] Trial 315 finished with value: 0.428683517352423 and parameters: {'kernel_type': 'RBF', 'length_scale': 0.775318175571678, 'noise_level': 0.03717554458334175, 'constant_value': 0.8028132052519554, 'nu': 0.5}. Best is trial 199 with value: 0.3592098145876718.
[I 2024-12-04 19:50:08,636] Trial 314 finished with value: 1.062416118320298 and parameters: {'kernel_type': 'Matern', 'length_scale': 145.49664548317244, 'noise_level': 0.012619864702582815, 'constant_value': 0.010118993117094358, 'nu': 0.5}. Best is trial 199 with value: 0.3592098145876718.
[I 2024-12-04 19:50:12,287] Trial 318 finished with value: 0.4195660018457047 and parameters: {'kernel_type': 'Matern', 'length_scale': 7.835390752068972, 'noise_level': 0.8582727823090954, 'constant_value': 3.12436521437261, 'nu': 2.5}. Best is trial 199 with value: 0.3592098145876718.
[I 2024-12-04 19:50:12,301] Trial 317 finished with value: 0.3592112341722349 and parameters: {'kernel_type': 'Matern', 'length_scale': 6.384786665369122, 'noise_level': 0.0015644266817996296, 'constant_value': 15.151659737376683, 'nu': 0.5}. Best is trial 199 with value: 0.3592098145876718.
[I 2024-12-04 19:50:13,644] Trial 316 finished with value: 1.0624161172694802 and parameters: {'kernel_type': 'RBF', 'length_scale': 2943.592566271177, 'noise_level': 5.6950963562114605e-09, 'constant_value': 22.1014831968295, 'nu': 0.5}. Best is trial 199 with value: 0.3592098145876718.
[I 2024-12-04 19:50:16,913] Trial 320 finished with value: 0.35921127728453917 and parameters: {'kernel_type': 'Matern', 'length_scale': 3.65145566454292, 'noise_level': 0.6260653966172652, 'constant_value': 10.056886577594552, 'nu': 0.5}. Best is trial 199 with value: 0.3592098145876718.
[I 2024-12-04 19:50:19,354] Trial 319 finished with value: 0.3592112567382404 and parameters: {'kernel_type': 'Matern', 'length_scale': 150.4447120213799, 'noise_level': 0.7696168670560646, 'constant_value': 0.03874986801971994, 'nu': 0.5}. Best is trial 199 with value: 0.3592098145876718.
[I 2024-12-04 19:50:21,228] Trial 322 finished with value: 1.0916558493878512 and parameters: {'kernel_type': 'Matern', 'length_scale': 0.020427371735231854, 'noise_level': 3.3805613386941236e-06, 'constant_value': 496.5687051025574, 'nu': 0.5}. Best is trial 199 with value: 0.3592098145876718.
[I 2024-12-04 19:50:25,884] Trial 324 finished with value: 0.35921105735100195 and parameters: {'kernel_type': 'Matern', 'length_scale': 94.11486909382617, 'noise_level': 0.6241214837428765, 'constant_value': 1.971394676619726, 'nu': 0.5}. Best is trial 199 with value: 0.3592098145876718.
[I 2024-12-04 19:50:26,311] Trial 323 finished with value: 1.0624161174708227 and parameters: {'kernel_type': 'RBF', 'length_scale': 62770.60272861442, 'noise_level': 0.0023626401161552114, 'constant_value': 52265.65245466767, 'nu': 2.5}. Best is trial 199 with value: 0.3592098145876718.
[I 2024-12-04 19:50:28,564] Trial 321 finished with value: 0.41956600539662786 and parameters: {'kernel_type': 'Matern', 'length_scale': 19729.766966599203, 'noise_level': 0.6918711951212652, 'constant_value': 22.531400993814938, 'nu': 2.5}. Best is trial 199 with value: 0.3592098145876718.
[I 2024-12-04 19:50:31,285] Trial 327 finished with value: 1.091656704854988 and parameters: {'kernel_type': 'Matern', 'length_scale': 156.84994146455918, 'noise_level': 0.007081631859427777, 'constant_value': 1866.4736037879836, 'nu': 0.5}. Best is trial 199 with value: 0.3592098145876718.
[I 2024-12-04 19:50:32,016] Trial 326 finished with value: 1.0624161172061928 and parameters: {'kernel_type': 'Matern', 'length_scale': 8687.250094573414, 'noise_level': 0.013070395004350522, 'constant_value': 5.816075408630313, 'nu': 0.5}. Best is trial 199 with value: 0.3592098145876718.
[I 2024-12-04 19:50:32,699] Trial 325 finished with value: 0.42269000127098183 and parameters: {'kernel_type': 'Matern', 'length_scale': 67.23668798095689, 'noise_level': 0.7743752349187062, 'constant_value': 4182.185680480314, 'nu': 1.5}. Best is trial 199 with value: 0.3592098145876718.
[I 2024-12-04 19:50:35,735] Trial 328 finished with value: 0.35921148337253805 and parameters: {'kernel_type': 'Matern', 'length_scale': 0.49807754059771636, 'noise_level': 7.096664956995841e-05, 'constant_value': 40.039620749014006, 'nu': 0.5}. Best is trial 199 with value: 0.3592098145876718.
[I 2024-12-04 19:50:39,616] Trial 329 finished with value: 0.3592112364582954 and parameters: {'kernel_type': 'Matern', 'length_scale': 94869.62142233248, 'noise_level': 0.508038499290736, 'constant_value': 1.4710462376185462, 'nu': 0.5}. Best is trial 199 with value: 0.3592098145876718.
[I 2024-12-04 19:50:41,510] Trial 331 finished with value: 0.3592112126545394 and parameters: {'kernel_type': 'Matern', 'length_scale': 87700.06874241159, 'noise_level': 0.25950161631391105, 'constant_value': 4944.044930595868, 'nu': 0.5}. Best is trial 199 with value: 0.3592098145876718.
