[I 2024-12-03 18:56:00,979] Trial 1079 finished with value: 0.13608690451284608 and parameters: {'kernel': 'linear', 'C': 91.65482894809458, 'gamma': 0.0008288185724796935, 'epsilon': 0.06932642199922938}. Best is trial 345 with value: 0.13438257115663557.
[I 2024-12-03 18:56:01,017] Trial 1107 finished with value: 0.14145864953442264 and parameters: {'kernel': 'linear', 'C': 6.912676020222216, 'gamma': 0.010158396132180074, 'epsilon': 0.08326212078310569}. Best is trial 345 with value: 0.13438257115663557.
[I 2024-12-03 18:56:01,086] Trial 1069 finished with value: 0.13790092224556488 and parameters: {'kernel': 'linear', 'C': 53.77973689898754, 'gamma': 0.005348995681569726, 'epsilon': 0.00957943467424835}. Best is trial 345 with value: 0.13438257115663557.
[I 2024-12-03 18:56:01,466] Trial 1034 finished with value: 0.13563488184099345 and parameters: {'kernel': 'linear', 'C': 88.08537309758526, 'gamma': 0.017696005376817717, 'epsilon': 0.026532535545529746}. Best is trial 345 with value: 0.13438257115663557.
[I 2024-12-03 18:56:04,484] Trial 1115 finished with value: 112.33310123909052 and parameters: {'kernel': 'sigmoid', 'C': 9.545605764349297, 'gamma': 0.020197018942378714, 'epsilon': 0.035844396792327954}. Best is trial 345 with value: 0.13438257115663557.
[I 2024-12-03 18:56:06,408] Trial 1116 finished with value: 1.222022829798491 and parameters: {'kernel': 'rbf', 'C': 0.0070749554018573885, 'gamma': 0.049222016165166554, 'epsilon': 0.01576940721135165}. Best is trial 345 with value: 0.13438257115663557.
[I 2024-12-03 18:56:07,278] Trial 1097 finished with value: 0.1351121797418312 and parameters: {'kernel': 'linear', 'C': 28.654140753156778, 'gamma': 0.006213271664760545, 'epsilon': 0.03230146536179527}. Best is trial 345 with value: 0.13438257115663557.
[I 2024-12-03 18:56:08,608] Trial 1118 finished with value: 1.327575848404356 and parameters: {'kernel': 'sigmoid', 'C': 0.0014278860779483777, 'gamma': 0.018383638267270647, 'epsilon': 0.28723235337683645}. Best is trial 345 with value: 0.13438257115663557.
[I 2024-12-03 18:56:09,392] Trial 1109 finished with value: 0.1355846176194776 and parameters: {'kernel': 'linear', 'C': 12.400781569670974, 'gamma': 0.003970451383008169, 'epsilon': 0.0280536214784745}. Best is trial 345 with value: 0.13438257115663557.
[I 2024-12-03 18:56:10,359] Trial 1105 finished with value: 0.13596659405763992 and parameters: {'kernel': 'linear', 'C': 18.700970036772, 'gamma': 0.001956711238113582, 'epsilon': 0.05239976357173031}. Best is trial 345 with value: 0.13438257115663557.
[I 2024-12-03 18:56:10,677] Trial 1120 finished with value: 1.0069508241692193 and parameters: {'kernel': 'poly', 'C': 1.1275509815398463, 'gamma': 0.006910732859425297, 'epsilon': 0.039532861240316644}. Best is trial 345 with value: 0.13438257115663557.
[I 2024-12-03 18:56:11,915] Trial 1103 finished with value: 0.13764778420282456 and parameters: {'kernel': 'linear', 'C': 14.246142691264845, 'gamma': 0.010891791933106021, 'epsilon': 0.018226894117443226}. Best is trial 345 with value: 0.13438257115663557.
[I 2024-12-03 18:56:12,934] Trial 1119 finished with value: 0.13767864651970282 and parameters: {'kernel': 'linear', 'C': 2.738302355548397, 'gamma': 0.008265753979734348, 'epsilon': 0.019702429552521415}. Best is trial 345 with value: 0.13438257115663557.
[I 2024-12-03 18:56:14,003] Trial 1124 finished with value: 172.08423629465253 and parameters: {'kernel': 'sigmoid', 'C': 42.73378894800855, 'gamma': 0.007864867387651723, 'epsilon': 0.09159419005747803}. Best is trial 345 with value: 0.13438257115663557.
[I 2024-12-03 18:56:18,332] Trial 1114 finished with value: 0.13525500925927472 and parameters: {'kernel': 'linear', 'C': 17.943671249397422, 'gamma': 0.0046411283529814076, 'epsilon': 0.0599757958543987}. Best is trial 345 with value: 0.13438257115663557.
[I 2024-12-03 18:56:22,772] Trial 1102 finished with value: 0.13753024736629937 and parameters: {'kernel': 'linear', 'C': 24.258223210602043, 'gamma': 0.0151976225886261, 'epsilon': 0.01932947649518026}. Best is trial 345 with value: 0.13438257115663557.
[I 2024-12-03 18:56:24,252] Trial 1127 finished with value: 0.1502446704007213 and parameters: {'kernel': 'linear', 'C': 0.639810156191846, 'gamma': 0.0016842528654426813, 'epsilon': 0.06117947943528084}. Best is trial 345 with value: 0.13438257115663557.
[I 2024-12-03 18:56:24,941] Trial 1123 finished with value: 0.13851719005873356 and parameters: {'kernel': 'linear', 'C': 10.744684551817542, 'gamma': 0.0017882218785399966, 'epsilon': 0.017982688997481906}. Best is trial 345 with value: 0.13438257115663557.
[I 2024-12-03 18:56:25,909] Trial 1111 finished with value: 0.13508824339120643 and parameters: {'kernel': 'linear', 'C': 27.544127774932562, 'gamma': 0.00895151471716585, 'epsilon': 0.06332848287001065}. Best is trial 345 with value: 0.13438257115663557.
[I 2024-12-03 18:56:27,336] Trial 1129 finished with value: 0.1399015595950591 and parameters: {'kernel': 'linear', 'C': 2.089292450366021, 'gamma': 0.0033885438413220914, 'epsilon': 0.0591071256847785}. Best is trial 345 with value: 0.13438257115663557.
[I 2024-12-03 18:56:27,786] Trial 1039 finished with value: 0.13814782083515295 and parameters: {'kernel': 'linear', 'C': 88.3603678279584, 'gamma': 0.0038446399893875124, 'epsilon': 0.01069897418689985}. Best is trial 345 with value: 0.13438257115663557.
[I 2024-12-03 18:56:28,183] Trial 1130 finished with value: 0.13901160357850775 and parameters: {'kernel': 'linear', 'C': 2.3256818477540193, 'gamma': 0.07957705784253603, 'epsilon': 0.06673379901375481}. Best is trial 345 with value: 0.13438257115663557.
[I 2024-12-03 18:56:28,893] Trial 1094 finished with value: 0.13560790251729768 and parameters: {'kernel': 'linear', 'C': 96.52978679442447, 'gamma': 0.007312211423811959, 'epsilon': 0.06694890372384897}. Best is trial 345 with value: 0.13438257115663557.
[I 2024-12-03 18:56:30,350] Trial 1112 finished with value: 0.13607217280734166 and parameters: {'kernel': 'linear', 'C': 34.776353940781284, 'gamma': 0.011998940879076426, 'epsilon': 0.04216297136563414}. Best is trial 345 with value: 0.13438257115663557.
[I 2024-12-03 18:56:31,497] Trial 1133 finished with value: 0.23122384125581177 and parameters: {'kernel': 'rbf', 'C': 54.085747935661026, 'gamma': 0.00035410875959684707, 'epsilon': 0.014036731742590926}. Best is trial 345 with value: 0.13438257115663557.
[I 2024-12-03 18:56:32,134] Trial 1077 finished with value: 0.13612091944723032 and parameters: {'kernel': 'linear', 'C': 99.42754864504751, 'gamma': 0.0027848416408720236, 'epsilon': 0.04225690281052025}. Best is trial 345 with value: 0.13438257115663557.
[I 2024-12-03 18:56:32,404] Trial 1135 finished with value: 0.7623595727078272 and parameters: {'kernel': 'poly', 'C': 66.4993576263765, 'gamma': 0.0029475483791968167, 'epsilon': 0.12321500027339573}. Best is trial 345 with value: 0.13438257115663557.
[I 2024-12-03 18:56:33,975] Trial 1137 finished with value: 0.17606851168897747 and parameters: {'kernel': 'linear', 'C': 7.019290118849041, 'gamma': 0.012054489469090485, 'epsilon': 0.21057518430819977}. Best is trial 345 with value: 0.13438257115663557.
[I 2024-12-03 18:56:34,615] Trial 1110 finished with value: 0.13965313275022975 and parameters: {'kernel': 'linear', 'C': 99.05353482548273, 'gamma': 0.014732161952120284, 'epsilon': 0.08617198829497241}. Best is trial 345 with value: 0.13438257115663557.
[I 2024-12-03 18:56:35,628] Trial 1089 finished with value: 0.13572291960454735 and parameters: {'kernel': 'linear', 'C': 76.01885263375054, 'gamma': 0.012321752919678802, 'epsilon': 0.034542233519951046}. Best is trial 345 with value: 0.13438257115663557.
[I 2024-12-03 18:56:35,890] Trial 1085 finished with value: 0.13818846885758515 and parameters: {'kernel': 'linear', 'C': 77.1379037215981, 'gamma': 0.004949995025686578, 'epsilon': 0.017120635264590102}. Best is trial 345 with value: 0.13438257115663557.
[I 2024-12-03 18:56:35,899] Trial 1140 finished with value: 315.17712076281947 and parameters: {'kernel': 'sigmoid', 'C': 22.26977557155677, 'gamma': 0.02836861972183585, 'epsilon': 0.001193644412033976}. Best is trial 345 with value: 0.13438257115663557.
[I 2024-12-03 18:56:36,383] Trial 1061 finished with value: 0.135549333969635 and parameters: {'kernel': 'linear', 'C': 90.2541257809908, 'gamma': 0.005273142061987353, 'epsilon': 0.02697879061105518}. Best is trial 345 with value: 0.13438257115663557.
[I 2024-12-03 18:56:37,980] Trial 1143 finished with value: 0.412888221907209 and parameters: {'kernel': 'poly', 'C': 95.28207483607372, 'gamma': 0.0050687506284384275, 'epsilon': 0.03562059645454418}. Best is trial 345 with value: 0.13438257115663557.
[I 2024-12-03 18:56:38,672] Trial 1131 finished with value: 0.1369287279218135 and parameters: {'kernel': 'linear', 'C': 23.688145254202098, 'gamma': 0.007135504476254487, 'epsilon': 0.04881147471237109}. Best is trial 345 with value: 0.13438257115663557.
[I 2024-12-03 18:56:39,644] Trial 1145 finished with value: 0.13886026667548743 and parameters: {'kernel': 'linear', 'C': 2.805631456717265, 'gamma': 0.022112453118733364, 'epsilon': 0.06950896881949369}. Best is trial 345 with value: 0.13438257115663557.
[I 2024-12-03 18:56:42,970] Trial 1142 finished with value: 0.34680953849590357 and parameters: {'kernel': 'poly', 'C': 92.89271105071049, 'gamma': 0.01762130562532034, 'epsilon': 0.01204525045444482}. Best is trial 345 with value: 0.13438257115663557.
[I 2024-12-03 18:56:43,629] Trial 1141 finished with value: 0.1360125722675588 and parameters: {'kernel': 'linear', 'C': 7.058953887362319, 'gamma': 0.009878693769546117, 'epsilon': 0.03132833579911241}. Best is trial 345 with value: 0.13438257115663557.
[I 2024-12-03 18:56:44,304] Trial 1148 finished with value: 338.2314880093743 and parameters: {'kernel': 'sigmoid', 'C': 23.19575077530866, 'gamma': 0.07801308916274269, 'epsilon': 0.09434940851429752}. Best is trial 345 with value: 0.13438257115663557.
[I 2024-12-03 18:56:45,878] Trial 1150 finished with value: 0.15450052197914105 and parameters: {'kernel': 'linear', 'C': 1.1345549752761597, 'gamma': 0.17372148714041558, 'epsilon': 0.0917946462055466}. Best is trial 345 with value: 0.13438257115663557.
[I 2024-12-03 18:56:46,647] Trial 1096 finished with value: 0.136035848168066 and parameters: {'kernel': 'linear', 'C': 96.1691696323202, 'gamma': 0.0036961048318457984, 'epsilon': 0.0690003543965398}. Best is trial 345 with value: 0.13438257115663557.
[I 2024-12-03 18:56:47,039] Trial 1149 finished with value: 0.1378825641959286 and parameters: {'kernel': 'linear', 'C': 2.157557344569909, 'gamma': 0.03634315486752521, 'epsilon': 0.0281664049321903}. Best is trial 345 with value: 0.13438257115663557.
[I 2024-12-03 18:56:49,293] Trial 1125 finished with value: 0.13638798769822247 and parameters: {'kernel': 'linear', 'C': 23.254742952574798, 'gamma': 0.007527717502311096, 'epsilon': 0.02433311414930801}. Best is trial 345 with value: 0.13438257115663557.
[I 2024-12-03 18:56:50,383] Trial 1136 finished with value: 0.13516841709941216 and parameters: {'kernel': 'linear', 'C': 20.434717109378617, 'gamma': 0.006409900401890579, 'epsilon': 0.05781624173589829}. Best is trial 345 with value: 0.13438257115663557.
[I 2024-12-03 18:56:50,711] Trial 1154 finished with value: 0.20972958590449525 and parameters: {'kernel': 'rbf', 'C': 12.839885973755678, 'gamma': 0.009597928808320886, 'epsilon': 0.02326661002723957}. Best is trial 345 with value: 0.13438257115663557.
[I 2024-12-03 18:56:53,932] Trial 1134 finished with value: 0.13789286677496684 and parameters: {'kernel': 'linear', 'C': 20.9965566089425, 'gamma': 0.008797394466134579, 'epsilon': 0.01265905465957021}. Best is trial 345 with value: 0.13438257115663557.
[I 2024-12-03 18:56:54,382] Trial 1099 finished with value: 0.1352211720889313 and parameters: {'kernel': 'linear', 'C': 96.65665352156549, 'gamma': 0.002020554220619825, 'epsilon': 0.060619579940995615}. Best is trial 345 with value: 0.13438257115663557.
[I 2024-12-03 18:56:54,710] Trial 1156 finished with value: 0.14071721109950971 and parameters: {'kernel': 'linear', 'C': 9.6115213043234, 'gamma': 0.00736485435757388, 'epsilon': 0.08903987350570089}. Best is trial 345 with value: 0.13438257115663557.
[I 2024-12-03 18:56:57,242] Trial 1153 finished with value: 0.1442329048938814 and parameters: {'kernel': 'linear', 'C': 25.772545145469266, 'gamma': 0.015236484447989975, 'epsilon': 0.11882737428793068}. Best is trial 345 with value: 0.13438257115663557.
[I 2024-12-03 18:56:58,305] Trial 1160 finished with value: 0.3667555134695058 and parameters: {'kernel': 'rbf', 'C': 4.0534987729296, 'gamma': 0.0004851983894402613, 'epsilon': 0.2004280398234969}. Best is trial 345 with value: 0.13438257115663557.
[I 2024-12-03 18:56:58,968] Trial 1151 finished with value: 0.13686195871813747 and parameters: {'kernel': 'linear', 'C': 12.423793254911315, 'gamma': 0.002479431572503746, 'epsilon': 0.025187441817506658}. Best is trial 345 with value: 0.13438257115663557.
[I 2024-12-03 18:57:02,051] Trial 1088 finished with value: 0.1381407751244227 and parameters: {'kernel': 'linear', 'C': 99.11964490998841, 'gamma': 0.007675622301191546, 'epsilon': 0.015988854940918406}. Best is trial 345 with value: 0.13438257115663557.
[I 2024-12-03 18:57:02,053] Trial 1138 finished with value: 0.13799171042040403 and parameters: {'kernel': 'linear', 'C': 23.80932342925915, 'gamma': 0.026169384684193633, 'epsilon': 0.006494734763145812}. Best is trial 345 with value: 0.13438257115663557.
[I 2024-12-03 18:57:03,508] Trial 1164 finished with value: 69.18677068919357 and parameters: {'kernel': 'sigmoid', 'C': 3.1537842326466086, 'gamma': 0.6378614047596132, 'epsilon': 0.07847855942790152}. Best is trial 345 with value: 0.13438257115663557.
[I 2024-12-03 18:57:06,687] Trial 1155 finished with value: 0.13718180405420488 and parameters: {'kernel': 'linear', 'C': 18.0955488427425, 'gamma': 0.026852230986325748, 'epsilon': 0.02118861274565461}. Best is trial 345 with value: 0.13438257115663557.
[I 2024-12-03 18:57:11,623] Trial 1126 finished with value: 0.13514391393475 and parameters: {'kernel': 'linear', 'C': 91.71262497435856, 'gamma': 0.024546198680108572, 'epsilon': 0.054046528014405286}. Best is trial 345 with value: 0.13438257115663557.
[I 2024-12-03 18:57:12,186] Trial 1161 finished with value: 0.13507364597184665 and parameters: {'kernel': 'linear', 'C': 30.830558202331495, 'gamma': 0.007063625165017182, 'epsilon': 0.06341569799653177}. Best is trial 345 with value: 0.13438257115663557.
[I 2024-12-03 18:57:12,272] Trial 1152 finished with value: 0.13814505676334804 and parameters: {'kernel': 'linear', 'C': 17.584543381511583, 'gamma': 0.004419119126771752, 'epsilon': 0.011624955902956579}. Best is trial 345 with value: 0.13438257115663557.
[I 2024-12-03 18:57:13,840] Trial 1159 finished with value: 0.1352590995422381 and parameters: {'kernel': 'linear', 'C': 17.684957046027677, 'gamma': 0.0035154101973309394, 'epsilon': 0.0556914620819565}. Best is trial 345 with value: 0.13438257115663557.
[I 2024-12-03 18:57:15,818] Trial 1078 finished with value: 0.13817550892224056 and parameters: {'kernel': 'linear', 'C': 89.5839026464209, 'gamma': 0.003828404241090761, 'epsilon': 0.01021718871398472}. Best is trial 345 with value: 0.13438257115663557.
[I 2024-12-03 18:57:16,232] Trial 1170 finished with value: 0.15241495196898527 and parameters: {'kernel': 'linear', 'C': 15.815667615023049, 'gamma': 0.0067376809356932445, 'epsilon': 0.15319906114936796}. Best is trial 345 with value: 0.13438257115663557.
[I 2024-12-03 18:57:17,083] Trial 1171 finished with value: 452.4105999185845 and parameters: {'kernel': 'sigmoid', 'C': 61.01914627235577, 'gamma': 0.01251284437373257, 'epsilon': 0.014547978035558838}. Best is trial 345 with value: 0.13438257115663557.
[I 2024-12-03 18:57:17,339] Trial 1166 finished with value: 0.13712847794938607 and parameters: {'kernel': 'linear', 'C': 17.911986025749453, 'gamma': 0.0024526265087256825, 'epsilon': 0.046497273974841796}. Best is trial 345 with value: 0.13438257115663557.
[I 2024-12-03 18:57:17,647] Trial 1172 finished with value: 0.22394263974854522 and parameters: {'kernel': 'rbf', 'C': 47.07136404928424, 'gamma': 0.02749300418967389, 'epsilon': 0.07085569519525396}. Best is trial 345 with value: 0.13438257115663557.
[I 2024-12-03 18:57:17,762] Trial 1169 finished with value: 0.1372883705516171 and parameters: {'kernel': 'linear', 'C': 2.7531654157258845, 'gamma': 0.015251902997418297, 'epsilon': 0.024226850408055337}. Best is trial 345 with value: 0.13438257115663557.
[I 2024-12-03 18:57:18,139] Trial 1090 finished with value: 0.13809322989348613 and parameters: {'kernel': 'linear', 'C': 96.11870986762081, 'gamma': 0.0017478283954738775, 'epsilon': 0.015451661759587386}. Best is trial 345 with value: 0.13438257115663557.
[I 2024-12-03 18:57:18,422] Trial 1173 finished with value: 0.4876014497083824 and parameters: {'kernel': 'linear', 'C': 0.23149549170300251, 'gamma': 0.0028841420411493623, 'epsilon': 0.9239557985942951}. Best is trial 345 with value: 0.13438257115663557.
[I 2024-12-03 18:57:18,604] Trial 1106 finished with value: 0.1373902731884736 and parameters: {'kernel': 'linear', 'C': 95.93298458546403, 'gamma': 0.004297934326063938, 'epsilon': 0.021797844470301836}. Best is trial 345 with value: 0.13438257115663557.
[I 2024-12-03 18:57:21,543] Trial 1176 finished with value: 0.3944362744018732 and parameters: {'kernel': 'poly', 'C': 11.250662380747023, 'gamma': 0.016114847090713456, 'epsilon': 0.04279159994953713}. Best is trial 345 with value: 0.13438257115663557.
[I 2024-12-03 18:57:22,111] Trial 1179 finished with value: 0.3082649690834524 and parameters: {'kernel': 'linear', 'C': 19.07082979566476, 'gamma': 0.0420436741245633, 'epsilon': 0.48837110155745594}. Best is trial 345 with value: 0.13438257115663557.
[I 2024-12-03 18:57:22,967] Trial 1178 finished with value: 0.1546602463792091 and parameters: {'kernel': 'rbf', 'C': 88.74769135066981, 'gamma': 0.004455954479170956, 'epsilon': 0.023010412319087088}. Best is trial 345 with value: 0.13438257115663557.
[I 2024-12-03 18:57:23,117] Trial 1121 finished with value: 0.1366199959576632 and parameters: {'kernel': 'linear', 'C': 97.70393650485887, 'gamma': 0.01458404533759754, 'epsilon': 0.043997807569420753}. Best is trial 345 with value: 0.13438257115663557.
[I 2024-12-03 18:57:30,306] Trial 1163 finished with value: 0.13788885298113332 and parameters: {'kernel': 'linear', 'C': 22.48614772371758, 'gamma': 0.0006554896296862007, 'epsilon': 0.015552076003814475}. Best is trial 345 with value: 0.13438257115663557.
[I 2024-12-03 18:57:31,792] Trial 1177 finished with value: 0.13597983675462 and parameters: {'kernel': 'linear', 'C': 17.083825446761626, 'gamma': 0.009490381326261654, 'epsilon': 0.042459671136365805}. Best is trial 345 with value: 0.13438257115663557.
[I 2024-12-03 18:57:31,794] Trial 1167 finished with value: 0.13808450261657218 and parameters: {'kernel': 'linear', 'C': 90.71418827381284, 'gamma': 0.01061444164321892, 'epsilon': 0.07937738697716751}. Best is trial 345 with value: 0.13438257115663557.
[I 2024-12-03 18:57:32,797] Trial 352 finished with value: 0.34590983534354713 and parameters: {'kernel': 'poly', 'C': 75.17415286700681, 'gamma': 0.11711471690019118, 'epsilon': 0.0020691004960773024}. Best is trial 345 with value: 0.13438257115663557.
[I 2024-12-03 18:57:32,799] Trial 1146 finished with value: 0.13614970464135348 and parameters: {'kernel': 'linear', 'C': 85.99677815083969, 'gamma': 0.006186188127634597, 'epsilon': 0.05156748897580237}. Best is trial 345 with value: 0.13438257115663557.
[I 2024-12-03 18:57:33,533] Trial 1162 finished with value: 0.13781506306552163 and parameters: {'kernel': 'linear', 'C': 24.625042578409122, 'gamma': 0.006640240555466625, 'epsilon': 0.018133918046793516}. Best is trial 345 with value: 0.13438257115663557.
[I 2024-12-03 18:57:33,902] Trial 1186 finished with value: 0.19249444363806967 and parameters: {'kernel': 'rbf', 'C': 35.50517881585919, 'gamma': 0.01350304833981706, 'epsilon': 0.01075986329913308}. Best is trial 345 with value: 0.13438257115663557.
[I 2024-12-03 18:57:34,245] Trial 1183 finished with value: 0.136296464795975 and parameters: {'kernel': 'linear', 'C': 17.552312517676278, 'gamma': 0.013951828060694584, 'epsilon': 0.07447036785282482}. Best is trial 345 with value: 0.13438257115663557.
[I 2024-12-03 18:57:35,347] Trial 1175 finished with value: 0.13561135000268942 and parameters: {'kernel': 'linear', 'C': 12.540819816245678, 'gamma': 0.02122467878985869, 'epsilon': 0.03334091248567415}. Best is trial 345 with value: 0.13438257115663557.
[I 2024-12-03 18:57:35,833] Trial 1190 finished with value: 0.16471892626388024 and parameters: {'kernel': 'linear', 'C': 1.5768167484753661, 'gamma': 0.018728678364680645, 'epsilon': 0.13213826823672303}. Best is trial 345 with value: 0.13438257115663557.
[I 2024-12-03 18:57:37,359] Trial 1187 finished with value: 0.14213059427392974 and parameters: {'kernel': 'linear', 'C': 4.105823468586243, 'gamma': 0.06859785612024298, 'epsilon': 0.0836099935220811}. Best is trial 345 with value: 0.13438257115663557.
[I 2024-12-03 18:57:38,757] Trial 1182 finished with value: 0.13645226714897932 and parameters: {'kernel': 'linear', 'C': 16.770989894372367, 'gamma': 0.0014861520217146894, 'epsilon': 0.043183623986308345}. Best is trial 345 with value: 0.13438257115663557.
[I 2024-12-03 18:57:39,437] Trial 1092 finished with value: 0.13730222606828488 and parameters: {'kernel': 'linear', 'C': 97.96573419628757, 'gamma': 0.011659184886956242, 'epsilon': 0.018296233003381217}. Best is trial 345 with value: 0.13438257115663557.
[I 2024-12-03 18:57:42,453] Trial 1194 finished with value: 0.1361500976425011 and parameters: {'kernel': 'linear', 'C': 4.6235441577846705, 'gamma': 0.00222294017154675, 'epsilon': 0.030904174678364715}. Best is trial 345 with value: 0.13438257115663557.
