[I 2024-12-04 13:00:13,818] Trial 1276 finished with value: 0.320505474972904 and parameters: {'n_estimators': 1066, 'learning_rate': 0.08736263484042617, 'max_depth': 4, 'min_samples_split': 2, 'min_samples_leaf': 1, 'subsample': 0.8416825468327854, 'max_features': None}. Best is trial 621 with value: 0.2256726988932517.
[I 2024-12-04 13:00:15,446] Trial 1269 finished with value: 0.2389734468120496 and parameters: {'n_estimators': 1398, 'learning_rate': 0.08027057599135252, 'max_depth': 7, 'min_samples_split': 2, 'min_samples_leaf': 1, 'subsample': 0.7308169469605548, 'max_features': 'sqrt'}. Best is trial 621 with value: 0.2256726988932517.
[I 2024-12-04 13:00:17,256] Trial 1271 finished with value: 0.2790716749167037 and parameters: {'n_estimators': 1373, 'learning_rate': 0.09955064852316416, 'max_depth': 7, 'min_samples_split': 2, 'min_samples_leaf': 2, 'subsample': 0.6817485074793167, 'max_features': 'sqrt'}. Best is trial 621 with value: 0.2256726988932517.
[I 2024-12-04 13:00:24,490] Trial 1279 finished with value: 0.2588481534644437 and parameters: {'n_estimators': 1193, 'learning_rate': 0.09892237902515538, 'max_depth': 7, 'min_samples_split': 6, 'min_samples_leaf': 1, 'subsample': 0.766309814066642, 'max_features': 'sqrt'}. Best is trial 621 with value: 0.2256726988932517.
[I 2024-12-04 13:00:25,397] Trial 1273 finished with value: 0.23524477653819154 and parameters: {'n_estimators': 1452, 'learning_rate': 0.0740895837326287, 'max_depth': 9, 'min_samples_split': 3, 'min_samples_leaf': 1, 'subsample': 0.8015440149358907, 'max_features': 'sqrt'}. Best is trial 621 with value: 0.2256726988932517.
[I 2024-12-04 13:00:28,926] Trial 1274 finished with value: 0.25682140910498824 and parameters: {'n_estimators': 1466, 'learning_rate': 0.05640019700269998, 'max_depth': 7, 'min_samples_split': 4, 'min_samples_leaf': 1, 'subsample': 0.6956310591328108, 'max_features': 'sqrt'}. Best is trial 621 with value: 0.2256726988932517.
[I 2024-12-04 13:00:30,986] Trial 1278 finished with value: 0.24197767916549917 and parameters: {'n_estimators': 1331, 'learning_rate': 0.09427618688561157, 'max_depth': 8, 'min_samples_split': 9, 'min_samples_leaf': 1, 'subsample': 0.7483654511396471, 'max_features': 'sqrt'}. Best is trial 621 with value: 0.2256726988932517.
[I 2024-12-04 13:00:32,905] Trial 1291 finished with value: 0.2526083686496496 and parameters: {'n_estimators': 859, 'learning_rate': 0.09574087909296485, 'max_depth': 8, 'min_samples_split': 6, 'min_samples_leaf': 1, 'subsample': 0.864404908906142, 'max_features': 'sqrt'}. Best is trial 621 with value: 0.2256726988932517.
[I 2024-12-04 13:00:35,735] Trial 1277 finished with value: 0.2972219760954867 and parameters: {'n_estimators': 1481, 'learning_rate': 0.08812353118430827, 'max_depth': 6, 'min_samples_split': 6, 'min_samples_leaf': 2, 'subsample': 0.7211049853082002, 'max_features': 'sqrt'}. Best is trial 621 with value: 0.2256726988932517.
[I 2024-12-04 13:00:40,484] Trial 1280 finished with value: 0.2944937278311437 and parameters: {'n_estimators': 1448, 'learning_rate': 0.09880056909615716, 'max_depth': 6, 'min_samples_split': 4, 'min_samples_leaf': 2, 'subsample': 0.7847020673930153, 'max_features': 'log2'}. Best is trial 621 with value: 0.2256726988932517.
[I 2024-12-04 13:00:43,279] Trial 1284 finished with value: 0.26959109698052613 and parameters: {'n_estimators': 1272, 'learning_rate': 0.09518564024187835, 'max_depth': 8, 'min_samples_split': 2, 'min_samples_leaf': 1, 'subsample': 0.6912536210268574, 'max_features': 'sqrt'}. Best is trial 621 with value: 0.2256726988932517.
[I 2024-12-04 13:00:44,942] Trial 1288 finished with value: 0.2626933939938436 and parameters: {'n_estimators': 1146, 'learning_rate': 0.0658957633112728, 'max_depth': 6, 'min_samples_split': 2, 'min_samples_leaf': 1, 'subsample': 0.7712113212341686, 'max_features': 'sqrt'}. Best is trial 621 with value: 0.2256726988932517.
[I 2024-12-04 13:00:47,738] Trial 1282 finished with value: 0.2851567451517715 and parameters: {'n_estimators': 1492, 'learning_rate': 0.04164419313157673, 'max_depth': 8, 'min_samples_split': 3, 'min_samples_leaf': 2, 'subsample': 0.6699909747029498, 'max_features': 'sqrt'}. Best is trial 621 with value: 0.2256726988932517.
[I 2024-12-04 13:00:47,752] Trial 1286 finished with value: 0.2408356435765711 and parameters: {'n_estimators': 1276, 'learning_rate': 0.05551524438663002, 'max_depth': 7, 'min_samples_split': 3, 'min_samples_leaf': 1, 'subsample': 0.854003226667593, 'max_features': 'sqrt'}. Best is trial 621 with value: 0.2256726988932517.
[I 2024-12-04 13:00:51,806] Trial 1283 finished with value: 0.29357564584578294 and parameters: {'n_estimators': 1486, 'learning_rate': 0.056937508397506345, 'max_depth': 5, 'min_samples_split': 2, 'min_samples_leaf': 2, 'subsample': 0.755986500939423, 'max_features': 'sqrt'}. Best is trial 621 with value: 0.2256726988932517.
[I 2024-12-04 13:00:54,780] Trial 1285 finished with value: 0.2559479613447054 and parameters: {'n_estimators': 1427, 'learning_rate': 0.08635371997571276, 'max_depth': 5, 'min_samples_split': 5, 'min_samples_leaf': 1, 'subsample': 0.7144021936891306, 'max_features': 'sqrt'}. Best is trial 621 with value: 0.2256726988932517.
[I 2024-12-04 13:00:55,383] Trial 1290 finished with value: 0.2492032857320732 and parameters: {'n_estimators': 1287, 'learning_rate': 0.06333911737558102, 'max_depth': 7, 'min_samples_split': 2, 'min_samples_leaf': 1, 'subsample': 0.7634319546283416, 'max_features': 'sqrt'}. Best is trial 621 with value: 0.2256726988932517.
[I 2024-12-04 13:00:56,295] Trial 1289 finished with value: 0.23840463136931347 and parameters: {'n_estimators': 1348, 'learning_rate': 0.09373574135627345, 'max_depth': 7, 'min_samples_split': 5, 'min_samples_leaf': 1, 'subsample': 0.8754234981809024, 'max_features': 'sqrt'}. Best is trial 621 with value: 0.2256726988932517.
[I 2024-12-04 13:01:00,632] Trial 1287 finished with value: 0.25211566825835185 and parameters: {'n_estimators': 1390, 'learning_rate': 0.05983466055129279, 'max_depth': 7, 'min_samples_split': 2, 'min_samples_leaf': 1, 'subsample': 0.7247655063516444, 'max_features': 'sqrt'}. Best is trial 621 with value: 0.2256726988932517.
[I 2024-12-04 13:01:06,506] Trial 1292 finished with value: 0.31810146671837775 and parameters: {'n_estimators': 1306, 'learning_rate': 0.09867489654135814, 'max_depth': 6, 'min_samples_split': 2, 'min_samples_leaf': 1, 'subsample': 0.8593823894108767, 'max_features': None}. Best is trial 621 with value: 0.2256726988932517.
[I 2024-12-04 13:01:11,408] Trial 1293 finished with value: 0.25010764521818873 and parameters: {'n_estimators': 1458, 'learning_rate': 0.04007711437756507, 'max_depth': 9, 'min_samples_split': 4, 'min_samples_leaf': 1, 'subsample': 0.6032654140930107, 'max_features': 'sqrt'}. Best is trial 621 with value: 0.2256726988932517.
[I 2024-12-04 13:01:12,714] Trial 1300 finished with value: 0.25409979998901705 and parameters: {'n_estimators': 1142, 'learning_rate': 0.08658188640034384, 'max_depth': 8, 'min_samples_split': 5, 'min_samples_leaf': 1, 'subsample': 0.7690566628543771, 'max_features': 'sqrt'}. Best is trial 621 with value: 0.2256726988932517.
[I 2024-12-04 13:01:14,309] Trial 1301 finished with value: 0.35397557150047115 and parameters: {'n_estimators': 1129, 'learning_rate': 0.06213329306928448, 'max_depth': 8, 'min_samples_split': 7, 'min_samples_leaf': 3, 'subsample': 0.6496258844464159, 'max_features': 'sqrt'}. Best is trial 621 with value: 0.2256726988932517.
[I 2024-12-04 13:01:16,356] Trial 1294 finished with value: 0.5157233742259522 and parameters: {'n_estimators': 1353, 'learning_rate': 0.09244567009488242, 'max_depth': 11, 'min_samples_split': 2, 'min_samples_leaf': 2, 'subsample': 0.987848735467242, 'max_features': None}. Best is trial 621 with value: 0.2256726988932517.
[I 2024-12-04 13:01:16,570] Trial 1298 finished with value: 0.3553314831950916 and parameters: {'n_estimators': 1320, 'learning_rate': 0.043391711513487426, 'max_depth': 7, 'min_samples_split': 5, 'min_samples_leaf': 3, 'subsample': 0.8565366669022422, 'max_features': 'sqrt'}. Best is trial 621 with value: 0.2256726988932517.
[I 2024-12-04 13:01:17,684] Trial 1295 finished with value: 0.24054856170768238 and parameters: {'n_estimators': 1475, 'learning_rate': 0.09704223145088633, 'max_depth': 7, 'min_samples_split': 4, 'min_samples_leaf': 1, 'subsample': 0.8150515188094543, 'max_features': 'sqrt'}. Best is trial 621 with value: 0.2256726988932517.
[I 2024-12-04 13:01:18,040] Trial 1296 finished with value: 0.233968243226375 and parameters: {'n_estimators': 1430, 'learning_rate': 0.09295477904661617, 'max_depth': 5, 'min_samples_split': 2, 'min_samples_leaf': 1, 'subsample': 0.7303160022231213, 'max_features': 'sqrt'}. Best is trial 621 with value: 0.2256726988932517.
[I 2024-12-04 13:01:18,757] Trial 1297 finished with value: 0.24282843250413044 and parameters: {'n_estimators': 1376, 'learning_rate': 0.06826767521984352, 'max_depth': 7, 'min_samples_split': 6, 'min_samples_leaf': 1, 'subsample': 0.7746396027329858, 'max_features': 'sqrt'}. Best is trial 621 with value: 0.2256726988932517.
[I 2024-12-04 13:01:24,203] Trial 1304 finished with value: 0.26933412880355084 and parameters: {'n_estimators': 1195, 'learning_rate': 0.04083788384666615, 'max_depth': 7, 'min_samples_split': 7, 'min_samples_leaf': 1, 'subsample': 0.6710312822986751, 'max_features': 'sqrt'}. Best is trial 621 with value: 0.2256726988932517.
[I 2024-12-04 13:01:24,467] Trial 1303 finished with value: 0.38422438696376027 and parameters: {'n_estimators': 1248, 'learning_rate': 0.09578330880413598, 'max_depth': 11, 'min_samples_split': 2, 'min_samples_leaf': 4, 'subsample': 0.7351583375771873, 'max_features': 'sqrt'}. Best is trial 621 with value: 0.2256726988932517.
[I 2024-12-04 13:01:31,434] Trial 1310 finished with value: 0.28121952615309 and parameters: {'n_estimators': 972, 'learning_rate': 0.09372050919597774, 'max_depth': 8, 'min_samples_split': 3, 'min_samples_leaf': 2, 'subsample': 0.7899642358483937, 'max_features': 'sqrt'}. Best is trial 621 with value: 0.2256726988932517.
[I 2024-12-04 13:01:33,495] Trial 1320 finished with value: 0.2507262932727316 and parameters: {'n_estimators': 575, 'learning_rate': 0.09745173283029766, 'max_depth': 8, 'min_samples_split': 5, 'min_samples_leaf': 1, 'subsample': 0.8278525466195436, 'max_features': 'sqrt'}. Best is trial 621 with value: 0.2256726988932517.
[I 2024-12-04 13:01:34,168] Trial 1305 finished with value: 0.2526360715536348 and parameters: {'n_estimators': 1276, 'learning_rate': 0.09448487965236271, 'max_depth': 6, 'min_samples_split': 2, 'min_samples_leaf': 1, 'subsample': 0.7876819704006109, 'max_features': 'sqrt'}. Best is trial 621 with value: 0.2256726988932517.
[I 2024-12-04 13:01:36,018] Trial 1302 finished with value: 0.3117126390496857 and parameters: {'n_estimators': 1360, 'learning_rate': 0.059232275675887604, 'max_depth': 6, 'min_samples_split': 6, 'min_samples_leaf': 1, 'subsample': 0.6823259253136952, 'max_features': None}. Best is trial 621 with value: 0.2256726988932517.
[I 2024-12-04 13:01:36,179] Trial 1307 finished with value: 0.3395585422151367 and parameters: {'n_estimators': 1266, 'learning_rate': 0.060359730113822646, 'max_depth': 10, 'min_samples_split': 2, 'min_samples_leaf': 3, 'subsample': 0.6586815456465582, 'max_features': 'sqrt'}. Best is trial 621 with value: 0.2256726988932517.
[I 2024-12-04 13:01:38,164] Trial 1299 finished with value: 0.36870732279869417 and parameters: {'n_estimators': 1433, 'learning_rate': 0.09791193332476744, 'max_depth': 12, 'min_samples_split': 14, 'min_samples_leaf': 3, 'subsample': 0.6949147100678456, 'max_features': None}. Best is trial 621 with value: 0.2256726988932517.
[I 2024-12-04 13:01:46,750] Trial 1308 finished with value: 0.2558617878953022 and parameters: {'n_estimators': 1324, 'learning_rate': 0.06692581511582114, 'max_depth': 10, 'min_samples_split': 8, 'min_samples_leaf': 1, 'subsample': 0.6410560045432151, 'max_features': 'sqrt'}. Best is trial 621 with value: 0.2256726988932517.
[I 2024-12-04 13:01:47,891] Trial 1306 finished with value: 0.410479180980214 and parameters: {'n_estimators': 1377, 'learning_rate': 0.04968599091196843, 'max_depth': 6, 'min_samples_split': 2, 'min_samples_leaf': 2, 'subsample': 0.8282309133755448, 'max_features': None}. Best is trial 621 with value: 0.2256726988932517.
[I 2024-12-04 13:01:48,660] Trial 1309 finished with value: 0.34939598269086475 and parameters: {'n_estimators': 1320, 'learning_rate': 0.06330065284385773, 'max_depth': 9, 'min_samples_split': 5, 'min_samples_leaf': 3, 'subsample': 0.6369557418351941, 'max_features': 'sqrt'}. Best is trial 621 with value: 0.2256726988932517.
[I 2024-12-04 13:01:52,462] Trial 1311 finished with value: 0.3690907934810065 and parameters: {'n_estimators': 1299, 'learning_rate': 0.08289684273919858, 'max_depth': 7, 'min_samples_split': 5, 'min_samples_leaf': 3, 'subsample': 0.6785501826267566, 'max_features': 'sqrt'}. Best is trial 621 with value: 0.2256726988932517.
[I 2024-12-04 13:01:53,659] Trial 1321 finished with value: 0.6833493829923561 and parameters: {'n_estimators': 916, 'learning_rate': 0.021870699863771964, 'max_depth': 7, 'min_samples_split': 6, 'min_samples_leaf': 5, 'subsample': 0.9597642581707868, 'max_features': 'log2'}. Best is trial 621 with value: 0.2256726988932517.
[I 2024-12-04 13:01:55,062] Trial 1313 finished with value: 0.27124215934625545 and parameters: {'n_estimators': 1270, 'learning_rate': 0.0870367140048611, 'max_depth': 12, 'min_samples_split': 12, 'min_samples_leaf': 1, 'subsample': 0.6344832760135551, 'max_features': 'log2'}. Best is trial 621 with value: 0.2256726988932517.
[I 2024-12-04 13:01:55,333] Trial 1338 finished with value: 0.6581663722572024 and parameters: {'n_estimators': 183, 'learning_rate': 0.04999630788789206, 'max_depth': 4, 'min_samples_split': 10, 'min_samples_leaf': 3, 'subsample': 0.609611478712455, 'max_features': 'sqrt'}. Best is trial 621 with value: 0.2256726988932517.
[I 2024-12-04 13:02:02,964] Trial 1312 finished with value: 0.23927237401721635 and parameters: {'n_estimators': 1452, 'learning_rate': 0.08315707789504921, 'max_depth': 10, 'min_samples_split': 6, 'min_samples_leaf': 1, 'subsample': 0.8819614394783583, 'max_features': 'sqrt'}. Best is trial 621 with value: 0.2256726988932517.
[I 2024-12-04 13:02:03,464] Trial 1316 finished with value: 0.24178412988697004 and parameters: {'n_estimators': 1249, 'learning_rate': 0.09537244721171984, 'max_depth': 11, 'min_samples_split': 7, 'min_samples_leaf': 1, 'subsample': 0.692380516920425, 'max_features': 'sqrt'}. Best is trial 621 with value: 0.2256726988932517.
[I 2024-12-04 13:02:04,560] Trial 1318 finished with value: 0.35074918609805994 and parameters: {'n_estimators': 1197, 'learning_rate': 0.047756200573154106, 'max_depth': 8, 'min_samples_split': 6, 'min_samples_leaf': 3, 'subsample': 0.7779519994621586, 'max_features': 'sqrt'}. Best is trial 621 with value: 0.2256726988932517.
[I 2024-12-04 13:02:04,646] Trial 1315 finished with value: 0.34802396688833764 and parameters: {'n_estimators': 1315, 'learning_rate': 0.05592672694388367, 'max_depth': 7, 'min_samples_split': 2, 'min_samples_leaf': 3, 'subsample': 0.8793919177870133, 'max_features': 'sqrt'}. Best is trial 621 with value: 0.2256726988932517.
[I 2024-12-04 13:02:11,795] Trial 1314 finished with value: 0.22677186296581325 and parameters: {'n_estimators': 1491, 'learning_rate': 0.0631078238337, 'max_depth': 7, 'min_samples_split': 2, 'min_samples_leaf': 1, 'subsample': 0.8144863107343874, 'max_features': 'sqrt'}. Best is trial 621 with value: 0.2256726988932517.
[I 2024-12-04 13:02:11,862] Trial 1336 finished with value: 0.3532768416800925 and parameters: {'n_estimators': 509, 'learning_rate': 0.020364251680186827, 'max_depth': 9, 'min_samples_split': 19, 'min_samples_leaf': 2, 'subsample': 0.9927627302524575, 'max_features': None}. Best is trial 621 with value: 0.2256726988932517.
[I 2024-12-04 13:02:17,246] Trial 1319 finished with value: 0.25713405354908175 and parameters: {'n_estimators': 1399, 'learning_rate': 0.0978022731493397, 'max_depth': 6, 'min_samples_split': 4, 'min_samples_leaf': 1, 'subsample': 0.7366994511499134, 'max_features': 'sqrt'}. Best is trial 621 with value: 0.2256726988932517.
[I 2024-12-04 13:02:18,239] Trial 1346 finished with value: 0.8003120296939547 and parameters: {'n_estimators': 271, 'learning_rate': 0.015324099379833672, 'max_depth': 8, 'min_samples_split': 19, 'min_samples_leaf': 5, 'subsample': 0.6178256306316902, 'max_features': 'sqrt'}. Best is trial 621 with value: 0.2256726988932517.
[I 2024-12-04 13:02:19,839] Trial 1322 finished with value: 0.35390688420745836 and parameters: {'n_estimators': 1299, 'learning_rate': 0.05418412730833333, 'max_depth': 8, 'min_samples_split': 7, 'min_samples_leaf': 3, 'subsample': 0.8643241890330727, 'max_features': 'sqrt'}. Best is trial 621 with value: 0.2256726988932517.
[I 2024-12-04 13:02:21,292] Trial 1317 finished with value: 0.2574503661208431 and parameters: {'n_estimators': 1471, 'learning_rate': 0.06702969912152472, 'max_depth': 6, 'min_samples_split': 4, 'min_samples_leaf': 1, 'subsample': 0.7052587631728346, 'max_features': 'sqrt'}. Best is trial 621 with value: 0.2256726988932517.
[I 2024-12-04 13:02:24,528] Trial 1333 finished with value: 0.27769819074890334 and parameters: {'n_estimators': 894, 'learning_rate': 0.09908521725210842, 'max_depth': 7, 'min_samples_split': 2, 'min_samples_leaf': 1, 'subsample': 0.8188590074897872, 'max_features': 'sqrt'}. Best is trial 621 with value: 0.2256726988932517.
[I 2024-12-04 13:02:26,509] Trial 1324 finished with value: 0.23543675020406377 and parameters: {'n_estimators': 1282, 'learning_rate': 0.07766545287366862, 'max_depth': 9, 'min_samples_split': 3, 'min_samples_leaf': 1, 'subsample': 0.744446626979424, 'max_features': 'sqrt'}. Best is trial 621 with value: 0.2256726988932517.
[I 2024-12-04 13:02:28,763] Trial 1325 finished with value: 0.25696070796001846 and parameters: {'n_estimators': 1213, 'learning_rate': 0.09999305592197624, 'max_depth': 9, 'min_samples_split': 4, 'min_samples_leaf': 1, 'subsample': 0.6850748093522593, 'max_features': 'sqrt'}. Best is trial 621 with value: 0.2256726988932517.
[I 2024-12-04 13:02:31,295] Trial 1323 finished with value: 0.29105689088172176 and parameters: {'n_estimators': 1467, 'learning_rate': 0.09709047163952154, 'max_depth': 6, 'min_samples_split': 3, 'min_samples_leaf': 2, 'subsample': 0.718046104052336, 'max_features': 'sqrt'}. Best is trial 621 with value: 0.2256726988932517.
[I 2024-12-04 13:02:32,834] Trial 1328 finished with value: 0.39604774953451866 and parameters: {'n_estimators': 1149, 'learning_rate': 0.017429900294286434, 'max_depth': 5, 'min_samples_split': 12, 'min_samples_leaf': 3, 'subsample': 0.6689804768765921, 'max_features': 'sqrt'}. Best is trial 621 with value: 0.2256726988932517.
[I 2024-12-04 13:02:35,192] Trial 1329 finished with value: 0.3559828766976492 and parameters: {'n_estimators': 1087, 'learning_rate': 0.06060137315815665, 'max_depth': 9, 'min_samples_split': 3, 'min_samples_leaf': 3, 'subsample': 0.7230218531516207, 'max_features': 'sqrt'}. Best is trial 621 with value: 0.2256726988932517.
[I 2024-12-04 13:02:37,722] Trial 1327 finished with value: 0.4375942300073464 and parameters: {'n_estimators': 1239, 'learning_rate': 0.027421251481159887, 'max_depth': 4, 'min_samples_split': 13, 'min_samples_leaf': 8, 'subsample': 0.9184179888479226, 'max_features': None}. Best is trial 621 with value: 0.2256726988932517.
[I 2024-12-04 13:02:39,081] Trial 1334 finished with value: 0.2895691139178196 and parameters: {'n_estimators': 1090, 'learning_rate': 0.0889888506734559, 'max_depth': 8, 'min_samples_split': 6, 'min_samples_leaf': 1, 'subsample': 0.8387332175158836, 'max_features': 'sqrt'}. Best is trial 621 with value: 0.2256726988932517.
[I 2024-12-04 13:02:39,632] Trial 1330 finished with value: 0.2842913650856346 and parameters: {'n_estimators': 1102, 'learning_rate': 0.04918692594456385, 'max_depth': 9, 'min_samples_split': 2, 'min_samples_leaf': 2, 'subsample': 0.6085245891696032, 'max_features': 'sqrt'}. Best is trial 621 with value: 0.2256726988932517.
[I 2024-12-04 13:02:44,171] Trial 1360 finished with value: 0.47722335179989106 and parameters: {'n_estimators': 167, 'learning_rate': 0.024932259861949545, 'max_depth': 3, 'min_samples_split': 17, 'min_samples_leaf': 5, 'subsample': 0.6119831235494093, 'max_features': None}. Best is trial 621 with value: 0.2256726988932517.
[I 2024-12-04 13:02:47,535] Trial 1326 finished with value: 0.4267021615504328 and parameters: {'n_estimators': 1347, 'learning_rate': 0.06397603886673826, 'max_depth': 10, 'min_samples_split': 12, 'min_samples_leaf': 7, 'subsample': 0.8943996149397531, 'max_features': None}. Best is trial 621 with value: 0.2256726988932517.
[I 2024-12-04 13:02:49,634] Trial 1337 finished with value: 0.25681127561334954 and parameters: {'n_estimators': 1122, 'learning_rate': 0.06062481256015999, 'max_depth': 8, 'min_samples_split': 7, 'min_samples_leaf': 1, 'subsample': 0.7066809306125985, 'max_features': 'sqrt'}. Best is trial 621 with value: 0.2256726988932517.
[I 2024-12-04 13:02:52,153] Trial 1332 finished with value: 0.36613435288338547 and parameters: {'n_estimators': 1356, 'learning_rate': 0.06910030399238774, 'max_depth': 9, 'min_samples_split': 7, 'min_samples_leaf': 3, 'subsample': 0.7919779234385196, 'max_features': 'sqrt'}. Best is trial 621 with value: 0.2256726988932517.
[I 2024-12-04 13:02:53,540] Trial 1335 finished with value: 0.29572038644730786 and parameters: {'n_estimators': 1297, 'learning_rate': 0.08827817374752815, 'max_depth': 9, 'min_samples_split': 9, 'min_samples_leaf': 2, 'subsample': 0.9585197702922322, 'max_features': 'log2'}. Best is trial 621 with value: 0.2256726988932517.
