[I 2024-12-04 00:06:39,792] Trial 242 finished with value: 0.14219830964198568 and parameters: {'kernel': 'rbf', 'C': 83.27954792575633, 'gamma': 0.010626447613958857, 'epsilon': 0.01930585898005303}. Best is trial 207 with value: 0.14186137438299729.
[I 2024-12-04 00:06:40,071] Trial 239 finished with value: 0.1992473249061095 and parameters: {'kernel': 'rbf', 'C': 99.42954088660994, 'gamma': 0.043022490971137195, 'epsilon': 0.008094316944973166}. Best is trial 207 with value: 0.14186137438299729.
[I 2024-12-04 00:06:40,227] Trial 241 finished with value: 0.20124883350246964 and parameters: {'kernel': 'rbf', 'C': 87.87632915884988, 'gamma': 0.0024476904104375444, 'epsilon': 0.013848458827589052}. Best is trial 207 with value: 0.14186137438299729.
[I 2024-12-04 00:06:40,958] Trial 246 finished with value: 0.16532772875415097 and parameters: {'kernel': 'rbf', 'C': 9.280256817656902, 'gamma': 0.02839884782310074, 'epsilon': 0.007954387110351428}. Best is trial 207 with value: 0.14186137438299729.
[I 2024-12-04 00:06:41,532] Trial 252 finished with value: 0.14335592974760097 and parameters: {'kernel': 'rbf', 'C': 93.59819729214013, 'gamma': 0.010302786707793391, 'epsilon': 0.005278302856463626}. Best is trial 207 with value: 0.14186137438299729.
[I 2024-12-04 00:06:41,593] Trial 247 finished with value: 0.1425495606477486 and parameters: {'kernel': 'rbf', 'C': 96.23439709501002, 'gamma': 0.009768683193177198, 'epsilon': 0.014677118031516478}. Best is trial 207 with value: 0.14186137438299729.
[I 2024-12-04 00:06:41,624] Trial 250 finished with value: 0.15400759981969198 and parameters: {'kernel': 'rbf', 'C': 43.52253146710491, 'gamma': 0.008449464093133935, 'epsilon': 0.020540392472673565}. Best is trial 207 with value: 0.14186137438299729.
[I 2024-12-04 00:06:42,084] Trial 244 finished with value: 0.15229536512431613 and parameters: {'kernel': 'rbf', 'C': 87.70503987517178, 'gamma': 0.012403817061342127, 'epsilon': 0.012938015196446865}. Best is trial 207 with value: 0.14186137438299729.
[I 2024-12-04 00:06:42,085] Trial 245 finished with value: 0.20407202944053604 and parameters: {'kernel': 'rbf', 'C': 21.76272554036683, 'gamma': 0.06076221546494447, 'epsilon': 0.019265402660432272}. Best is trial 207 with value: 0.14186137438299729.
[I 2024-12-04 00:06:42,376] Trial 248 finished with value: 0.149000485910068 and parameters: {'kernel': 'rbf', 'C': 81.47666146566965, 'gamma': 0.009166618971611354, 'epsilon': 0.032228637372070705}. Best is trial 207 with value: 0.14186137438299729.
[I 2024-12-04 00:06:42,837] Trial 251 finished with value: 0.1537976238769703 and parameters: {'kernel': 'rbf', 'C': 93.08306709562345, 'gamma': 0.013105882123682126, 'epsilon': 0.015920971689715388}. Best is trial 207 with value: 0.14186137438299729.
[I 2024-12-04 00:06:42,972] Trial 253 finished with value: 0.15710319298937897 and parameters: {'kernel': 'rbf', 'C': 49.14396482163296, 'gamma': 0.007334656394884555, 'epsilon': 0.007377652455860208}. Best is trial 207 with value: 0.14186137438299729.
[I 2024-12-04 00:06:43,264] Trial 249 finished with value: 0.6213613900593753 and parameters: {'kernel': 'poly', 'C': 68.16040705275167, 'gamma': 0.006690202272069752, 'epsilon': 0.009051950820578976}. Best is trial 207 with value: 0.14186137438299729.
[I 2024-12-04 00:06:43,697] Trial 255 finished with value: 0.2637442013712271 and parameters: {'kernel': 'rbf', 'C': 14.956919389670404, 'gamma': 0.0035573168205663835, 'epsilon': 0.009029623706307058}. Best is trial 207 with value: 0.14186137438299729.
[I 2024-12-04 00:06:44,886] Trial 258 finished with value: 0.15721052299306007 and parameters: {'kernel': 'rbf', 'C': 91.96806737407691, 'gamma': 0.013679941530164852, 'epsilon': 0.006075283915641142}. Best is trial 207 with value: 0.14186137438299729.
[I 2024-12-04 00:06:44,889] Trial 260 finished with value: 0.1493893347829273 and parameters: {'kernel': 'rbf', 'C': 18.614079491283427, 'gamma': 0.01897874022878209, 'epsilon': 0.005948245772552406}. Best is trial 207 with value: 0.14186137438299729.
[I 2024-12-04 00:06:44,909] Trial 259 finished with value: 0.14599602798539188 and parameters: {'kernel': 'rbf', 'C': 83.52447254670356, 'gamma': 0.007305668194961974, 'epsilon': 0.02073088593617141}. Best is trial 207 with value: 0.14186137438299729.
[I 2024-12-04 00:06:44,910] Trial 254 finished with value: 0.14397541709580047 and parameters: {'kernel': 'rbf', 'C': 82.54729405877188, 'gamma': 0.007196429043630735, 'epsilon': 0.004333723738644977}. Best is trial 207 with value: 0.14186137438299729.
[I 2024-12-04 00:06:45,176] Trial 256 finished with value: 0.1529318767120337 and parameters: {'kernel': 'rbf', 'C': 95.7626676724231, 'gamma': 0.005012510725576658, 'epsilon': 0.00760742128665374}. Best is trial 207 with value: 0.14186137438299729.
[I 2024-12-04 00:06:45,792] Trial 264 finished with value: 0.1915879568848067 and parameters: {'kernel': 'rbf', 'C': 84.36564274524879, 'gamma': 0.0029508748287970575, 'epsilon': 0.016440227386680637}. Best is trial 207 with value: 0.14186137438299729.
[I 2024-12-04 00:06:45,962] Trial 263 finished with value: 0.15535837914803777 and parameters: {'kernel': 'rbf', 'C': 64.0353875820842, 'gamma': 0.006368223799210089, 'epsilon': 0.01637416080111071}. Best is trial 207 with value: 0.14186137438299729.
[I 2024-12-04 00:06:45,994] Trial 261 finished with value: 0.1530039127683622 and parameters: {'kernel': 'rbf', 'C': 70.65927208543988, 'gamma': 0.0063431173338719055, 'epsilon': 0.02316282718103084}. Best is trial 207 with value: 0.14186137438299729.
[I 2024-12-04 00:06:46,055] Trial 266 finished with value: 0.28124693559150754 and parameters: {'kernel': 'rbf', 'C': 12.967263335968424, 'gamma': 0.002711812523269593, 'epsilon': 0.006583279063208921}. Best is trial 207 with value: 0.14186137438299729.
[I 2024-12-04 00:06:46,445] Trial 257 finished with value: 0.18034300551841526 and parameters: {'kernel': 'rbf', 'C': 86.9662603717476, 'gamma': 0.028562223923993844, 'epsilon': 0.007599333079344499}. Best is trial 207 with value: 0.14186137438299729.
[I 2024-12-04 00:06:47,023] Trial 268 finished with value: 0.1589598056522857 and parameters: {'kernel': 'rbf', 'C': 35.40160103717817, 'gamma': 0.008824432954611057, 'epsilon': 0.003995128207614697}. Best is trial 207 with value: 0.14186137438299729.
[I 2024-12-04 00:06:48,871] Trial 277 finished with value: 0.23715137056207586 and parameters: {'kernel': 'rbf', 'C': 7.675500073367903, 'gamma': 0.010971474956780124, 'epsilon': 0.021664323634391892}. Best is trial 207 with value: 0.14186137438299729.
[I 2024-12-04 00:06:48,876] Trial 262 finished with value: 0.14633571987712346 and parameters: {'kernel': 'rbf', 'C': 54.03955261044883, 'gamma': 0.008493612348917441, 'epsilon': 0.014129277118487651}. Best is trial 207 with value: 0.14186137438299729.
[I 2024-12-04 00:06:49,137] Trial 269 finished with value: 0.1645163840597848 and parameters: {'kernel': 'rbf', 'C': 96.42350736923365, 'gamma': 0.0039269401518621135, 'epsilon': 0.006538294080672308}. Best is trial 207 with value: 0.14186137438299729.
[I 2024-12-04 00:06:49,262] Trial 271 finished with value: 0.14865631556552084 and parameters: {'kernel': 'rbf', 'C': 72.52600941459711, 'gamma': 0.006919690110859745, 'epsilon': 0.005293555318593566}. Best is trial 207 with value: 0.14186137438299729.
[I 2024-12-04 00:06:50,101] Trial 118 finished with value: 0.352806039764316 and parameters: {'kernel': 'linear', 'C': 22.722348539164308, 'gamma': 0.02276254284099191, 'epsilon': 0.010595915624724095}. Best is trial 270 with value: 0.14046642316818972.
[I 2024-12-04 00:06:50,105] Trial 270 finished with value: 0.14046642316818972 and parameters: {'kernel': 'rbf', 'C': 99.90344582576694, 'gamma': 0.008436442158987383, 'epsilon': 0.003590622854666502}. Best is trial 270 with value: 0.14046642316818972.
[I 2024-12-04 00:06:50,344] Trial 273 finished with value: 0.1589245732571021 and parameters: {'kernel': 'rbf', 'C': 96.21054672828677, 'gamma': 0.004223825811749009, 'epsilon': 0.025411700134708212}. Best is trial 270 with value: 0.14046642316818972.
[I 2024-12-04 00:06:50,459] Trial 276 finished with value: 0.18321469660564432 and parameters: {'kernel': 'rbf', 'C': 71.89269756698516, 'gamma': 0.03402874575464984, 'epsilon': 0.024062390337691975}. Best is trial 270 with value: 0.14046642316818972.
[I 2024-12-04 00:06:50,543] Trial 274 finished with value: 0.22454045895613567 and parameters: {'kernel': 'rbf', 'C': 8.21391304706747, 'gamma': 0.012349158360532655, 'epsilon': 0.00508499126519109}. Best is trial 270 with value: 0.14046642316818972.
[I 2024-12-04 00:06:50,763] Trial 272 finished with value: 0.16622825056440524 and parameters: {'kernel': 'rbf', 'C': 97.46129160358478, 'gamma': 0.017234522030445107, 'epsilon': 0.00659158954008088}. Best is trial 270 with value: 0.14046642316818972.
[I 2024-12-04 00:06:51,034] Trial 278 finished with value: 0.17809863712423768 and parameters: {'kernel': 'rbf', 'C': 33.25098362751991, 'gamma': 0.007575317324170314, 'epsilon': 0.01952853092183604}. Best is trial 270 with value: 0.14046642316818972.
[I 2024-12-04 00:06:51,149] Trial 279 finished with value: 0.14759372029609666 and parameters: {'kernel': 'rbf', 'C': 99.71476333126766, 'gamma': 0.00902361028047223, 'epsilon': 0.03277221116154996}. Best is trial 270 with value: 0.14046642316818972.
[I 2024-12-04 00:06:52,421] Trial 286 finished with value: 0.2985425471970516 and parameters: {'kernel': 'rbf', 'C': 10.474678126171062, 'gamma': 0.002483239542037998, 'epsilon': 0.032601845413024765}. Best is trial 270 with value: 0.14046642316818972.
[I 2024-12-04 00:06:52,491] Trial 282 finished with value: 0.33004937311609944 and parameters: {'kernel': 'rbf', 'C': 11.036862597014329, 'gamma': 0.0016544540306052695, 'epsilon': 0.0032151084017108733}. Best is trial 270 with value: 0.14046642316818972.
[I 2024-12-04 00:06:52,980] Trial 283 finished with value: 0.14467186598381793 and parameters: {'kernel': 'rbf', 'C': 65.26552543214154, 'gamma': 0.011736738552372599, 'epsilon': 0.0035707643828169753}. Best is trial 270 with value: 0.14046642316818972.
[I 2024-12-04 00:06:53,032] Trial 280 finished with value: 0.14350506206121158 and parameters: {'kernel': 'rbf', 'C': 92.92766029272866, 'gamma': 0.007185602380954196, 'epsilon': 0.008978900374123014}. Best is trial 270 with value: 0.14046642316818972.
[I 2024-12-04 00:06:53,034] Trial 281 finished with value: 0.1492663099810532 and parameters: {'kernel': 'rbf', 'C': 89.22395541710614, 'gamma': 0.006055652436800436, 'epsilon': 0.016199252940283588}. Best is trial 270 with value: 0.14046642316818972.
[I 2024-12-04 00:06:53,687] Trial 285 finished with value: 23.33197632620903 and parameters: {'kernel': 'sigmoid', 'C': 2.688304512215057, 'gamma': 0.00637251718046097, 'epsilon': 0.004109728821612237}. Best is trial 270 with value: 0.14046642316818972.
[I 2024-12-04 00:06:53,689] Trial 287 finished with value: 0.6358205426989626 and parameters: {'kernel': 'linear', 'C': 0.001163960908322493, 'gamma': 0.002083636219718642, 'epsilon': 0.4360593178123969}. Best is trial 270 with value: 0.14046642316818972.
[I 2024-12-04 00:06:54,267] Trial 291 finished with value: 0.1450865599572138 and parameters: {'kernel': 'rbf', 'C': 21.91307696696665, 'gamma': 0.016871158056447802, 'epsilon': 0.023714792896483}. Best is trial 270 with value: 0.14046642316818972.
[I 2024-12-04 00:06:54,597] Trial 288 finished with value: 0.1569668320430123 and parameters: {'kernel': 'rbf', 'C': 82.49795296140474, 'gamma': 0.015271721767824278, 'epsilon': 0.019339458631380452}. Best is trial 270 with value: 0.14046642316818972.
[I 2024-12-04 00:06:54,601] Trial 289 finished with value: 0.19402139094789841 and parameters: {'kernel': 'rbf', 'C': 85.99535797442203, 'gamma': 0.0029242984461438945, 'epsilon': 0.07028616680324362}. Best is trial 270 with value: 0.14046642316818972.
[I 2024-12-04 00:06:55,578] Trial 290 finished with value: 96.55952820076521 and parameters: {'kernel': 'sigmoid', 'C': 5.982762130209941, 'gamma': 0.014685832931496586, 'epsilon': 0.02606466742559103}. Best is trial 270 with value: 0.14046642316818972.
[I 2024-12-04 00:06:55,651] Trial 293 finished with value: 42.23638349913113 and parameters: {'kernel': 'sigmoid', 'C': 1.5591860980361074, 'gamma': 0.28929688808007215, 'epsilon': 0.01998220059734847}. Best is trial 270 with value: 0.14046642316818972.
[I 2024-12-04 00:06:56,211] Trial 204 finished with value: 0.3526185413547187 and parameters: {'kernel': 'linear', 'C': 12.21319382412221, 'gamma': 0.0036217125227052233, 'epsilon': 0.0010231072332900263}. Best is trial 270 with value: 0.14046642316818972.
[I 2024-12-04 00:06:56,212] Trial 294 finished with value: 0.23194349817211396 and parameters: {'kernel': 'rbf', 'C': 12.703187318390022, 'gamma': 0.008122893073018387, 'epsilon': 0.016486552565091905}. Best is trial 270 with value: 0.14046642316818972.
[I 2024-12-04 00:06:56,684] Trial 284 finished with value: 0.14112379320271687 and parameters: {'kernel': 'rbf', 'C': 99.6405720482385, 'gamma': 0.010105095239725448, 'epsilon': 0.00281756010293935}. Best is trial 270 with value: 0.14046642316818972.
[I 2024-12-04 00:06:56,860] Trial 295 finished with value: 0.20414815304672093 and parameters: {'kernel': 'rbf', 'C': 6.333415343190853, 'gamma': 0.018826105792415948, 'epsilon': 0.018456601347422132}. Best is trial 270 with value: 0.14046642316818972.
[I 2024-12-04 00:06:57,197] Trial 301 finished with value: 0.26742007557935477 and parameters: {'kernel': 'rbf', 'C': 19.531074560855583, 'gamma': 0.002535832100700363, 'epsilon': 0.005412141052060689}. Best is trial 270 with value: 0.14046642316818972.
[I 2024-12-04 00:06:57,249] Trial 292 finished with value: 0.15356652889586575 and parameters: {'kernel': 'rbf', 'C': 76.32758938502528, 'gamma': 0.01358508030109783, 'epsilon': 0.0023734783212652467}. Best is trial 270 with value: 0.14046642316818972.
[I 2024-12-04 00:06:57,593] Trial 297 finished with value: 0.23634194683953133 and parameters: {'kernel': 'rbf', 'C': 13.10030583855675, 'gamma': 0.007504903832362139, 'epsilon': 0.017134926216223263}. Best is trial 270 with value: 0.14046642316818972.
[I 2024-12-04 00:06:57,743] Trial 296 finished with value: 0.6935965711120649 and parameters: {'kernel': 'poly', 'C': 66.35919406862813, 'gamma': 0.004561269622089735, 'epsilon': 0.02823977382711135}. Best is trial 270 with value: 0.14046642316818972.
[I 2024-12-04 00:06:59,444] Trial 298 finished with value: 0.18059027752721998 and parameters: {'kernel': 'rbf', 'C': 16.322247465127838, 'gamma': 0.04033196745783557, 'epsilon': 0.014437346182500565}. Best is trial 270 with value: 0.14046642316818972.
[I 2024-12-04 00:06:59,810] Trial 300 finished with value: 0.14369568565681468 and parameters: {'kernel': 'rbf', 'C': 94.49908754091568, 'gamma': 0.006865060615515385, 'epsilon': 0.007283393683136913}. Best is trial 270 with value: 0.14046642316818972.
[I 2024-12-04 00:07:00,132] Trial 303 finished with value: 0.14772836490010471 and parameters: {'kernel': 'rbf', 'C': 66.8352320308281, 'gamma': 0.007129718368545823, 'epsilon': 0.0041603386030821315}. Best is trial 270 with value: 0.14046642316818972.
[I 2024-12-04 00:07:00,133] Trial 302 finished with value: 0.14661222292303372 and parameters: {'kernel': 'rbf', 'C': 98.34659135156187, 'gamma': 0.006013166821469689, 'epsilon': 0.002981689053161269}. Best is trial 270 with value: 0.14046642316818972.
[I 2024-12-04 00:07:00,668] Trial 304 finished with value: 0.17544113089210808 and parameters: {'kernel': 'rbf', 'C': 15.672334535060845, 'gamma': 0.013756338146348478, 'epsilon': 0.04251257518674826}. Best is trial 270 with value: 0.14046642316818972.
[I 2024-12-04 00:07:01,150] Trial 306 finished with value: 0.1721425697849496 and parameters: {'kernel': 'rbf', 'C': 46.93242481946618, 'gamma': 0.006059538144828496, 'epsilon': 0.004230379029233373}. Best is trial 270 with value: 0.14046642316818972.
[I 2024-12-04 00:07:01,869] Trial 307 finished with value: 0.17065970739269723 and parameters: {'kernel': 'rbf', 'C': 94.00694863092636, 'gamma': 0.02302651381789046, 'epsilon': 0.022750811540464176}. Best is trial 270 with value: 0.14046642316818972.
[I 2024-12-04 00:07:02,376] Trial 311 finished with value: 0.8042819868162426 and parameters: {'kernel': 'rbf', 'C': 0.0871657674833091, 'gamma': 0.0005956728280735232, 'epsilon': 0.29998505563836975}. Best is trial 270 with value: 0.14046642316818972.
[I 2024-12-04 00:07:02,463] Trial 308 finished with value: 0.22818944070134994 and parameters: {'kernel': 'rbf', 'C': 84.81093652379607, 'gamma': 0.0015592951847399489, 'epsilon': 0.0038712032685947776}. Best is trial 270 with value: 0.14046642316818972.
[I 2024-12-04 00:07:02,984] Trial 309 finished with value: 0.21503985777882795 and parameters: {'kernel': 'rbf', 'C': 53.87317610468876, 'gamma': 0.003078479823901646, 'epsilon': 0.0017214598244205868}. Best is trial 270 with value: 0.14046642316818972.
[I 2024-12-04 00:07:03,818] Trial 314 finished with value: 0.1674906308081864 and parameters: {'kernel': 'rbf', 'C': 59.873060329515916, 'gamma': 0.005338514745839557, 'epsilon': 0.00251789823028778}. Best is trial 270 with value: 0.14046642316818972.
[I 2024-12-04 00:07:04,609] Trial 315 finished with value: 0.18887999282837128 and parameters: {'kernel': 'rbf', 'C': 54.40356035207851, 'gamma': 0.004339127148749043, 'epsilon': 0.00547546220368582}. Best is trial 270 with value: 0.14046642316818972.
[I 2024-12-04 00:07:04,911] Trial 318 finished with value: 0.22255625905939125 and parameters: {'kernel': 'rbf', 'C': 92.58799455204293, 'gamma': 0.0016303215627605544, 'epsilon': 0.008623243745016097}. Best is trial 270 with value: 0.14046642316818972.
[I 2024-12-04 00:07:05,041] Trial 313 finished with value: 0.26613240523298076 and parameters: {'kernel': 'rbf', 'C': 54.12213682596932, 'gamma': 0.0010572702805192492, 'epsilon': 0.02361200243411569}. Best is trial 270 with value: 0.14046642316818972.
[I 2024-12-04 00:07:05,042] Trial 310 finished with value: 0.18682325953508686 and parameters: {'kernel': 'rbf', 'C': 88.54431761837743, 'gamma': 0.0339694642614361, 'epsilon': 0.0029178717912862837}. Best is trial 270 with value: 0.14046642316818972.
[I 2024-12-04 00:07:05,670] Trial 312 finished with value: 0.14800706897937985 and parameters: {'kernel': 'rbf', 'C': 72.01814201571896, 'gamma': 0.006938214000477438, 'epsilon': 0.004723485566602319}. Best is trial 270 with value: 0.14046642316818972.
[I 2024-12-04 00:07:06,584] Trial 317 finished with value: 0.15973748459821974 and parameters: {'kernel': 'rbf', 'C': 85.26885057680342, 'gamma': 0.004497028188767966, 'epsilon': 0.009878364441562556}. Best is trial 270 with value: 0.14046642316818972.
[I 2024-12-04 00:07:07,069] Trial 323 finished with value: 0.18249992376675334 and parameters: {'kernel': 'rbf', 'C': 8.224314817272829, 'gamma': 0.04049608526361756, 'epsilon': 0.04402492406058237}. Best is trial 270 with value: 0.14046642316818972.
[I 2024-12-04 00:07:07,070] Trial 265 finished with value: 0.35203603483245066 and parameters: {'kernel': 'linear', 'C': 7.377888169468834, 'gamma': 0.005994180645556045, 'epsilon': 0.005614128675701237}. Best is trial 270 with value: 0.14046642316818972.
[I 2024-12-04 00:07:07,496] Trial 325 finished with value: 0.6648718080424703 and parameters: {'kernel': 'sigmoid', 'C': 0.1395221811044142, 'gamma': 0.0038407770060592114, 'epsilon': 0.4764769463192118}. Best is trial 270 with value: 0.14046642316818972.
[I 2024-12-04 00:07:07,643] Trial 321 finished with value: 0.14275861767623152 and parameters: {'kernel': 'rbf', 'C': 92.44253279050308, 'gamma': 0.006722846902162661, 'epsilon': 0.0016161601856981118}. Best is trial 270 with value: 0.14046642316818972.
[I 2024-12-04 00:07:07,644] Trial 319 finished with value: 0.6353155943856348 and parameters: {'kernel': 'poly', 'C': 0.27884000435584655, 'gamma': 0.03832089973717787, 'epsilon': 0.2735247817026717}. Best is trial 270 with value: 0.14046642316818972.
[I 2024-12-04 00:07:07,808] Trial 324 finished with value: 0.62300749670427 and parameters: {'kernel': 'rbf', 'C': 0.330600155294483, 'gamma': 0.001122116188850218, 'epsilon': 0.0022330249918304937}. Best is trial 270 with value: 0.14046642316818972.
[I 2024-12-04 00:07:08,778] Trial 316 finished with value: 0.14663293344371944 and parameters: {'kernel': 'rbf', 'C': 98.96234950750714, 'gamma': 0.010289231232730641, 'epsilon': 0.009132390640814244}. Best is trial 270 with value: 0.14046642316818972.
[I 2024-12-04 00:07:09,288] Trial 322 finished with value: 0.14789911675040487 and parameters: {'kernel': 'rbf', 'C': 95.2184142459354, 'gamma': 0.011179491955961752, 'epsilon': 0.0166150687444261}. Best is trial 270 with value: 0.14046642316818972.
[I 2024-12-04 00:07:09,683] Trial 326 finished with value: 0.15233441841696962 and parameters: {'kernel': 'rbf', 'C': 94.34012029167766, 'gamma': 0.011718050567059319, 'epsilon': 0.011461379301870868}. Best is trial 270 with value: 0.14046642316818972.
[I 2024-12-04 00:07:09,969] Trial 320 finished with value: 0.18282493711306977 and parameters: {'kernel': 'rbf', 'C': 89.49941955995189, 'gamma': 0.031186439681283637, 'epsilon': 0.005623378349064129}. Best is trial 270 with value: 0.14046642316818972.
[I 2024-12-04 00:07:11,630] Trial 330 finished with value: 0.16441614637301125 and parameters: {'kernel': 'rbf', 'C': 84.3101447865544, 'gamma': 0.004317703972654942, 'epsilon': 0.00391612504749495}. Best is trial 270 with value: 0.14046642316818972.
[I 2024-12-04 00:07:11,764] Trial 332 finished with value: 0.6051394752252626 and parameters: {'kernel': 'rbf', 'C': 0.05455511790137149, 'gamma': 0.06055036457119469, 'epsilon': 0.029888457008276487}. Best is trial 270 with value: 0.14046642316818972.
[I 2024-12-04 00:07:12,590] Trial 327 finished with value: 0.14093464104076694 and parameters: {'kernel': 'rbf', 'C': 79.65905347190876, 'gamma': 0.00822438731268739, 'epsilon': 0.0022235244983036325}. Best is trial 270 with value: 0.14046642316818972.
