[I 2024-12-04 19:43:30,855] Trial 109 finished with value: 0.14249505888627315 and parameters: {'kernel_type': 'Matern', 'length_scale': 14.649867843988126, 'noise_level': 0.05512148760253397, 'constant_value': 3.322240822880633, 'nu': 1.5}. Best is trial 87 with value: 0.13777769741398374.
[I 2024-12-04 19:43:31,166] Trial 108 finished with value: 0.1424950652601597 and parameters: {'kernel_type': 'Matern', 'length_scale': 12.93299873567322, 'noise_level': 0.3916354024000501, 'constant_value': 0.0022913666672882715, 'nu': 1.5}. Best is trial 87 with value: 0.13777769741398374.
[I 2024-12-04 19:43:31,399] Trial 106 finished with value: 0.14249509770604238 and parameters: {'kernel_type': 'Matern', 'length_scale': 0.9231428213585396, 'noise_level': 0.0001036347278422141, 'constant_value': 382.78681899232555, 'nu': 1.5}. Best is trial 87 with value: 0.13777769741398374.
[I 2024-12-04 19:43:38,590] Trial 111 finished with value: 0.14771021013865598 and parameters: {'kernel_type': 'RBF', 'length_scale': 10.221062262961278, 'noise_level': 0.13957635958844042, 'constant_value': 0.09453292724784793, 'nu': 1.5}. Best is trial 87 with value: 0.13777769741398374.
[I 2024-12-04 19:43:47,640] Trial 110 finished with value: 0.142495007217158 and parameters: {'kernel_type': 'Matern', 'length_scale': 2.205997758293808, 'noise_level': 0.5202425268171087, 'constant_value': 3.4588018599450235e-06, 'nu': 1.5}. Best is trial 87 with value: 0.13777769741398374.
[I 2024-12-04 19:43:48,052] Trial 113 finished with value: 0.9864686819233902 and parameters: {'kernel_type': 'Matern', 'length_scale': 0.025153088028493455, 'noise_level': 0.3124518002122306, 'constant_value': 33838.22144752303, 'nu': 1.5}. Best is trial 87 with value: 0.13777769741398374.
[I 2024-12-04 19:43:48,315] Trial 112 finished with value: 0.14249516894006736 and parameters: {'kernel_type': 'Matern', 'length_scale': 0.38042144608714856, 'noise_level': 0.8410388556973121, 'constant_value': 0.0018256404358258575, 'nu': 1.5}. Best is trial 87 with value: 0.13777769741398374.
[I 2024-12-04 19:43:51,455] Trial 116 finished with value: 0.9982167338004022 and parameters: {'kernel_type': 'Matern', 'length_scale': 0.03563204806089305, 'noise_level': 0.8614952431766734, 'constant_value': 1.2625720286751426e-06, 'nu': 1.5}. Best is trial 87 with value: 0.13777769741398374.
[I 2024-12-04 19:43:56,073] Trial 115 finished with value: 0.14249501528729927 and parameters: {'kernel_type': 'Matern', 'length_scale': 19.458739006441316, 'noise_level': 0.00036571983981029994, 'constant_value': 315.495432247108, 'nu': 1.5}. Best is trial 87 with value: 0.13777769741398374.
[I 2024-12-04 19:43:58,223] Trial 117 finished with value: 0.14249563543039398 and parameters: {'kernel_type': 'Matern', 'length_scale': 5.776715050515656, 'noise_level': 0.1366396184190814, 'constant_value': 0.0427739466419299, 'nu': 1.5}. Best is trial 87 with value: 0.13777769741398374.
[I 2024-12-04 19:44:01,339] Trial 114 finished with value: 0.14249505309798358 and parameters: {'kernel_type': 'Matern', 'length_scale': 31.112976625966954, 'noise_level': 0.6964073568031223, 'constant_value': 9.207309043142929e-06, 'nu': 1.5}. Best is trial 87 with value: 0.13777769741398374.
[I 2024-12-04 19:44:03,328] Trial 119 finished with value: 0.986468681928741 and parameters: {'kernel_type': 'Matern', 'length_scale': 333.23070432113565, 'noise_level': 3.9276977185287347e-05, 'constant_value': 710.8362761242713, 'nu': 1.5}. Best is trial 87 with value: 0.13777769741398374.
[I 2024-12-04 19:44:04,570] Trial 118 finished with value: 0.1424951403159521 and parameters: {'kernel_type': 'Matern', 'length_scale': 0.6038949747672081, 'noise_level': 0.0009204557202323006, 'constant_value': 3923.227781842353, 'nu': 1.5}. Best is trial 87 with value: 0.13777769741398374.
[I 2024-12-04 19:44:09,143] Trial 120 finished with value: 0.14249523592222618 and parameters: {'kernel_type': 'Matern', 'length_scale': 35.14307905453204, 'noise_level': 0.003446354236193198, 'constant_value': 72.980222902378, 'nu': 1.5}. Best is trial 87 with value: 0.13777769741398374.
[I 2024-12-04 19:44:16,258] Trial 123 finished with value: 0.14249494674732238 and parameters: {'kernel_type': 'Matern', 'length_scale': 1.8837895906936346, 'noise_level': 0.0005258965284465342, 'constant_value': 67621.70082343304, 'nu': 1.5}. Best is trial 87 with value: 0.13777769741398374.
[I 2024-12-04 19:44:19,260] Trial 121 finished with value: 0.197200034162032 and parameters: {'kernel_type': 'Matern', 'length_scale': 85.55826540266038, 'noise_level': 0.7157560239501488, 'constant_value': 1.0385611137567335e-07, 'nu': 0.5}. Best is trial 87 with value: 0.13777769741398374.
[I 2024-12-04 19:44:19,703] Trial 122 finished with value: 0.14249487554538812 and parameters: {'kernel_type': 'Matern', 'length_scale': 0.42084027176502864, 'noise_level': 0.05339943131335023, 'constant_value': 1.3322872497598425e-06, 'nu': 1.5}. Best is trial 87 with value: 0.13777769741398374.
[I 2024-12-04 19:44:29,165] Trial 124 finished with value: 0.1477103413220641 and parameters: {'kernel_type': 'RBF', 'length_scale': 13.362003343273656, 'noise_level': 0.6179021240435193, 'constant_value': 1.1770789672625622e-07, 'nu': 1.5}. Best is trial 87 with value: 0.13777769741398374.
[I 2024-12-04 19:44:29,652] Trial 125 finished with value: 0.9864686819220473 and parameters: {'kernel_type': 'Matern', 'length_scale': 110.41848037024504, 'noise_level': 0.002984177264829203, 'constant_value': 4.345343188076093e-07, 'nu': 1.5}. Best is trial 87 with value: 0.13777769741398374.
[I 2024-12-04 19:44:30,282] Trial 126 finished with value: 0.24535337305681998 and parameters: {'kernel_type': 'Matern', 'length_scale': 8.628181093052179, 'noise_level': 0.08443504436198786, 'constant_value': 1.1611390253243706e-06, 'nu': 1.5}. Best is trial 87 with value: 0.13777769741398374.
[I 2024-12-04 19:44:38,648] Trial 129 finished with value: 0.9982167337939828 and parameters: {'kernel_type': 'RBF', 'length_scale': 0.02270498690728691, 'noise_level': 1.885493142606168e-05, 'constant_value': 16054.190685773945, 'nu': 1.5}. Best is trial 87 with value: 0.13777769741398374.
[I 2024-12-04 19:44:49,714] Trial 127 finished with value: 0.9864686819318137 and parameters: {'kernel_type': 'Matern', 'length_scale': 0.027016372082750553, 'noise_level': 0.00439619190466618, 'constant_value': 2.230435631257841e-05, 'nu': 1.5}. Best is trial 87 with value: 0.13777769741398374.
[I 2024-12-04 19:44:50,334] Trial 130 finished with value: 0.9864686819185324 and parameters: {'kernel_type': 'RBF', 'length_scale': 1723.218623511963, 'noise_level': 0.00345946068604513, 'constant_value': 4432.670946474563, 'nu': 1.5}. Best is trial 87 with value: 0.13777769741398374.
[I 2024-12-04 19:44:53,850] Trial 128 finished with value: 0.14249505507045332 and parameters: {'kernel_type': 'Matern', 'length_scale': 48.18657687932989, 'noise_level': 0.31751119068523864, 'constant_value': 1.731841728157502e-05, 'nu': 1.5}. Best is trial 87 with value: 0.13777769741398374.
[I 2024-12-04 19:44:56,593] Trial 131 finished with value: 0.14249505058387998 and parameters: {'kernel_type': 'Matern', 'length_scale': 7.258947270954283, 'noise_level': 0.012333587504702816, 'constant_value': 2876.0369744863624, 'nu': 1.5}. Best is trial 87 with value: 0.13777769741398374.
[I 2024-12-04 19:45:04,021] Trial 134 finished with value: 0.9864686819399238 and parameters: {'kernel_type': 'Matern', 'length_scale': 89.51517488767537, 'noise_level': 1.96726487579684e-09, 'constant_value': 0.02713042048943185, 'nu': 2.5}. Best is trial 87 with value: 0.13777769741398374.
[I 2024-12-04 19:45:05,119] Trial 132 finished with value: 0.14249550883151857 and parameters: {'kernel_type': 'Matern', 'length_scale': 0.3936960276930641, 'noise_level': 0.025747579576209937, 'constant_value': 77045.12688095568, 'nu': 1.5}. Best is trial 87 with value: 0.13777769741398374.
[I 2024-12-04 19:45:05,655] Trial 133 finished with value: 0.9864686819229266 and parameters: {'kernel_type': 'Matern', 'length_scale': 27.877701698647897, 'noise_level': 0.2559518182856871, 'constant_value': 4.802109877275687e-06, 'nu': 1.5}. Best is trial 87 with value: 0.13777769741398374.
[I 2024-12-04 19:45:10,000] Trial 136 finished with value: 0.9982167338027503 and parameters: {'kernel_type': 'Matern', 'length_scale': 0.04161719330486513, 'noise_level': 2.5074798819185764e-05, 'constant_value': 23435.995235168117, 'nu': 1.5}. Best is trial 87 with value: 0.13777769741398374.
[I 2024-12-04 19:45:12,767] Trial 135 finished with value: 0.1424950234748118 and parameters: {'kernel_type': 'Matern', 'length_scale': 1.3955866441398233, 'noise_level': 0.0007587784564448541, 'constant_value': 69860.5521479894, 'nu': 1.5}. Best is trial 87 with value: 0.13777769741398374.
[I 2024-12-04 19:45:15,494] Trial 138 finished with value: 0.142495063694648 and parameters: {'kernel_type': 'Matern', 'length_scale': 180.19318442665278, 'noise_level': 0.025177320244666745, 'constant_value': 74548.3859500616, 'nu': 1.5}. Best is trial 87 with value: 0.13777769741398374.
[I 2024-12-04 19:45:17,112] Trial 137 finished with value: 0.9864686819136197 and parameters: {'kernel_type': 'Matern', 'length_scale': 0.0068923143383091716, 'noise_level': 2.2238626534536704e-09, 'constant_value': 0.7658749638135366, 'nu': 1.5}. Best is trial 87 with value: 0.13777769741398374.
[I 2024-12-04 19:45:17,128] Trial 139 finished with value: 0.9982171087886117 and parameters: {'kernel_type': 'Matern', 'length_scale': 1.2497766138571946, 'noise_level': 2.1567881428977114e-05, 'constant_value': 17382.199061496234, 'nu': 1.5}. Best is trial 87 with value: 0.13777769741398374.
[I 2024-12-04 19:45:19,049] Trial 140 finished with value: 0.9982168552880438 and parameters: {'kernel_type': 'Matern', 'length_scale': 728.3932782343222, 'noise_level': 0.2731632010855305, 'constant_value': 7.09797043546877e-07, 'nu': 1.5}. Best is trial 87 with value: 0.13777769741398374.
[I 2024-12-04 19:45:22,195] Trial 143 finished with value: 0.9982154201338183 and parameters: {'kernel_type': 'RBF', 'length_scale': 0.06935209035988925, 'noise_level': 0.46048694435043225, 'constant_value': 4.484261263504748e-05, 'nu': 0.5}. Best is trial 87 with value: 0.13777769741398374.
[I 2024-12-04 19:45:23,299] Trial 141 finished with value: 0.1424950501972194 and parameters: {'kernel_type': 'Matern', 'length_scale': 61.50515812078516, 'noise_level': 0.0005768064026319484, 'constant_value': 1078.5967619030412, 'nu': 1.5}. Best is trial 87 with value: 0.13777769741398374.
[I 2024-12-04 19:45:24,540] Trial 142 finished with value: 0.1424950781033075 and parameters: {'kernel_type': 'Matern', 'length_scale': 29.020644928723204, 'noise_level': 0.00023075329508181648, 'constant_value': 13798.60310724761, 'nu': 1.5}. Best is trial 87 with value: 0.13777769741398374.
[I 2024-12-04 19:45:29,087] Trial 146 finished with value: 0.14771027182364813 and parameters: {'kernel_type': 'RBF', 'length_scale': 24.694606406456895, 'noise_level': 0.08302986003013159, 'constant_value': 2953.752180293626, 'nu': 0.5}. Best is trial 87 with value: 0.13777769741398374.
[I 2024-12-04 19:45:29,823] Trial 145 finished with value: 0.1424950362646836 and parameters: {'kernel_type': 'Matern', 'length_scale': 14.497784907516305, 'noise_level': 0.00014971046259036448, 'constant_value': 15.827858796216201, 'nu': 1.5}. Best is trial 87 with value: 0.13777769741398374.
[I 2024-12-04 19:45:31,401] Trial 144 finished with value: 0.1424950681778 and parameters: {'kernel_type': 'Matern', 'length_scale': 0.28119146683136637, 'noise_level': 0.0048254657283502, 'constant_value': 79331.1662914703, 'nu': 1.5}. Best is trial 87 with value: 0.13777769741398374.
[I 2024-12-04 19:45:38,122] Trial 148 finished with value: 0.14249504619301703 and parameters: {'kernel_type': 'Matern', 'length_scale': 0.4240692899369422, 'noise_level': 0.0006050089514438388, 'constant_value': 2.6902549801475013, 'nu': 1.5}. Best is trial 87 with value: 0.13777769741398374.
[I 2024-12-04 19:45:42,558] Trial 150 finished with value: 0.9864686819226222 and parameters: {'kernel_type': 'Matern', 'length_scale': 0.0013367146796683146, 'noise_level': 0.0007005113747771928, 'constant_value': 0.6330047832161622, 'nu': 1.5}. Best is trial 87 with value: 0.13777769741398374.
[I 2024-12-04 19:45:42,935] Trial 149 finished with value: 0.9864686819423296 and parameters: {'kernel_type': 'Matern', 'length_scale': 0.13775292707312928, 'noise_level': 0.001195457765799628, 'constant_value': 1.4635627566395901e-07, 'nu': 1.5}. Best is trial 87 with value: 0.13777769741398374.
[I 2024-12-04 19:45:45,913] Trial 147 finished with value: 0.14249510859324768 and parameters: {'kernel_type': 'Matern', 'length_scale': 26.789934802701833, 'noise_level': 0.8881413472475486, 'constant_value': 4.628692357632282e-06, 'nu': 1.5}. Best is trial 87 with value: 0.13777769741398374.
[I 2024-12-04 19:45:51,141] Trial 151 finished with value: 0.14249527372844167 and parameters: {'kernel_type': 'Matern', 'length_scale': 2.7064390576261443, 'noise_level': 0.0010839930317989434, 'constant_value': 55664.22102298708, 'nu': 1.5}. Best is trial 87 with value: 0.13777769741398374.
[I 2024-12-04 19:45:56,994] Trial 153 finished with value: 0.9864686820376979 and parameters: {'kernel_type': 'Matern', 'length_scale': 0.014061949370519819, 'noise_level': 0.0005894751145463465, 'constant_value': 1353.6050277989202, 'nu': 0.5}. Best is trial 87 with value: 0.13777769741398374.
[I 2024-12-04 19:45:59,556] Trial 152 finished with value: 0.14249570119768587 and parameters: {'kernel_type': 'Matern', 'length_scale': 0.12895192012986112, 'noise_level': 0.0003882005107933663, 'constant_value': 0.18336482718461908, 'nu': 1.5}. Best is trial 87 with value: 0.13777769741398374.
[I 2024-12-04 19:46:01,458] Trial 154 finished with value: 0.1477106696863458 and parameters: {'kernel_type': 'RBF', 'length_scale': 0.4360045861314085, 'noise_level': 0.000980370537761798, 'constant_value': 37.129495801819075, 'nu': 1.5}. Best is trial 87 with value: 0.13777769741398374.
[I 2024-12-04 19:46:07,571] Trial 156 finished with value: 0.9864686819260579 and parameters: {'kernel_type': 'Matern', 'length_scale': 61.02127342924923, 'noise_level': 0.0001618875179876872, 'constant_value': 4.297616903475375, 'nu': 1.5}. Best is trial 87 with value: 0.13777769741398374.
[I 2024-12-04 19:46:09,898] Trial 155 finished with value: 0.1446987965425533 and parameters: {'kernel_type': 'Matern', 'length_scale': 0.8804270276379654, 'noise_level': 0.06910152093518535, 'constant_value': 4.1788928627119586e-07, 'nu': 2.5}. Best is trial 87 with value: 0.13777769741398374.
[I 2024-12-04 19:46:10,166] Trial 157 finished with value: 0.14249506639619802 and parameters: {'kernel_type': 'Matern', 'length_scale': 0.3318549073999494, 'noise_level': 0.0008092810917506391, 'constant_value': 42.6384896262992, 'nu': 1.5}. Best is trial 87 with value: 0.13777769741398374.
[I 2024-12-04 19:46:16,066] Trial 158 finished with value: 0.1972000131290395 and parameters: {'kernel_type': 'Matern', 'length_scale': 18.61821496864424, 'noise_level': 0.0003252290007837532, 'constant_value': 69.0118348652692, 'nu': 0.5}. Best is trial 87 with value: 0.13777769741398374.
[I 2024-12-04 19:46:17,358] Trial 159 finished with value: 0.14249505877885082 and parameters: {'kernel_type': 'Matern', 'length_scale': 15.430202179777586, 'noise_level': 0.0003233819352571093, 'constant_value': 65.57022339516224, 'nu': 1.5}. Best is trial 87 with value: 0.13777769741398374.
[I 2024-12-04 19:46:18,645] Trial 160 finished with value: 0.9864686819231061 and parameters: {'kernel_type': 'Matern', 'length_scale': 3018.5119446897297, 'noise_level': 0.0007963798082072217, 'constant_value': 151.73817458899507, 'nu': 1.5}. Best is trial 87 with value: 0.13777769741398374.
[I 2024-12-04 19:46:20,860] Trial 161 finished with value: 0.998217109008208 and parameters: {'kernel_type': 'Matern', 'length_scale': 10.444370410935612, 'noise_level': 4.352748704240288e-06, 'constant_value': 63.75418688586374, 'nu': 1.5}. Best is trial 87 with value: 0.13777769741398374.
[I 2024-12-04 19:46:24,693] Trial 163 finished with value: 0.1424952899355273 and parameters: {'kernel_type': 'Matern', 'length_scale': 35.930649171191995, 'noise_level': 0.016113082763277345, 'constant_value': 5562.6110793684775, 'nu': 1.5}. Best is trial 87 with value: 0.13777769741398374.
[I 2024-12-04 19:46:25,056] Trial 162 finished with value: 0.14249506236102213 and parameters: {'kernel_type': 'Matern', 'length_scale': 1.9086000817770172, 'noise_level': 0.005159037056291734, 'constant_value': 267.8883853483581, 'nu': 1.5}. Best is trial 87 with value: 0.13777769741398374.
[I 2024-12-04 19:46:30,442] Trial 164 finished with value: 0.986468681784895 and parameters: {'kernel_type': 'RBF', 'length_scale': 1581.380117746621, 'noise_level': 2.915776174093117e-10, 'constant_value': 0.013078917660621699, 'nu': 1.5}. Best is trial 87 with value: 0.13777769741398374.
[I 2024-12-04 19:46:32,258] Trial 165 finished with value: 0.9864686819007056 and parameters: {'kernel_type': 'RBF', 'length_scale': 9.981392502130193e-05, 'noise_level': 9.221373502227168e-10, 'constant_value': 1.8363570261162132e-06, 'nu': 1.5}. Best is trial 87 with value: 0.13777769741398374.
[I 2024-12-04 19:46:34,487] Trial 166 finished with value: 0.1424950598176036 and parameters: {'kernel_type': 'Matern', 'length_scale': 2.1051955503489754, 'noise_level': 0.0002174752002391082, 'constant_value': 237.9480773302203, 'nu': 1.5}. Best is trial 87 with value: 0.13777769741398374.
[I 2024-12-04 19:46:42,281] Trial 167 finished with value: 0.19719901217769134 and parameters: {'kernel_type': 'Matern', 'length_scale': 0.6080367748385791, 'noise_level': 0.015326226473591964, 'constant_value': 5.136201632519324e-05, 'nu': 0.5}. Best is trial 87 with value: 0.13777769741398374.
[I 2024-12-04 19:46:42,455] Trial 169 finished with value: 0.9982170893182521 and parameters: {'kernel_type': 'Matern', 'length_scale': 1.0521339499488078, 'noise_level': 0.043312803512825626, 'constant_value': 6.253631856374239e-07, 'nu': 1.5}. Best is trial 87 with value: 0.13777769741398374.
[I 2024-12-04 19:46:44,464] Trial 168 finished with value: 0.9864686819613272 and parameters: {'kernel_type': 'Matern', 'length_scale': 21.59975681164689, 'noise_level': 0.002024164253238083, 'constant_value': 0.0005994984698892145, 'nu': 1.5}. Best is trial 87 with value: 0.13777769741398374.
[I 2024-12-04 19:46:46,959] Trial 170 finished with value: 0.9982170590691167 and parameters: {'kernel_type': 'Matern', 'length_scale': 0.9376792716204985, 'noise_level': 7.963783976077479e-07, 'constant_value': 1.6233107760691807, 'nu': 1.5}. Best is trial 87 with value: 0.13777769741398374.
[I 2024-12-04 19:46:49,702] Trial 171 finished with value: 0.9864686819439134 and parameters: {'kernel_type': 'RBF', 'length_scale': 85817.37366590372, 'noise_level': 3.309295713321343e-10, 'constant_value': 3.5233894269070583e-06, 'nu': 0.5}. Best is trial 87 with value: 0.13777769741398374.
[I 2024-12-04 19:46:56,139] Trial 173 finished with value: 0.14249499272480498 and parameters: {'kernel_type': 'Matern', 'length_scale': 3.4111459041857493, 'noise_level': 0.035018934016035244, 'constant_value': 216.307140052337, 'nu': 1.5}. Best is trial 87 with value: 0.13777769741398374.
[I 2024-12-04 19:46:56,456] Trial 172 finished with value: 0.14249525607319166 and parameters: {'kernel_type': 'Matern', 'length_scale': 5.094938464836731, 'noise_level': 0.7460258584540694, 'constant_value': 1.4960934110579028e-06, 'nu': 1.5}. Best is trial 87 with value: 0.13777769741398374.
[I 2024-12-04 19:46:56,696] Trial 174 finished with value: 0.14249505077394492 and parameters: {'kernel_type': 'Matern', 'length_scale': 205.8969474306879, 'noise_level': 6.862604757407102e-05, 'constant_value': 25588.637245703205, 'nu': 1.5}. Best is trial 87 with value: 0.13777769741398374.
[I 2024-12-04 19:47:00,276] Trial 175 finished with value: 0.9864686818082582 and parameters: {'kernel_type': 'Matern', 'length_scale': 0.06762655169566684, 'noise_level': 0.006475584859652754, 'constant_value': 362.2195504719338, 'nu': 1.5}. Best is trial 87 with value: 0.13777769741398374.
[I 2024-12-04 19:47:04,313] Trial 176 finished with value: 0.14249518970784109 and parameters: {'kernel_type': 'Matern', 'length_scale': 401.0012317474143, 'noise_level': 2.2762069289244474e-05, 'constant_value': 64341.620977572726, 'nu': 1.5}. Best is trial 87 with value: 0.13777769741398374.
[I 2024-12-04 19:47:04,338] Trial 177 finished with value: 0.14249500504945123 and parameters: {'kernel_type': 'Matern', 'length_scale': 44.15789094587056, 'noise_level': 0.0002856550911054662, 'constant_value': 1024.1225947133198, 'nu': 1.5}. Best is trial 87 with value: 0.13777769741398374.
[I 2024-12-04 19:47:07,312] Trial 178 finished with value: 0.14249512956619367 and parameters: {'kernel_type': 'Matern', 'length_scale': 89.51580286632566, 'noise_level': 0.20097520840418578, 'constant_value': 552.950585733893, 'nu': 1.5}. Best is trial 87 with value: 0.13777769741398374.
[I 2024-12-04 19:47:10,601] Trial 179 finished with value: 0.14771040015883746 and parameters: {'kernel_type': 'RBF', 'length_scale': 5.992375518855031, 'noise_level': 0.001329797894180605, 'constant_value': 92907.4931142477, 'nu': 1.5}. Best is trial 87 with value: 0.13777769741398374.
[I 2024-12-04 19:47:14,922] Trial 180 finished with value: 0.14249505329008097 and parameters: {'kernel_type': 'Matern', 'length_scale': 123.82595315662093, 'noise_level': 0.00029974696602096205, 'constant_value': 754.9486194314123, 'nu': 1.5}. Best is trial 87 with value: 0.13777769741398374.
