[I 2024-12-04 15:21:39,009] Trial 1997 finished with value: 0.4947791168315972 and parameters: {'n_estimators': 1144, 'learning_rate': 0.06453126190907817, 'max_depth': 10, 'min_samples_split': 17, 'min_samples_leaf': 1, 'subsample': 0.9258332196070136, 'max_features': None}. Best is trial 1435 with value: 0.45467030752684195.
[I 2024-12-04 15:21:40,122] Trial 2009 finished with value: 0.6208443693445835 and parameters: {'n_estimators': 838, 'learning_rate': 0.060661149668871726, 'max_depth': 11, 'min_samples_split': 20, 'min_samples_leaf': 3, 'subsample': 0.9815972527693222, 'max_features': None}. Best is trial 1435 with value: 0.45467030752684195.
[I 2024-12-04 15:21:40,527] Trial 2003 finished with value: 0.48387197642417407 and parameters: {'n_estimators': 1022, 'learning_rate': 0.061617591871146696, 'max_depth': 10, 'min_samples_split': 20, 'min_samples_leaf': 1, 'subsample': 0.9318193179470452, 'max_features': None}. Best is trial 1435 with value: 0.45467030752684195.
[I 2024-12-04 15:21:43,730] Trial 2011 finished with value: 0.6411792692126965 and parameters: {'n_estimators': 874, 'learning_rate': 0.06383437489257461, 'max_depth': 12, 'min_samples_split': 16, 'min_samples_leaf': 3, 'subsample': 0.9941081321560306, 'max_features': None}. Best is trial 1435 with value: 0.45467030752684195.
[I 2024-12-04 15:21:44,930] Trial 2006 finished with value: 0.6654638903265929 and parameters: {'n_estimators': 993, 'learning_rate': 0.0847778005375128, 'max_depth': 12, 'min_samples_split': 20, 'min_samples_leaf': 3, 'subsample': 0.9665308824222425, 'max_features': None}. Best is trial 1435 with value: 0.45467030752684195.
[I 2024-12-04 15:21:44,986] Trial 2002 finished with value: 0.4863755332859824 and parameters: {'n_estimators': 1094, 'learning_rate': 0.09238133090940745, 'max_depth': 10, 'min_samples_split': 18, 'min_samples_leaf': 1, 'subsample': 0.9886793419920914, 'max_features': None}. Best is trial 1435 with value: 0.45467030752684195.
[I 2024-12-04 15:21:45,960] Trial 2005 finished with value: 0.6301384358535684 and parameters: {'n_estimators': 1098, 'learning_rate': 0.06102034438959033, 'max_depth': 12, 'min_samples_split': 18, 'min_samples_leaf': 3, 'subsample': 0.9885398885480688, 'max_features': None}. Best is trial 1435 with value: 0.45467030752684195.
[I 2024-12-04 15:21:46,870] Trial 2004 finished with value: 0.4855214845070169 and parameters: {'n_estimators': 1161, 'learning_rate': 0.09877976142880167, 'max_depth': 11, 'min_samples_split': 17, 'min_samples_leaf': 1, 'subsample': 0.9316913419848573, 'max_features': None}. Best is trial 1435 with value: 0.45467030752684195.
[I 2024-12-04 15:21:49,198] Trial 2010 finished with value: 0.6489352838665957 and parameters: {'n_estimators': 1049, 'learning_rate': 0.07048829651694619, 'max_depth': 12, 'min_samples_split': 17, 'min_samples_leaf': 3, 'subsample': 0.9330542978679734, 'max_features': None}. Best is trial 1435 with value: 0.45467030752684195.
[I 2024-12-04 15:21:49,700] Trial 2018 finished with value: 0.9786252490695212 and parameters: {'n_estimators': 810, 'learning_rate': 0.011596307442282596, 'max_depth': 11, 'min_samples_split': 4, 'min_samples_leaf': 5, 'subsample': 0.6101668128615434, 'max_features': 'log2'}. Best is trial 1435 with value: 0.45467030752684195.
[I 2024-12-04 15:21:51,528] Trial 2008 finished with value: 0.6532980156480195 and parameters: {'n_estimators': 1190, 'learning_rate': 0.08608353956104516, 'max_depth': 12, 'min_samples_split': 18, 'min_samples_leaf': 3, 'subsample': 0.9973752394642901, 'max_features': None}. Best is trial 1435 with value: 0.45467030752684195.
[I 2024-12-04 15:21:52,838] Trial 2022 finished with value: 0.7947183173839971 and parameters: {'n_estimators': 826, 'learning_rate': 0.09400175199163048, 'max_depth': 3, 'min_samples_split': 17, 'min_samples_leaf': 8, 'subsample': 0.7704397893438366, 'max_features': 'log2'}. Best is trial 1435 with value: 0.45467030752684195.
[I 2024-12-04 15:21:52,897] Trial 2016 finished with value: 0.4724035352705861 and parameters: {'n_estimators': 825, 'learning_rate': 0.062075168875790454, 'max_depth': 12, 'min_samples_split': 20, 'min_samples_leaf': 1, 'subsample': 0.9755255114595227, 'max_features': None}. Best is trial 1435 with value: 0.45467030752684195.
[I 2024-12-04 15:21:54,808] Trial 2032 finished with value: 0.6272921345376152 and parameters: {'n_estimators': 573, 'learning_rate': 0.05309800272963394, 'max_depth': 5, 'min_samples_split': 14, 'min_samples_leaf': 1, 'subsample': 0.7356335082522876, 'max_features': 'log2'}. Best is trial 1435 with value: 0.45467030752684195.
[I 2024-12-04 15:21:56,178] Trial 2007 finished with value: 0.47955816728581885 and parameters: {'n_estimators': 1265, 'learning_rate': 0.06015739548598702, 'max_depth': 11, 'min_samples_split': 20, 'min_samples_leaf': 1, 'subsample': 0.9260352962682639, 'max_features': None}. Best is trial 1435 with value: 0.45467030752684195.
[I 2024-12-04 15:21:58,124] Trial 2014 finished with value: 0.6378152858418505 and parameters: {'n_estimators': 1007, 'learning_rate': 0.07550174763303852, 'max_depth': 12, 'min_samples_split': 19, 'min_samples_leaf': 3, 'subsample': 0.998788688388602, 'max_features': None}. Best is trial 1435 with value: 0.45467030752684195.
[I 2024-12-04 15:22:01,145] Trial 2017 finished with value: 0.488734728037488 and parameters: {'n_estimators': 1044, 'learning_rate': 0.08522794101219751, 'max_depth': 12, 'min_samples_split': 18, 'min_samples_leaf': 1, 'subsample': 0.9985596900438425, 'max_features': None}. Best is trial 1435 with value: 0.45467030752684195.
[I 2024-12-04 15:22:01,770] Trial 2019 finished with value: 0.4949218735197127 and parameters: {'n_estimators': 1009, 'learning_rate': 0.05999832302977987, 'max_depth': 11, 'min_samples_split': 17, 'min_samples_leaf': 1, 'subsample': 0.9890267909814041, 'max_features': None}. Best is trial 1435 with value: 0.45467030752684195.
[I 2024-12-04 15:22:01,885] Trial 2036 finished with value: 0.6431267299952235 and parameters: {'n_estimators': 629, 'learning_rate': 0.05919466780854705, 'max_depth': 5, 'min_samples_split': 4, 'min_samples_leaf': 3, 'subsample': 0.6162263110544685, 'max_features': None}. Best is trial 1435 with value: 0.45467030752684195.
[I 2024-12-04 15:22:02,117] Trial 2024 finished with value: 0.48774312030565664 and parameters: {'n_estimators': 912, 'learning_rate': 0.05977615189622802, 'max_depth': 11, 'min_samples_split': 20, 'min_samples_leaf': 1, 'subsample': 0.9910394109640307, 'max_features': None}. Best is trial 1435 with value: 0.45467030752684195.
[I 2024-12-04 15:22:02,637] Trial 2012 finished with value: 0.6697924507043711 and parameters: {'n_estimators': 1271, 'learning_rate': 0.09254663254920467, 'max_depth': 12, 'min_samples_split': 16, 'min_samples_leaf': 3, 'subsample': 0.934133977123344, 'max_features': None}. Best is trial 1435 with value: 0.45467030752684195.
[I 2024-12-04 15:22:03,757] Trial 2013 finished with value: 0.6042603366030366 and parameters: {'n_estimators': 1436, 'learning_rate': 0.01278561890994707, 'max_depth': 4, 'min_samples_split': 16, 'min_samples_leaf': 2, 'subsample': 0.8843261642502739, 'max_features': None}. Best is trial 1435 with value: 0.45467030752684195.
[I 2024-12-04 15:22:03,874] Trial 2034 finished with value: 0.5307709041641909 and parameters: {'n_estimators': 786, 'learning_rate': 0.09300183003979895, 'max_depth': 10, 'min_samples_split': 14, 'min_samples_leaf': 1, 'subsample': 0.9987577183848104, 'max_features': 'sqrt'}. Best is trial 1435 with value: 0.45467030752684195.
[I 2024-12-04 15:22:04,675] Trial 2039 finished with value: 0.6664847754225506 and parameters: {'n_estimators': 537, 'learning_rate': 0.06639129419650193, 'max_depth': 12, 'min_samples_split': 8, 'min_samples_leaf': 6, 'subsample': 0.8885827782098052, 'max_features': 'sqrt'}. Best is trial 1435 with value: 0.45467030752684195.
[I 2024-12-04 15:22:07,857] Trial 2021 finished with value: 0.5123153572251281 and parameters: {'n_estimators': 1062, 'learning_rate': 0.06723107923016497, 'max_depth': 12, 'min_samples_split': 16, 'min_samples_leaf': 1, 'subsample': 0.9180533889792214, 'max_features': None}. Best is trial 1435 with value: 0.45467030752684195.
[I 2024-12-04 15:22:10,296] Trial 2047 finished with value: 0.689574413566107 and parameters: {'n_estimators': 496, 'learning_rate': 0.01199473699395947, 'max_depth': 4, 'min_samples_split': 2, 'min_samples_leaf': 10, 'subsample': 0.7386506351941037, 'max_features': None}. Best is trial 1435 with value: 0.45467030752684195.
[I 2024-12-04 15:22:10,424] Trial 2023 finished with value: 0.4849864448629315 and parameters: {'n_estimators': 1115, 'learning_rate': 0.07481442665339397, 'max_depth': 11, 'min_samples_split': 20, 'min_samples_leaf': 1, 'subsample': 0.976129521197984, 'max_features': None}. Best is trial 1435 with value: 0.45467030752684195.
[I 2024-12-04 15:22:11,098] Trial 2027 finished with value: 0.612785037994081 and parameters: {'n_estimators': 1047, 'learning_rate': 0.059615748773269424, 'max_depth': 12, 'min_samples_split': 20, 'min_samples_leaf': 2, 'subsample': 0.9940571250322965, 'max_features': None}. Best is trial 1435 with value: 0.45467030752684195.
[I 2024-12-04 15:22:11,191] Trial 2029 finished with value: 0.639604204532275 and parameters: {'n_estimators': 1131, 'learning_rate': 0.010498919308664964, 'max_depth': 9, 'min_samples_split': 17, 'min_samples_leaf': 8, 'subsample': 0.9220205001888595, 'max_features': None}. Best is trial 1435 with value: 0.45467030752684195.
[I 2024-12-04 15:22:11,223] Trial 2030 finished with value: 0.6590177483582371 and parameters: {'n_estimators': 1145, 'learning_rate': 0.01351957711522586, 'max_depth': 12, 'min_samples_split': 17, 'min_samples_leaf': 8, 'subsample': 0.7809539238564412, 'max_features': None}. Best is trial 1435 with value: 0.45467030752684195.
[I 2024-12-04 15:22:11,573] Trial 2042 finished with value: 1.143863882527912 and parameters: {'n_estimators': 689, 'learning_rate': 0.013413745645060473, 'max_depth': 4, 'min_samples_split': 13, 'min_samples_leaf': 9, 'subsample': 0.627042742200868, 'max_features': 'log2'}. Best is trial 1435 with value: 0.45467030752684195.
[I 2024-12-04 15:22:12,088] Trial 2026 finished with value: 0.4733587453326656 and parameters: {'n_estimators': 1144, 'learning_rate': 0.07522977531160074, 'max_depth': 11, 'min_samples_split': 19, 'min_samples_leaf': 1, 'subsample': 0.9968590466460465, 'max_features': None}. Best is trial 1435 with value: 0.45467030752684195.
[I 2024-12-04 15:22:13,435] Trial 2025 finished with value: 0.4872338114110755 and parameters: {'n_estimators': 1131, 'learning_rate': 0.060853943694018336, 'max_depth': 12, 'min_samples_split': 17, 'min_samples_leaf': 1, 'subsample': 0.9770572184113432, 'max_features': None}. Best is trial 1435 with value: 0.45467030752684195.
[I 2024-12-04 15:22:13,902] Trial 2028 finished with value: 0.6354248646457681 and parameters: {'n_estimators': 1213, 'learning_rate': 0.06031425569487037, 'max_depth': 12, 'min_samples_split': 20, 'min_samples_leaf': 2, 'subsample': 0.9879190167771714, 'max_features': None}. Best is trial 1435 with value: 0.45467030752684195.
[I 2024-12-04 15:22:14,119] Trial 2031 finished with value: 0.5089221402570532 and parameters: {'n_estimators': 1136, 'learning_rate': 0.09619933914925764, 'max_depth': 12, 'min_samples_split': 18, 'min_samples_leaf': 1, 'subsample': 0.9535155564941851, 'max_features': None}. Best is trial 1435 with value: 0.45467030752684195.
[I 2024-12-04 15:22:14,324] Trial 2040 finished with value: 0.48909015903032765 and parameters: {'n_estimators': 820, 'learning_rate': 0.09420773760346035, 'max_depth': 12, 'min_samples_split': 17, 'min_samples_leaf': 1, 'subsample': 0.9981473696976633, 'max_features': None}. Best is trial 1435 with value: 0.45467030752684195.
[I 2024-12-04 15:22:14,542] Trial 2033 finished with value: 0.46509210800022915 and parameters: {'n_estimators': 1073, 'learning_rate': 0.07825834573046775, 'max_depth': 12, 'min_samples_split': 20, 'min_samples_leaf': 1, 'subsample': 0.95063092659862, 'max_features': None}. Best is trial 1435 with value: 0.45467030752684195.
[I 2024-12-04 15:22:15,828] Trial 2037 finished with value: 0.4805133805938027 and parameters: {'n_estimators': 1036, 'learning_rate': 0.06154864912771612, 'max_depth': 11, 'min_samples_split': 20, 'min_samples_leaf': 1, 'subsample': 0.938398693573501, 'max_features': None}. Best is trial 1435 with value: 0.45467030752684195.
[I 2024-12-04 15:22:19,459] Trial 2035 finished with value: 0.4897858545188012 and parameters: {'n_estimators': 1190, 'learning_rate': 0.06735269241198133, 'max_depth': 11, 'min_samples_split': 17, 'min_samples_leaf': 1, 'subsample': 0.9993526850618106, 'max_features': None}. Best is trial 1435 with value: 0.45467030752684195.
[I 2024-12-04 15:22:19,519] Trial 2038 finished with value: 0.6358954805553422 and parameters: {'n_estimators': 1120, 'learning_rate': 0.07216406250227804, 'max_depth': 11, 'min_samples_split': 20, 'min_samples_leaf': 2, 'subsample': 0.9983941436835001, 'max_features': None}. Best is trial 1435 with value: 0.45467030752684195.
[I 2024-12-04 15:22:21,148] Trial 2045 finished with value: 0.6603220342248046 and parameters: {'n_estimators': 947, 'learning_rate': 0.09443877634417681, 'max_depth': 12, 'min_samples_split': 20, 'min_samples_leaf': 3, 'subsample': 0.9716563410083763, 'max_features': None}. Best is trial 1435 with value: 0.45467030752684195.
[I 2024-12-04 15:22:23,861] Trial 2046 finished with value: 0.6594200168338169 and parameters: {'n_estimators': 1032, 'learning_rate': 0.09449311508647619, 'max_depth': 10, 'min_samples_split': 18, 'min_samples_leaf': 3, 'subsample': 0.9354216033496685, 'max_features': None}. Best is trial 1435 with value: 0.45467030752684195.
[I 2024-12-04 15:22:24,786] Trial 2051 finished with value: 0.4980256030783535 and parameters: {'n_estimators': 678, 'learning_rate': 0.05751877789870287, 'max_depth': 12, 'min_samples_split': 16, 'min_samples_leaf': 1, 'subsample': 0.995211573945548, 'max_features': None}. Best is trial 1435 with value: 0.45467030752684195.
[I 2024-12-04 15:22:25,037] Trial 2043 finished with value: 0.6748751118322911 and parameters: {'n_estimators': 1458, 'learning_rate': 0.07298188607243468, 'max_depth': 9, 'min_samples_split': 12, 'min_samples_leaf': 3, 'subsample': 0.7597514203928752, 'max_features': 'sqrt'}. Best is trial 1435 with value: 0.45467030752684195.
[I 2024-12-04 15:22:27,098] Trial 2044 finished with value: 0.5178578732614565 and parameters: {'n_estimators': 1139, 'learning_rate': 0.058644580188550954, 'max_depth': 12, 'min_samples_split': 16, 'min_samples_leaf': 1, 'subsample': 0.9339502951347344, 'max_features': None}. Best is trial 1435 with value: 0.45467030752684195.
[I 2024-12-04 15:22:27,200] Trial 2041 finished with value: 0.504958131745909 and parameters: {'n_estimators': 1218, 'learning_rate': 0.09762683668196884, 'max_depth': 12, 'min_samples_split': 20, 'min_samples_leaf': 1, 'subsample': 0.9686286906254914, 'max_features': None}. Best is trial 1435 with value: 0.45467030752684195.
[I 2024-12-04 15:22:27,219] Trial 2048 finished with value: 0.4984009939860326 and parameters: {'n_estimators': 1022, 'learning_rate': 0.0896957008500031, 'max_depth': 10, 'min_samples_split': 20, 'min_samples_leaf': 1, 'subsample': 0.9147934162218401, 'max_features': None}. Best is trial 1435 with value: 0.45467030752684195.
[I 2024-12-04 15:22:28,119] Trial 2050 finished with value: 0.6589523849373686 and parameters: {'n_estimators': 978, 'learning_rate': 0.06644323695742937, 'max_depth': 12, 'min_samples_split': 20, 'min_samples_leaf': 3, 'subsample': 0.9327818536336498, 'max_features': None}. Best is trial 1435 with value: 0.45467030752684195.
[I 2024-12-04 15:22:28,321] Trial 2049 finished with value: 0.49806751065882726 and parameters: {'n_estimators': 1026, 'learning_rate': 0.08549121031436045, 'max_depth': 12, 'min_samples_split': 20, 'min_samples_leaf': 1, 'subsample': 0.928517417418951, 'max_features': None}. Best is trial 1435 with value: 0.45467030752684195.
[I 2024-12-04 15:22:29,687] Trial 2062 finished with value: 1.060358681232393 and parameters: {'n_estimators': 346, 'learning_rate': 0.02355202860632248, 'max_depth': 4, 'min_samples_split': 14, 'min_samples_leaf': 10, 'subsample': 0.8897524030793724, 'max_features': 'log2'}. Best is trial 1435 with value: 0.45467030752684195.
[I 2024-12-04 15:22:30,191] Trial 2055 finished with value: 0.5467053479575539 and parameters: {'n_estimators': 908, 'learning_rate': 0.0531906512398902, 'max_depth': 11, 'min_samples_split': 15, 'min_samples_leaf': 1, 'subsample': 0.8706027718006272, 'max_features': 'sqrt'}. Best is trial 1435 with value: 0.45467030752684195.
[I 2024-12-04 15:22:37,088] Trial 2057 finished with value: 0.6254161495053927 and parameters: {'n_estimators': 885, 'learning_rate': 0.06370033299272267, 'max_depth': 12, 'min_samples_split': 18, 'min_samples_leaf': 3, 'subsample': 0.992788338338218, 'max_features': None}. Best is trial 1435 with value: 0.45467030752684195.
[I 2024-12-04 15:22:38,559] Trial 2054 finished with value: 0.49182330529903634 and parameters: {'n_estimators': 1067, 'learning_rate': 0.04903347360531288, 'max_depth': 12, 'min_samples_split': 19, 'min_samples_leaf': 1, 'subsample': 0.9193623586421873, 'max_features': None}. Best is trial 1435 with value: 0.45467030752684195.
[I 2024-12-04 15:22:39,244] Trial 2053 finished with value: 0.6296203631415718 and parameters: {'n_estimators': 851, 'learning_rate': 0.05488067701143551, 'max_depth': 10, 'min_samples_split': 19, 'min_samples_leaf': 3, 'subsample': 0.9299919312049261, 'max_features': None}. Best is trial 1435 with value: 0.45467030752684195.
[I 2024-12-04 15:22:40,899] Trial 2064 finished with value: 0.5872499865945816 and parameters: {'n_estimators': 736, 'learning_rate': 0.013354966040548599, 'max_depth': 12, 'min_samples_split': 7, 'min_samples_leaf': 6, 'subsample': 0.8269975278459094, 'max_features': None}. Best is trial 1435 with value: 0.45467030752684195.
[I 2024-12-04 15:22:42,418] Trial 2080 finished with value: 0.9189533918069073 and parameters: {'n_estimators': 346, 'learning_rate': 0.05298922430227674, 'max_depth': 10, 'min_samples_split': 15, 'min_samples_leaf': 6, 'subsample': 0.6293928322804132, 'max_features': 'log2'}. Best is trial 1435 with value: 0.45467030752684195.
[I 2024-12-04 15:22:42,896] Trial 2060 finished with value: 0.5783252016866326 and parameters: {'n_estimators': 1044, 'learning_rate': 0.012996041740515094, 'max_depth': 7, 'min_samples_split': 7, 'min_samples_leaf': 1, 'subsample': 0.6552316567570151, 'max_features': 'sqrt'}. Best is trial 1435 with value: 0.45467030752684195.
[I 2024-12-04 15:22:43,485] Trial 2058 finished with value: 0.9375198834589478 and parameters: {'n_estimators': 1382, 'learning_rate': 0.013569383704150409, 'max_depth': 8, 'min_samples_split': 11, 'min_samples_leaf': 10, 'subsample': 0.8021661569217502, 'max_features': 'log2'}. Best is trial 1435 with value: 0.45467030752684195.
[I 2024-12-04 15:22:46,171] Trial 2081 finished with value: 0.8114030681039591 and parameters: {'n_estimators': 441, 'learning_rate': 0.08297797220847367, 'max_depth': 12, 'min_samples_split': 16, 'min_samples_leaf': 10, 'subsample': 0.7297524325736227, 'max_features': 'sqrt'}. Best is trial 1435 with value: 0.45467030752684195.
[I 2024-12-04 15:22:46,721] Trial 2065 finished with value: 0.7504905229847457 and parameters: {'n_estimators': 843, 'learning_rate': 0.03607085651912635, 'max_depth': 8, 'min_samples_split': 5, 'min_samples_leaf': 10, 'subsample': 0.888526446015772, 'max_features': None}. Best is trial 1435 with value: 0.45467030752684195.
[I 2024-12-04 15:22:47,256] Trial 2056 finished with value: 0.48172915113561093 and parameters: {'n_estimators': 1054, 'learning_rate': 0.05333974745688813, 'max_depth': 11, 'min_samples_split': 20, 'min_samples_leaf': 1, 'subsample': 0.9977877362576817, 'max_features': None}. Best is trial 1435 with value: 0.45467030752684195.
[I 2024-12-04 15:22:50,122] Trial 2067 finished with value: 0.6510994030773268 and parameters: {'n_estimators': 874, 'learning_rate': 0.09682567049576846, 'max_depth': 10, 'min_samples_split': 20, 'min_samples_leaf': 2, 'subsample': 0.9961744281539724, 'max_features': None}. Best is trial 1435 with value: 0.45467030752684195.
[I 2024-12-04 15:22:50,538] Trial 2052 finished with value: 0.5196079724361747 and parameters: {'n_estimators': 1287, 'learning_rate': 0.09523092067337559, 'max_depth': 10, 'min_samples_split': 14, 'min_samples_leaf': 1, 'subsample': 0.9850439890947297, 'max_features': None}. Best is trial 1435 with value: 0.45467030752684195.
[I 2024-12-04 15:22:52,714] Trial 2077 finished with value: 0.6781014421825132 and parameters: {'n_estimators': 796, 'learning_rate': 0.09007153940295493, 'max_depth': 4, 'min_samples_split': 6, 'min_samples_leaf': 2, 'subsample': 0.9754419857261944, 'max_features': 'log2'}. Best is trial 1435 with value: 0.45467030752684195.
[I 2024-12-04 15:22:54,022] Trial 2073 finished with value: 0.6582088130073288 and parameters: {'n_estimators': 841, 'learning_rate': 0.09280565781523253, 'max_depth': 12, 'min_samples_split': 20, 'min_samples_leaf': 3, 'subsample': 0.9031898015060187, 'max_features': None}. Best is trial 1435 with value: 0.45467030752684195.
[I 2024-12-04 15:22:54,038] Trial 2066 finished with value: 0.46737935109053536 and parameters: {'n_estimators': 888, 'learning_rate': 0.07611432635061256, 'max_depth': 12, 'min_samples_split': 20, 'min_samples_leaf': 1, 'subsample': 0.9939254971323626, 'max_features': None}. Best is trial 1435 with value: 0.45467030752684195.
