[I 2024-12-03 18:48:25,331] Trial 1624 finished with value: 0.4670721117942939 and parameters: {'kernel': 'rbf', 'C': 29.224988537192363, 'gamma': 0.027964745974837838, 'epsilon': 0.06732261085170932}. Best is trial 1119 with value: 0.4485361816812923.
[I 2024-12-03 18:48:25,675] Trial 1601 finished with value: 0.5155924558442355 and parameters: {'kernel': 'rbf', 'C': 30.064374016543184, 'gamma': 0.00909552412149654, 'epsilon': 0.025690679723543892}. Best is trial 1119 with value: 0.4485361816812923.
[I 2024-12-03 18:48:26,091] Trial 1612 finished with value: 0.5010491222209573 and parameters: {'kernel': 'rbf', 'C': 90.97223050504317, 'gamma': 0.028212944522738728, 'epsilon': 0.012113447362721146}. Best is trial 1119 with value: 0.4485361816812923.
[I 2024-12-03 18:48:26,107] Trial 1621 finished with value: 0.4529607940042013 and parameters: {'kernel': 'rbf', 'C': 93.19607402813314, 'gamma': 0.011461816732463888, 'epsilon': 0.05978847584072194}. Best is trial 1119 with value: 0.4485361816812923.
[I 2024-12-03 18:48:26,259] Trial 1623 finished with value: 0.4641804992220951 and parameters: {'kernel': 'rbf', 'C': 88.00919850570118, 'gamma': 0.013982464391707358, 'epsilon': 0.12707360925436667}. Best is trial 1119 with value: 0.4485361816812923.
[I 2024-12-03 18:48:26,260] Trial 1619 finished with value: 0.5710843621646788 and parameters: {'kernel': 'rbf', 'C': 26.714281378371176, 'gamma': 0.054803452971335015, 'epsilon': 0.4046491840723121}. Best is trial 1119 with value: 0.4485361816812923.
[I 2024-12-03 18:48:26,526] Trial 1617 finished with value: 0.4676907637651571 and parameters: {'kernel': 'rbf', 'C': 19.28393222343617, 'gamma': 0.023447062163506522, 'epsilon': 0.1303506789012982}. Best is trial 1119 with value: 0.4485361816812923.
[I 2024-12-03 18:48:26,873] Trial 1615 finished with value: 0.7420259875627324 and parameters: {'kernel': 'rbf', 'C': 19.43685019777224, 'gamma': 0.0006480594540904298, 'epsilon': 0.13318216219993576}. Best is trial 1119 with value: 0.4485361816812923.
[I 2024-12-03 18:48:27,234] Trial 1620 finished with value: 0.5015847695051749 and parameters: {'kernel': 'rbf', 'C': 97.47005889851323, 'gamma': 0.004934098513715117, 'epsilon': 0.08736997818611095}. Best is trial 1119 with value: 0.4485361816812923.
[I 2024-12-03 18:48:28,012] Trial 1625 finished with value: 0.5414384730604892 and parameters: {'kernel': 'rbf', 'C': 21.854364869522083, 'gamma': 0.007861860948886037, 'epsilon': 0.02010748925168554}. Best is trial 1119 with value: 0.4485361816812923.
[I 2024-12-03 18:48:28,946] Trial 1618 finished with value: 0.7060513806044407 and parameters: {'kernel': 'rbf', 'C': 4.098141795875562, 'gamma': 0.005907001662282547, 'epsilon': 0.08429821554632647}. Best is trial 1119 with value: 0.4485361816812923.
[I 2024-12-03 18:48:29,650] Trial 1631 finished with value: 0.46751339642658346 and parameters: {'kernel': 'rbf', 'C': 21.48363073559962, 'gamma': 0.027246099718315455, 'epsilon': 0.10837017853874396}. Best is trial 1119 with value: 0.4485361816812923.
[I 2024-12-03 18:48:30,011] Trial 1629 finished with value: 1.3110088306086105 and parameters: {'kernel': 'sigmoid', 'C': 0.01035045027163365, 'gamma': 0.1120973686585281, 'epsilon': 0.05144117123948527}. Best is trial 1119 with value: 0.4485361816812923.
[I 2024-12-03 18:48:30,093] Trial 1637 finished with value: 0.7587606130008036 and parameters: {'kernel': 'rbf', 'C': 14.28343025831921, 'gamma': 0.0010475090367085122, 'epsilon': 0.004795580153994623}. Best is trial 1119 with value: 0.4485361816812923.
[I 2024-12-03 18:48:30,455] Trial 1633 finished with value: 0.5474747097125255 and parameters: {'kernel': 'rbf', 'C': 94.34968443378496, 'gamma': 0.03278626051065452, 'epsilon': 0.04829140731217573}. Best is trial 1119 with value: 0.4485361816812923.
[I 2024-12-03 18:48:30,763] Trial 1630 finished with value: 0.454513172316408 and parameters: {'kernel': 'rbf', 'C': 97.7056993983319, 'gamma': 0.010457933464606847, 'epsilon': 0.07632494799482731}. Best is trial 1119 with value: 0.4485361816812923.
[I 2024-12-03 18:48:31,012] Trial 1626 finished with value: 0.5161005667989618 and parameters: {'kernel': 'rbf', 'C': 20.342519942998237, 'gamma': 0.054947398392073056, 'epsilon': 0.05514154578397745}. Best is trial 1119 with value: 0.4485361816812923.
[I 2024-12-03 18:48:31,760] Trial 1635 finished with value: 0.4986274670405953 and parameters: {'kernel': 'rbf', 'C': 16.17583593075396, 'gamma': 0.017232438359532462, 'epsilon': 0.0446778622481782}. Best is trial 1119 with value: 0.4485361816812923.
[I 2024-12-03 18:48:31,834] Trial 1641 finished with value: 0.4946706594987957 and parameters: {'kernel': 'rbf', 'C': 27.20410419948302, 'gamma': 0.012094580833801797, 'epsilon': 0.07187325284446844}. Best is trial 1119 with value: 0.4485361816812923.
[I 2024-12-03 18:48:32,001] Trial 1628 finished with value: 0.5440942852214742 and parameters: {'kernel': 'rbf', 'C': 27.305195923899397, 'gamma': 0.00658044496945975, 'epsilon': 0.17968820152294165}. Best is trial 1119 with value: 0.4485361816812923.
[I 2024-12-03 18:48:32,161] Trial 1632 finished with value: 0.5637494978323461 and parameters: {'kernel': 'rbf', 'C': 21.244028359693313, 'gamma': 0.005193110228523236, 'epsilon': 0.11618134748437701}. Best is trial 1119 with value: 0.4485361816812923.
[I 2024-12-03 18:48:32,165] Trial 1634 finished with value: 0.5654110716560333 and parameters: {'kernel': 'rbf', 'C': 26.11796282243548, 'gamma': 0.0043130810037363965, 'epsilon': 0.09442908999507861}. Best is trial 1119 with value: 0.4485361816812923.
[I 2024-12-03 18:48:32,167] Trial 1636 finished with value: 0.5135463575001571 and parameters: {'kernel': 'rbf', 'C': 96.99628607380254, 'gamma': 0.005176239113896395, 'epsilon': 0.16902948199736195}. Best is trial 1119 with value: 0.4485361816812923.
[I 2024-12-03 18:48:32,195] Trial 1639 finished with value: 1.2352026924542023 and parameters: {'kernel': 'poly', 'C': 0.032615910930882806, 'gamma': 0.0018842186138269621, 'epsilon': 0.9477314729563381}. Best is trial 1119 with value: 0.4485361816812923.
[I 2024-12-03 18:48:32,663] Trial 1638 finished with value: 3.0055245375652957 and parameters: {'kernel': 'sigmoid', 'C': 0.3008905654275641, 'gamma': 0.10978343966441938, 'epsilon': 0.033393578212836665}. Best is trial 1119 with value: 0.4485361816812923.
[I 2024-12-03 18:48:32,665] Trial 1627 finished with value: 1.2262204252923854 and parameters: {'kernel': 'poly', 'C': 1.432070517414392, 'gamma': 0.692764383492655, 'epsilon': 0.845109024878475}. Best is trial 1119 with value: 0.4485361816812923.
[I 2024-12-03 18:48:33,130] Trial 1643 finished with value: 0.5618063594527978 and parameters: {'kernel': 'rbf', 'C': 91.63266827203022, 'gamma': 0.0023847254407814997, 'epsilon': 0.02714824485069693}. Best is trial 1119 with value: 0.4485361816812923.
[I 2024-12-03 18:48:33,270] Trial 1640 finished with value: 1.0585730304598175 and parameters: {'kernel': 'poly', 'C': 28.932493070116234, 'gamma': 0.005253040759919973, 'epsilon': 0.08930377516765615}. Best is trial 1119 with value: 0.4485361816812923.
[I 2024-12-03 18:48:33,509] Trial 1647 finished with value: 1.0878050064925915 and parameters: {'kernel': 'sigmoid', 'C': 12.724907015111956, 'gamma': 0.003310021082509329, 'epsilon': 0.05711452907136137}. Best is trial 1119 with value: 0.4485361816812923.
[I 2024-12-03 18:48:34,532] Trial 1653 finished with value: 0.46840264070464505 and parameters: {'kernel': 'rbf', 'C': 95.95741395145706, 'gamma': 0.00883647477470627, 'epsilon': 0.06760995462034503}. Best is trial 1119 with value: 0.4485361816812923.
[I 2024-12-03 18:48:34,604] Trial 1646 finished with value: 0.759770755666466 and parameters: {'kernel': 'poly', 'C': 95.5497211209186, 'gamma': 0.034680665476658865, 'epsilon': 0.052907610898660466}. Best is trial 1119 with value: 0.4485361816812923.
[I 2024-12-03 18:48:35,245] Trial 1654 finished with value: 0.4593915782403546 and parameters: {'kernel': 'rbf', 'C': 99.80886808584637, 'gamma': 0.014496763171390798, 'epsilon': 0.026266805527278503}. Best is trial 1119 with value: 0.4485361816812923.
[I 2024-12-03 18:48:35,417] Trial 1649 finished with value: 0.4907019412135413 and parameters: {'kernel': 'rbf', 'C': 97.67309584348438, 'gamma': 0.022948677065332816, 'epsilon': 0.08144733659321785}. Best is trial 1119 with value: 0.4485361816812923.
[I 2024-12-03 18:48:35,535] Trial 1648 finished with value: 0.46712275131353154 and parameters: {'kernel': 'rbf', 'C': 24.195008819251488, 'gamma': 0.019505679567357763, 'epsilon': 0.05903549324892369}. Best is trial 1119 with value: 0.4485361816812923.
[I 2024-12-03 18:48:36,127] Trial 1642 finished with value: 0.5103087746385754 and parameters: {'kernel': 'rbf', 'C': 99.98702542988117, 'gamma': 0.026319015156533156, 'epsilon': 0.06729820553382655}. Best is trial 1119 with value: 0.4485361816812923.
[I 2024-12-03 18:48:36,128] Trial 1657 finished with value: 0.5251074229179297 and parameters: {'kernel': 'rbf', 'C': 17.19796815642679, 'gamma': 0.048847439044701305, 'epsilon': 0.2440928610344344}. Best is trial 1119 with value: 0.4485361816812923.
[I 2024-12-03 18:48:36,629] Trial 1644 finished with value: 0.5386424070833341 and parameters: {'kernel': 'rbf', 'C': 98.64916491081424, 'gamma': 0.0035536599202938817, 'epsilon': 0.1557635379259489}. Best is trial 1119 with value: 0.4485361816812923.
[I 2024-12-03 18:48:37,030] Trial 1645 finished with value: 0.4666399741110965 and parameters: {'kernel': 'rbf', 'C': 24.61695129090361, 'gamma': 0.02032302933415837, 'epsilon': 0.027957418567097228}. Best is trial 1119 with value: 0.4485361816812923.
[I 2024-12-03 18:48:37,791] Trial 1655 finished with value: 0.5504764395332855 and parameters: {'kernel': 'rbf', 'C': 92.20228657198068, 'gamma': 0.02997370656367179, 'epsilon': 0.19817831841032077}. Best is trial 1119 with value: 0.4485361816812923.
[I 2024-12-03 18:48:38,499] Trial 1650 finished with value: 0.5866235335351284 and parameters: {'kernel': 'rbf', 'C': 25.455012992281226, 'gamma': 0.07711537534089387, 'epsilon': 0.02952197502933568}. Best is trial 1119 with value: 0.4485361816812923.
[I 2024-12-03 18:48:40,215] Trial 1651 finished with value: 0.4635146816548598 and parameters: {'kernel': 'rbf', 'C': 23.749346984074716, 'gamma': 0.021104343348467183, 'epsilon': 0.11730835403223593}. Best is trial 1119 with value: 0.4485361816812923.
[I 2024-12-03 18:48:40,303] Trial 1665 finished with value: 0.5375520191176594 and parameters: {'kernel': 'rbf', 'C': 98.11247167796516, 'gamma': 0.003164129959719963, 'epsilon': 0.04590429131225877}. Best is trial 1119 with value: 0.4485361816812923.
[I 2024-12-03 18:48:40,336] Trial 1666 finished with value: 0.6033344542193126 and parameters: {'kernel': 'rbf', 'C': 22.352925842704455, 'gamma': 0.002686651375478785, 'epsilon': 0.04190636222090288}. Best is trial 1119 with value: 0.4485361816812923.
[I 2024-12-03 18:48:40,452] Trial 1662 finished with value: 0.54624559345199 and parameters: {'kernel': 'rbf', 'C': 20.091649405966088, 'gamma': 0.007788407599084644, 'epsilon': 0.018900205070368235}. Best is trial 1119 with value: 0.4485361816812923.
[I 2024-12-03 18:48:40,728] Trial 1669 finished with value: 0.5652861751875418 and parameters: {'kernel': 'rbf', 'C': 5.306401546032798, 'gamma': 0.014226840573299782, 'epsilon': 0.270602503586826}. Best is trial 1119 with value: 0.4485361816812923.
[I 2024-12-03 18:48:40,869] Trial 1658 finished with value: 1.3730986033664496 and parameters: {'kernel': 'poly', 'C': 0.0037312597461231015, 'gamma': 0.0014327089649983037, 'epsilon': 0.08778022860718213}. Best is trial 1119 with value: 0.4485361816812923.
[I 2024-12-03 18:48:41,410] Trial 1659 finished with value: 0.5660140655146166 and parameters: {'kernel': 'rbf', 'C': 97.05860896682593, 'gamma': 0.0372821384422867, 'epsilon': 0.10180453767478084}. Best is trial 1119 with value: 0.4485361816812923.
[I 2024-12-03 18:48:41,559] Trial 1668 finished with value: 0.49365933672671297 and parameters: {'kernel': 'rbf', 'C': 28.175070058280394, 'gamma': 0.012437488506411385, 'epsilon': 0.1684069373251517}. Best is trial 1119 with value: 0.4485361816812923.
[I 2024-12-03 18:48:41,662] Trial 1675 finished with value: 0.5627728961566546 and parameters: {'kernel': 'linear', 'C': 4.840870347397737, 'gamma': 0.0011185790782355235, 'epsilon': 0.004328413303662655}. Best is trial 1119 with value: 0.4485361816812923.
[I 2024-12-03 18:48:41,784] Trial 1652 finished with value: 0.7570160750817039 and parameters: {'kernel': 'linear', 'C': 0.012393119382200106, 'gamma': 0.030212958115733535, 'epsilon': 0.6363601265373822}. Best is trial 1119 with value: 0.4485361816812923.
[I 2024-12-03 18:48:42,047] Trial 1656 finished with value: 0.5416516560260237 and parameters: {'kernel': 'rbf', 'C': 98.36189521360417, 'gamma': 0.00306564956699886, 'epsilon': 0.024857102045094667}. Best is trial 1119 with value: 0.4485361816812923.
[I 2024-12-03 18:48:42,142] Trial 1660 finished with value: 0.5740950445275053 and parameters: {'kernel': 'linear', 'C': 83.93876559178348, 'gamma': 0.026951327007893707, 'epsilon': 0.08202625785907829}. Best is trial 1119 with value: 0.4485361816812923.
[I 2024-12-03 18:48:42,799] Trial 1664 finished with value: 0.4587716090041026 and parameters: {'kernel': 'rbf', 'C': 94.95443219917283, 'gamma': 0.010298670609499903, 'epsilon': 0.06442470050625382}. Best is trial 1119 with value: 0.4485361816812923.
[I 2024-12-03 18:48:42,892] Trial 1671 finished with value: 0.474087716104235 and parameters: {'kernel': 'rbf', 'C': 23.13046730584775, 'gamma': 0.01860449017871603, 'epsilon': 0.020998036671782336}. Best is trial 1119 with value: 0.4485361816812923.
[I 2024-12-03 18:48:43,118] Trial 1676 finished with value: 0.46749141287398016 and parameters: {'kernel': 'rbf', 'C': 24.447213228732153, 'gamma': 0.02347101828741492, 'epsilon': 0.018327183112881288}. Best is trial 1119 with value: 0.4485361816812923.
[I 2024-12-03 18:48:43,481] Trial 1672 finished with value: 0.6061679786814168 and parameters: {'kernel': 'rbf', 'C': 20.87510174740615, 'gamma': 0.17191489292613354, 'epsilon': 0.0841829794896487}. Best is trial 1119 with value: 0.4485361816812923.
[I 2024-12-03 18:48:43,633] Trial 1673 finished with value: 0.563328956463703 and parameters: {'kernel': 'linear', 'C': 4.5785333948351346, 'gamma': 0.004733999831918117, 'epsilon': 0.030942928241320507}. Best is trial 1119 with value: 0.4485361816812923.
[I 2024-12-03 18:48:43,720] Trial 1661 finished with value: 0.5907071471674936 and parameters: {'kernel': 'rbf', 'C': 20.581810475838893, 'gamma': 0.0033125568524160305, 'epsilon': 0.058001567156158416}. Best is trial 1119 with value: 0.4485361816812923.
[I 2024-12-03 18:48:43,798] Trial 1663 finished with value: 0.4692662481584199 and parameters: {'kernel': 'rbf', 'C': 95.35772927227912, 'gamma': 0.021420261751898043, 'epsilon': 0.05767577778435244}. Best is trial 1119 with value: 0.4485361816812923.
[I 2024-12-03 18:48:43,801] Trial 1667 finished with value: 0.5488535604885314 and parameters: {'kernel': 'rbf', 'C': 3.83320656213321, 'gamma': 0.029422307166836487, 'epsilon': 0.18069182071812914}. Best is trial 1119 with value: 0.4485361816812923.
[I 2024-12-03 18:48:43,958] Trial 1678 finished with value: 0.5511155146935308 and parameters: {'kernel': 'rbf', 'C': 93.33318079147487, 'gamma': 0.00506436788251277, 'epsilon': 0.23281426960715038}. Best is trial 1119 with value: 0.4485361816812923.
[I 2024-12-03 18:48:44,241] Trial 1670 finished with value: 0.49070842369912954 and parameters: {'kernel': 'rbf', 'C': 99.26804942026506, 'gamma': 0.021314995710287395, 'epsilon': 0.09801286919019948}. Best is trial 1119 with value: 0.4485361816812923.
[I 2024-12-03 18:48:44,873] Trial 1677 finished with value: 0.5531842116910897 and parameters: {'kernel': 'rbf', 'C': 89.8530131775612, 'gamma': 0.02701829010779655, 'epsilon': 0.42797427760914064}. Best is trial 1119 with value: 0.4485361816812923.
[I 2024-12-03 18:48:45,291] Trial 1680 finished with value: 0.5428621795811814 and parameters: {'kernel': 'rbf', 'C': 21.652215925026812, 'gamma': 0.006901529122822299, 'epsilon': 0.08706964160774988}. Best is trial 1119 with value: 0.4485361816812923.
[I 2024-12-03 18:48:45,976] Trial 1684 finished with value: 0.8110074506752433 and parameters: {'kernel': 'linear', 'C': 0.004737804543663189, 'gamma': 0.007422947612606207, 'epsilon': 0.13384491940305376}. Best is trial 1119 with value: 0.4485361816812923.
[I 2024-12-03 18:48:46,471] Trial 1683 finished with value: 0.4906268773308389 and parameters: {'kernel': 'rbf', 'C': 31.696380700590723, 'gamma': 0.011534496804639522, 'epsilon': 0.05281714995911251}. Best is trial 1119 with value: 0.4485361816812923.
[I 2024-12-03 18:48:46,551] Trial 1674 finished with value: 0.5484522193171116 and parameters: {'kernel': 'rbf', 'C': 21.54264599763872, 'gamma': 0.06493966703262916, 'epsilon': 0.06856407162755965}. Best is trial 1119 with value: 0.4485361816812923.
[I 2024-12-03 18:48:47,076] Trial 1687 finished with value: 0.5039157550453858 and parameters: {'kernel': 'rbf', 'C': 94.78222583688998, 'gamma': 0.021083546950599955, 'epsilon': 0.12388852194066503}. Best is trial 1119 with value: 0.4485361816812923.
[I 2024-12-03 18:48:47,593] Trial 1685 finished with value: 3.448101933311441 and parameters: {'kernel': 'sigmoid', 'C': 3.869136839154171, 'gamma': 0.009121525831584827, 'epsilon': 0.014086386985362243}. Best is trial 1119 with value: 0.4485361816812923.
[I 2024-12-03 18:48:47,716] Trial 1681 finished with value: 635.197385425453 and parameters: {'kernel': 'sigmoid', 'C': 93.80208702433733, 'gamma': 0.06349160088280727, 'epsilon': 0.015130838967850615}. Best is trial 1119 with value: 0.4485361816812923.
[I 2024-12-03 18:48:48,310] Trial 1690 finished with value: 0.6079533335583127 and parameters: {'kernel': 'linear', 'C': 19.804373148685443, 'gamma': 0.00837281416182973, 'epsilon': 0.23653291821673822}. Best is trial 1119 with value: 0.4485361816812923.
[I 2024-12-03 18:48:48,557] Trial 1679 finished with value: 0.47331698770071107 and parameters: {'kernel': 'rbf', 'C': 95.10755949795083, 'gamma': 0.02159677176891009, 'epsilon': 0.02868562209714702}. Best is trial 1119 with value: 0.4485361816812923.
[I 2024-12-03 18:48:49,014] Trial 1686 finished with value: 0.4641588673441502 and parameters: {'kernel': 'rbf', 'C': 94.70502095141563, 'gamma': 0.010088861724951853, 'epsilon': 0.04283837262492428}. Best is trial 1119 with value: 0.4485361816812923.
[I 2024-12-03 18:48:49,443] Trial 1697 finished with value: 0.5547070613911631 and parameters: {'kernel': 'rbf', 'C': 20.113072781204124, 'gamma': 0.0063841922864925835, 'epsilon': 0.039543577273504264}. Best is trial 1119 with value: 0.4485361816812923.
[I 2024-12-03 18:48:49,445] Trial 1692 finished with value: 0.534175089193525 and parameters: {'kernel': 'rbf', 'C': 99.03373105075974, 'gamma': 0.02868571644648789, 'epsilon': 0.08564820393242521}. Best is trial 1119 with value: 0.4485361816812923.
[I 2024-12-03 18:48:50,459] Trial 1695 finished with value: 0.5351720845865026 and parameters: {'kernel': 'rbf', 'C': 95.74056291597405, 'gamma': 0.00358475199728612, 'epsilon': 0.11695631227822065}. Best is trial 1119 with value: 0.4485361816812923.
[I 2024-12-03 18:48:50,600] Trial 1691 finished with value: 0.5544660908147495 and parameters: {'kernel': 'rbf', 'C': 97.69808369318787, 'gamma': 0.002556347317892321, 'epsilon': 0.06554541588125555}. Best is trial 1119 with value: 0.4485361816812923.
[I 2024-12-03 18:48:50,601] Trial 1694 finished with value: 0.4631867913207104 and parameters: {'kernel': 'rbf', 'C': 96.08974407100776, 'gamma': 0.016174168742254393, 'epsilon': 0.01654817418653988}. Best is trial 1119 with value: 0.4485361816812923.
[I 2024-12-03 18:48:50,901] Trial 1682 finished with value: 0.6323888132207218 and parameters: {'kernel': 'rbf', 'C': 11.56348619822287, 'gamma': 0.003502929487092393, 'epsilon': 0.24387033320326384}. Best is trial 1119 with value: 0.4485361816812923.
[I 2024-12-03 18:48:51,351] Trial 1688 finished with value: 0.4794176704058499 and parameters: {'kernel': 'rbf', 'C': 95.08539107198997, 'gamma': 0.007592667617930604, 'epsilon': 0.10517513136532886}. Best is trial 1119 with value: 0.4485361816812923.
[I 2024-12-03 18:48:51,777] Trial 1705 finished with value: 0.46345333671006106 and parameters: {'kernel': 'rbf', 'C': 23.791182598124085, 'gamma': 0.026507305414642673, 'epsilon': 0.05151198973076778}. Best is trial 1119 with value: 0.4485361816812923.
[I 2024-12-03 18:48:51,778] Trial 1693 finished with value: 0.5194634084206831 and parameters: {'kernel': 'rbf', 'C': 87.31973094183988, 'gamma': 0.004026156631608205, 'epsilon': 0.07880804284915675}. Best is trial 1119 with value: 0.4485361816812923.
[I 2024-12-03 18:48:51,961] Trial 1701 finished with value: 0.4730192491930319 and parameters: {'kernel': 'rbf', 'C': 18.81227336934579, 'gamma': 0.02601418193953693, 'epsilon': 0.09188706089987601}. Best is trial 1119 with value: 0.4485361816812923.
[I 2024-12-03 18:48:52,020] Trial 1700 finished with value: 0.6448821711490921 and parameters: {'kernel': 'rbf', 'C': 4.895585257666276, 'gamma': 0.008365176073292365, 'epsilon': 0.049295461549386396}. Best is trial 1119 with value: 0.4485361816812923.
[I 2024-12-03 18:48:52,241] Trial 1703 finished with value: 0.539258383722007 and parameters: {'kernel': 'rbf', 'C': 20.488708706177967, 'gamma': 0.007871694620835163, 'epsilon': 0.035944981760978024}. Best is trial 1119 with value: 0.4485361816812923.
[I 2024-12-03 18:48:52,255] Trial 1689 finished with value: 0.5986728572518653 and parameters: {'kernel': 'rbf', 'C': 29.530569844111092, 'gamma': 0.07766085884614206, 'epsilon': 0.17349668470897173}. Best is trial 1119 with value: 0.4485361816812923.
[I 2024-12-03 18:48:53,138] Trial 1708 finished with value: 0.6201045287672414 and parameters: {'kernel': 'rbf', 'C': 91.4210163098873, 'gamma': 0.05005501812814124, 'epsilon': 0.020990573541802976}. Best is trial 1119 with value: 0.4485361816812923.
